name,main_category,sub_category,image,link,ratings,no_of_ratings,discount_price,actual_price
"QUXIS Portable High Pressure Foot Air Pump Heavy Compressor Cylinder with Pressure Gauge Floor Pump for Motorbike, for Car...",sports & fitness,Cycling,https://m.media-amazon.com/images/W/IMAGERENDERING_521856-T1/images/I/61sHYhGL3pL._AC_UL320_.jpg,https://www.amazon.in/QUXIS-Portable-Activated-Pressure-Gauge/dp/B098DYLKP1/ref=sr_1_1?qid=1679216992&s=sports&sr=1-1,4.0,"7,635",₹499,"₹1,299"
"Boldfit Gym Shaker for Protein Shake Leakproof Shaker Bottles for Protein, Preworkout and Bcaa Shake, Protein Shaker Bottl...",sports & fitness,Cycling,https://m.media-amazon.com/images/W/IMAGERENDERING_521856-T1/images/I/51NKPZx0a6L._AC_UL320_.jpg,https://www.amazon.in/Boldfit-Typhoon-Shaker-Leakproof-Preworkout/dp/B08JTMZRJW/ref=sr_1_2?qid=1679216992&s=sports&sr=1-2,4.1,"8,052",,₹229
Techista 2-in-1 Rechargeable - Cycle Light (3 Modes) Cycle Light and Horn/Cycle Lights Rechargeable Waterproof (140 dB) Cy...,sports & fitness,Cycling,https://m.media-amazon.com/images/W/IMAGERENDERING_521856-T1/images/I/61AkAm4EAML._AC_UL320_.jpg,https://www.amazon.in/Techista-2-1-Rechargeable-Waterproof/dp/B09KH81K1W/ref=sr_1_3?qid=1679216992&s=sports&sr=1-3,4.1,"2,214",₹339,₹999
"Nivia Plain Encounter Stockings (L, Black) - Polyester Blend, Unisex,Knee Length, Pack of 1 Pair",sports & fitness,Cycling,https://m.media-amazon.com/images/W/IMAGERENDERING_521856-T1/images/I/71z7s3J9qVL._AC_UL320_.jpg,https://www.amazon.in/Nivia-728LBW-Encounter-Blend-Stockings/dp/B079SCPN7W/ref=sr_1_4?qid=1679216992&s=sports&sr=1-4,4.1,"2,974",₹145,₹149
"Eazo Steel Multipurpose Air Pump with needle (use for Car,Bicycles,Scooters,Balls,Bikes etc)",sports & fitness,Cycling,https://m.media-amazon.com/images/W/IMAGERENDERING_521856-T1/images/I/616qy5Stc5L._AC_UL320_.jpg,https://www.amazon.in/EAZO-Steel-Multipurpose-Bicycles-Scooters/dp/B092SG8KM8/ref=sr_1_5?qid=1679216992&s=sports&sr=1-5,4.1,"3,678",₹369,₹450
Gadget Deals Combo of Rechargeable Head Cycle Light and Cycle Tail Light Cycle Light led for Bicycle,sports & fitness,Cycling,https://m.media-amazon.com/images/W/IMAGERENDERING_521856-T1/images/I/51uY2GdkWVL._AC_UL320_.jpg,https://www.amazon.in/Gadget-Deals-Combo-Rechargeable-Bicycle/dp/B08PP8XMFN/ref=sr_1_6?qid=1679216992&s=sports&sr=1-6,3.8,"1,444",₹279,"₹1,199"
"Lista Rechargeable Bike Horn and Light 140 DB with Super Bright 250 Lumen Light 3 Modes, Plastic",sports & fitness,Cycling,https://m.media-amazon.com/images/W/IMAGERENDERING_521856-T1/images/I/618BL2J+3xL._AC_UL320_.jpg,https://www.amazon.in/Lista-Lista056-Rechargeable-Light-Bright/dp/B075GYJSPT/ref=sr_1_7?qid=1679216992&s=sports&sr=1-7,3.9,"8,334",₹339,₹599
"PURSUE FASHION Premium Cotton Ankle Socks for Men and Women - Free Size, Solid Unisex Ankle Length Socks, Pack of 5 (Multi...",sports & fitness,Cycling,https://m.media-amazon.com/images/W/IMAGERENDERING_521856-T1/images/I/71gqkgPxczL._AC_UL320_.jpg,https://www.amazon.in/PURSUE-FASHION-Womens-Ankle-Socks/dp/B0BBG1SWK5/ref=sr_1_8?qid=1679216992&s=sports&sr=1-8,3.9,66,₹289,₹699
"Strauss Bicycle Computer Odometer Speedometer Wired Cyclocomputer, ()",sports & fitness,Cycling,https://m.media-amazon.com/images/W/IMAGERENDERING_521856-T1/images/I/611QYlzagoL._AC_UL320_.jpg,https://www.amazon.in/Strauss-Bicycle-Speedometer-Black-Red/dp/B09BQ834ZZ/ref=sr_1_9?qid=1679216992&s=sports&sr=1-9,3.7,566,₹287,₹849
Lista Lista002 Bicycle Silicone Saddle Seat and Cycling Cushion Pad Bike Gel Cover,sports & fitness,Cycling,https://m.media-amazon.com/images/W/IMAGERENDERING_521856-T1/images/I/51gqOgzMwJS._AC_UL320_.jpg,https://www.amazon.in/Quality-Bicycle-Silicone-Cycling-Cushion/dp/B00RV3CLVU/ref=sr_1_10?qid=1679216992&s=sports&sr=1-10,3.6,"6,580",₹205,₹999
"Strauss Bicycle Flash Tail Light with Laser, (Black)",sports & fitness,Cycling,https://m.media-amazon.com/images/W/IMAGERENDERING_521856-T1/images/I/61j2cEs+tPL._AC_UL320_.jpg,https://www.amazon.in/Strauss-Bicycle-Flash-Light-Laser/dp/B07GKZZYNT/ref=sr_1_11?qid=1679216992&s=sports&sr=1-11,3.7,"5,117",₹179.50,₹499
"Boldfit Gym Headband for Men and Women - Sports Headband for Workout & Running, Breathable, Non-Slip & Quick Drying Head B...",sports & fitness,Cycling,https://m.media-amazon.com/images/W/IMAGERENDERING_521856-T1/images/I/71nBw7m1daL._AC_UL320_.jpg,https://www.amazon.in/Boldfit-Gym-Headband-Women-HeadBandBlack/dp/B09B2BRGPQ/ref=sr_1_12?qid=1679216992&s=sports&sr=1-12,4.0,"1,601",₹149,₹599
"DOVEAZ® Sports Water Bottle for Gym, Protein Shaker Bottle, Gallon Water Bottle (1.5 LTR) with Mixer Ball and Strainer (BP...",sports & fitness,Cycling,https://m.media-amazon.com/images/W/IMAGERENDERING_521856-T1/images/I/61t+KbxoCWL._AC_UL320_.jpg,https://www.amazon.in/Sports-Unbreakable-Freezer-Gallon-Strainer/dp/B07YDZGM9S/ref=sr_1_13?qid=1679216992&s=sports&sr=1-13,4.4,"2,759",₹229,₹599
"Leader Scout MTB 26T Mountain Bicycle/Bike Without Gear Single Speed for Men - Sea Green, Ideal for 10 + Years, Frame Siz...",sports & fitness,Cycling,https://m.media-amazon.com/images/W/IMAGERENDERING_521856-T1/images/I/81wGn2TQJeL._AC_UL320_.jpg,https://www.amazon.in/Leader-Scout-26T-SEA-Green_Black-Rider/dp/B089M9HVQP/ref=sr_1_14?qid=1679216992&s=sports&sr=1-14,4.1,"3,457","₹4,499","₹7,500"
AmazonBasics ABS Horn Bell for Bicycles,sports & fitness,Cycling,https://m.media-amazon.com/images/W/IMAGERENDERING_521856-T1/images/I/61IbZJshbAL._AC_UL320_.jpg,https://www.amazon.in/AmazonBasics-abcancytoac0002-Cycle-Bell/dp/B08Z912H9D/ref=sr_1_15?qid=1679216992&s=sports&sr=1-15,4.0,46,₹75,"₹9,999"
"Luusa TFT-1 Tricycle Plug N Play Kids / Baby Tricycle with Parental Control, Cushion seat and Safety Guard Rail for Boys /...",sports & fitness,Cycling,https://m.media-amazon.com/images/W/IMAGERENDERING_521856-T1/images/I/61Zukf2XVdL._AC_UL320_.jpg,https://www.amazon.in/Tricycle-Parental-Control-Carrying-Capacity/dp/B09T2VMD1L/ref=sr_1_16?qid=1679216992&s=sports&sr=1-16,4.0,632,"₹2,649","₹4,595"
"Luusa TFT RX-500 Plug N Play Kids/Baby Tricycle With Parental Control, Cushion Seat And Seat Belt For 12 Months To 48 Mont...",sports & fitness,Cycling,https://m.media-amazon.com/images/W/IMAGERENDERING_521856-T1/images/I/514ua3R3pqL._AC_UL320_.jpg,https://www.amazon.in/Luusa-RX-500-Tricycle-Parental-Control/dp/B07STNCVMQ/ref=sr_1_17?qid=1679216992&s=sports&sr=1-17,4.1,"12,842","₹2,349","₹3,699"
SignoraWare Charger Stainless Steel Protein Shaker Bottle for Pre-Post Workout | Water Bottle | Leakproof with Knob (750ml...,sports & fitness,Cycling,https://m.media-amazon.com/images/W/IMAGERENDERING_521856-T1/images/I/51oBoS87qiL._AC_UL320_.jpg,https://www.amazon.in/Signoraware-Charger-Shaker-Steel-Silver/dp/B08437DZDP/ref=sr_1_18?qid=1679216992&s=sports&sr=1-18,4.3,"6,596",₹544,₹649
Strauss Bicycle Bottle Holder (Black),sports & fitness,Cycling,https://m.media-amazon.com/images/W/IMAGERENDERING_521856-T1/images/I/616l6Bbph7L._AC_UL320_.jpg,https://www.amazon.in/Strauss-ST-1347-Plastic-Bicycle-Bottle/dp/B07DHJQ2S1/ref=sr_1_19?qid=1679216992&s=sports&sr=1-19,3.7,"2,507",₹199,₹399
Gadget Deals 2-in-1 Rechargeable Cycle Light and Horn with Cycle Tail Light LED Cycle Light for Bicycle Front Rear Light C...,sports & fitness,Cycling,https://m.media-amazon.com/images/W/IMAGERENDERING_521856-T1/images/I/31jV0+jgN3S._AC_UL320_.jpg,https://www.amazon.in/Gadget-Rechargeable-Bicycle-Light-Multicolor/dp/B085XJ3QCL/ref=sr_1_20?qid=1679216992&s=sports&sr=1-20,3.9,708,₹399,"₹1,199"
"SKULLFIT Sports Headbands for Men (Black) - Lightweight Moisture Wicking Workout Sweatbands for Running, Gym, Yoga, Cyclin...",sports & fitness,Cycling,https://m.media-amazon.com/images/W/IMAGERENDERING_521856-T1/images/I/61-n+ddVIHL._AC_UL320_.jpg,https://www.amazon.in/SKULLFIT-Sports-Headbands-Men-Black/dp/B08QGP3JVV/ref=sr_1_21?qid=1679216992&s=sports&sr=1-21,4.0,"1,022",₹298,"₹1,999"
"Nivia 728MYB Football Stocking, Medium (Yellow)",sports & fitness,Cycling,https://m.media-amazon.com/images/W/IMAGERENDERING_521856-T1/images/I/61nsa2dtQOL._AC_UL320_.jpg,https://www.amazon.in/Nivia-728LNW-Encounter-Blend-Stockings/dp/B079SCMLG6/ref=sr_1_22?qid=1679216992&s=sports&sr=1-22,4.1,"1,062",,₹105
"GELRIDE Advanced Gel Bicycle Saddle Seat Cushion Cover for Indoor Outdoor Cycling, Exercise Cycle - Soft and Washable, 10...",sports & fitness,Cycling,https://m.media-amazon.com/images/W/IMAGERENDERING_521856-T1/images/I/7175PdysvzL._AC_UL320_.jpg,https://www.amazon.in/GELRIDE-Advanced-Bicycle-Cushion-Exercise/dp/B09TQLLK47/ref=sr_1_23?qid=1679216992&s=sports&sr=1-23,4.3,768,₹849,"₹1,390"
GADGET DEALS Durable Quality Cycle Bell for Bicycle Ultra-Loud Cycle Horn Trending Kids Cycle Bell,sports & fitness,Cycling,https://m.media-amazon.com/images/W/IMAGERENDERING_521856-T1/images/I/515g7LbvP9L._AC_UL320_.jpg,https://www.amazon.in/Durable-Quality-Bicycle-Ultra-Loud-Trending/dp/B09RPRB634/ref=sr_1_24?qid=1679216992&s=sports&sr=1-24,4.0,487,₹179,₹499
NIVIA Encounter Stockings-Large,sports & fitness,Cycling,https://m.media-amazon.com/images/I/61v7q9uBOGL._AC_UL320_.jpg,https://www.amazon.in/Nivia-Encounter-Stockings-Royal-Blue/dp/B079S6HJMY/ref=sr_1_73?qid=1679216994&s=sports&sr=1-73,3.8,268,,₹105
"Amazon Brand - Symactive Sprinter S2000 Series, 26T Geared Mountain Bike (Shimano 21-Speed Gear), Front Suspension, Dual D...",sports & fitness,Cycling,https://m.media-amazon.com/images/I/81HTjWJxTUL._AC_UL320_.jpg,https://www.amazon.in/Amazon-Brand-Symactive-Sprinter-Suspension/dp/B0BCFH2N8X/ref=sr_1_74?qid=1679216994&s=sports&sr=1-74,3.6,81,"₹8,299","₹32,000"
"Leader Kids Children, Boys, Girls 20T Road Bike , 20 Inches Steel Frame , Single Speed Cycle for 7-10 Years , Sea Green & ...",sports & fitness,Cycling,https://m.media-amazon.com/images/I/81522BnOL3L._AC_UL320_.jpg,https://www.amazon.in/Leader-Murphy-Green-Light-Colour/dp/B087C3NKSX/ref=sr_1_75?qid=1679216994&s=sports&sr=1-75,3.8,447,"₹3,999","₹5,900"
AmazonBasics Multipurpose Cycle Tool Kit with Bottle Holder,sports & fitness,Cycling,https://m.media-amazon.com/images/I/81yrhJRvYpL._AC_UL320_.jpg,https://www.amazon.in/AmazonBasics-Multipurpose-Cycle-Bottle-Holder/dp/B086DXBNCD/ref=sr_1_76?qid=1679216994&s=sports&sr=1-76,4.0,169,₹376,"₹1,500"
N2S NEXT2SKIN Women's Low Ankle Length Sneaker Cotton Thumb Socks (Pack of 3) (Assorted),sports & fitness,Cycling,https://m.media-amazon.com/images/I/61GF1NzJEiL._AC_UL320_.jpg,https://www.amazon.in/N2S-NEXT2SKIN-Womens-Length-Cotton/dp/B07PXS6V8R/ref=sr_1_77_mod_primary_new?qid=1679216994&s=sports&sbo=RZvfv%2F%2FHxDF%2BO5021pAnSA%3D%3D&sr=1-77,4.0,424,₹313,₹330
JoyRide Stylish Sports Plus Trike Push & Plug Baby Trike| Tricycle with Dual Storage Basket for Kids| Boys| Girls Age Grou...,sports & fitness,Cycling,https://m.media-amazon.com/images/I/51yWOJ6My6L._AC_UL320_.jpg,https://www.amazon.in/JoyRide-Stylish-Sports-Tricycle-Storage/dp/B09YYJN9NX/ref=sr_1_78?qid=1679216994&s=sports&sr=1-78,3.8,416,"₹1,652","₹2,899"
UZARUS Womens Dry Fit Workout Top Sports Gym T-Shirt,sports & fitness,Cycling,https://m.media-amazon.com/images/I/615seF3thLL._AC_UL320_.jpg,https://www.amazon.in/UZARUS-Womens-Workout-Sports-T-Shirt/dp/B09ZFD5PWZ/ref=sr_1_79?qid=1679216994&s=sports&sr=1-79,3.7,485,₹349,"₹1,499"
Leader Spyder 27.5T MTB Cycle/Bike Single Speed with Complete Accessories for Men - Matt Black/Orange Ideal for 15+ Years...,sports & fitness,Cycling,https://m.media-amazon.com/images/I/81y9uUq1lnL._AC_UL320_.jpg,https://www.amazon.in/Leader-Spyder-27-5T-MTB-Cycle/dp/B0BSS17P4R/ref=sr_1_80?qid=1679216994&s=sports&sr=1-80,5.0,1,"₹4,999","₹11,999"
"Proberos® Hi-Tech Performance Athletic Socks for Men Women, Rubber Anti-Slip and Thicken Cushion Sport Socks Ankle Length ...",sports & fitness,Cycling,https://m.media-amazon.com/images/I/61ODfHdGVmL._AC_UL320_.jpg,https://www.amazon.in/Proberos%C2%AE-Performance-Athletic-Anti-Slip-Badminton/dp/B0BHP7LYDK/ref=sr_1_81?qid=1679216994&s=sports&sr=1-81,4.4,23,₹395,₹719
"Lifelong Conqueror Freeride Shimano Gear Cycle,27.5T Steel MTB Unisex Cycle with 21 Speed|Dual Disc Brake|Frame Size: 18""|...",sports & fitness,Cycling,https://m.media-amazon.com/images/I/81VZgPyUj4L._AC_UL320_.jpg,https://www.amazon.in/Lifelong-Freeride-Suspension-Shimano-IConqueror/dp/B09XF4BPYJ/ref=sr_1_82?qid=1679216994&s=sports&sr=1-82,4.2,"1,145","₹10,499","₹19,499"
"R for Rabbit Tiny Toes T10 Ace with EVA Wheels Kids/Baby Tricycle, Cycle for Kids, Tricycle for Kids for 1.5 to 5 Years Ba...",sports & fitness,Cycling,https://m.media-amazon.com/images/I/618X2T7iiRL._AC_UL320_.jpg,https://www.amazon.in/Rabbit-Wheels-Tricycle-Storage-Basket/dp/B0BBS2HYCL/ref=sr_1_83?qid=1679216994&s=sports&sr=1-83,3.5,300,"₹1,869","₹2,493"
MICHELIN 12206 Analogue Double Barrel Foot Pump with Rubber Feet (Black),sports & fitness,Cycling,https://m.media-amazon.com/images/I/51mDMyokaCL._AC_UL320_.jpg,https://www.amazon.in/Michelin-12206-Analogue-Double-Barrel/dp/B00IOQ1LR8/ref=sr_1_84?qid=1679216994&s=sports&sr=1-84,4.3,"2,589","₹2,095","₹3,835"
"Nivia Plain Encounter Stockings (M, Blue) - Polyester Blend, Unisex, Knee Length, Pack of 1 Pair",sports & fitness,Cycling,https://m.media-amazon.com/images/I/61nsa2dtQOL._AC_UL320_.jpg,https://www.amazon.in/Nivia-728MNW-Encounter-Stockings-Medium/dp/B079SF1Z4W/ref=sr_1_85?qid=1679216994&s=sports&sr=1-85,4.1,252,,₹145
Enamor Women's Shorts (Black),sports & fitness,Cycling,https://m.media-amazon.com/images/I/510kGmNNsmL._AC_UL320_.jpg,https://www.amazon.in/Enamor-E032-BLK-Womens-Bottom-E032-BLK_Black_M/dp/B0785HRSBF/ref=sr_1_86?qid=1679216994&s=sports&sr=1-86,4.2,"1,270",₹284,₹299
Lifelong Adjustable Cycling Helmet with Detachable Visor|Adjustable Light Weight Mountain Bike Cycle Helmet with Padding f...,sports & fitness,Cycling,https://m.media-amazon.com/images/I/71q10atG9VL._AC_UL320_.jpg,https://www.amazon.in/Lifelong-Adjustable-Detachable-Mountain-LLFAH05/dp/B0BJVPY5G3/ref=sr_1_87?qid=1679216994&s=sports&sr=1-87,4.1,78,₹799,"₹1,999"
RKPM Multi-Purpose Mountain Bike Bicycle Repair Tool Kit Allen Key Spoke Wrench 16 IN 1,sports & fitness,Cycling,https://m.media-amazon.com/images/I/51v779pmsOL._AC_UL320_.jpg,https://www.amazon.in/RKPM-Multi-Purpose-Mountain-Bicycle-Repair/dp/B07MY5GF6L/ref=sr_1_88?qid=1679216994&s=sports&sr=1-88,3.9,144,₹195,₹899
FUNEX Moisture Wicking and Non-Slip Exercise Workout Cotton Headband for Men and Women (Color Black & Blue | Pack of 2),sports & fitness,Cycling,https://m.media-amazon.com/images/I/61S5DOjDJDL._AC_UL320_.jpg,https://www.amazon.in/FUNEX-Moisture-Non-Slip-Exercise-Headband/dp/B09NM9V6WL/ref=sr_1_89?qid=1679216994&s=sports&sr=1-89,2.7,13,₹195,₹275
"Amazon Brand - Symactive Water Resistant Polyester Cycle Body Cover, Black",sports & fitness,Cycling,https://m.media-amazon.com/images/I/71yDmJ7hXhS._AC_UL320_.jpg,https://www.amazon.in/Amazon-Brand-Symactive-Resistant-Polyester/dp/B08VX67ZSM/ref=sr_1_90?qid=1679216994&s=sports&sr=1-90,3.9,65,₹359,₹629
AFPIN Cycle 15 in 1 Cycle Tool kit Multi-Purpose Wrench Mountain Cycle Repair Tool kit Allen Key Spoke Cycle Tool kit Set ...,sports & fitness,Cycling,https://m.media-amazon.com/images/I/512cx762zHL._AC_UL320_.jpg,https://www.amazon.in/AFPIN-Multi-Purpose-Wrench-Mountain-Repair/dp/B08WX2C92K/ref=sr_1_91?qid=1679216994&s=sports&sr=1-91,3.6,287,₹189,₹799
Jockey Women's Tailored Fit Thermal Top,sports & fitness,Cycling,https://m.media-amazon.com/images/I/81zj09l9HAL._AC_UL320_.jpg,https://www.amazon.in/Jockey-Womens-Thermal-2503-0105-CHAML_Charcoal-Melange_Medium/dp/B014SQJENK/ref=sr_1_92?qid=1679216994&s=sports&sr=1-92,4.2,"4,207",,₹519
Gadget Deals Bicycle Safety Cycle Blinker Light LED Front Cycle Blinking Light Rear Light Combo Cycle Warning Light Combo,sports & fitness,Cycling,https://m.media-amazon.com/images/I/41bx2fh4JML._AC_UL320_.jpg,https://www.amazon.in/Gadget-Deals-Bicycle-Blinker-Blinking/dp/B08X3DGQWY/ref=sr_1_93?qid=1679216994&s=sports&sr=1-93,3.4,203,₹189,₹499
RACHEYTA Ultra-Thin Transparent Nylon Summer Ankle Length Stocking Socks for Women/Girl's,sports & fitness,Cycling,https://m.media-amazon.com/images/I/51YbjWHW3fL._AC_UL320_.jpg,https://www.amazon.in/RACHEYTA-Ultra-Thin-Transparent-Summer-Length/dp/B09ZYT9TH7/ref=sr_1_94?qid=1679216994&s=sports&sr=1-94,3.6,15,₹249,₹399
"Dark Horse® Bicycle New Tail Light with 3 Colors Red, Blue & White LED Light 6 Mode USB Rechargeable",sports & fitness,Cycling,https://m.media-amazon.com/images/I/41JSkgO+5+L._AC_UL320_.jpg,https://www.amazon.in/Dark-Horse%C2%AE-Bicycle-Colors-Rechargeable/dp/B08QS4ML6D/ref=sr_1_95?qid=1679216994&s=sports&sr=1-95,3.9,121,₹377,"₹1,299"
Lista Aluminum-Alloy Side Kickstand for Road Bike Mountain Bicycle (Black),sports & fitness,Cycling,https://m.media-amazon.com/images/I/31i2OVITwnL._AC_UL320_.jpg,https://www.amazon.in/Lista-Aluminum-Alloy-Kickstand-Mountain-Bicycle/dp/B09RMX41NT/ref=sr_1_96?qid=1679216994&s=sports&sr=1-96,3.7,247,₹280,₹499
"Lifelong Without Gear Single Speed 26T MTB Cycle, Mountain Bikes|Frame Size: 18 inches|Cycle with Free Installation Assist...",sports & fitness,Cycling,https://m.media-amazon.com/images/W/IMAGERENDERING_521856-T2/images/I/81cHNPztKcL._AC_UL320_.jpg,https://www.amazon.in/Lifelong-LLBC2601-Escape-Cycle-Black/dp/B096GXBX1L/ref=sr_1_145?qid=1679216996&s=sports&sr=1-145,3.8,870,"₹5,399","₹7,499"
NAVYSPORT Men's Calf Length Cotton Socks (Pack Of 3),sports & fitness,Cycling,https://m.media-amazon.com/images/W/IMAGERENDERING_521856-T2/images/I/71w6cbUykXL._AC_UL320_.jpg,https://www.amazon.in/NAVYSPORT-Cotton-Athletic-Socks-Melange/dp/B09WRSSSB5/ref=sr_1_146?qid=1679216996&s=sports&sr=1-146,4.1,"10,244",₹261,₹599
Tripole Hydration Backpacks 3 litres for Cycling and Trail Running,sports & fitness,Cycling,https://m.media-amazon.com/images/W/IMAGERENDERING_521856-T2/images/I/8109+FngMqL._AC_UL320_.jpg,https://www.amazon.in/Tripole-Hydration-Backpacks-Cycling-Running/dp/B09D7G885D/ref=sr_1_147?qid=1679216996&s=sports&sr=1-147,4.0,128,,₹719
Hero Zoom 14T Single Speed Kids Cycles,sports & fitness,Cycling,https://m.media-amazon.com/images/W/IMAGERENDERING_521856-T2/images/I/71hYYVHp4hL._AC_UL320_.jpg,https://www.amazon.in/Hero-Single-Speed-Cycles-Color/dp/B085CQ2YKK/ref=sr_1_148?qid=1679216996&s=sports&sr=1-148,3.3,"1,623","₹2,696.98","₹2,966.72"
"Missby Regular Wear Anti-Tan Nylon Ankle Thumb Socks for Women and Girls (Beige Color, Free Size, Pack of 4)",sports & fitness,Cycling,https://m.media-amazon.com/images/W/IMAGERENDERING_521856-T2/images/I/51g1-ZEXZCL._AC_UL320_.jpg,https://www.amazon.in/Missby-Regular-Anti-Tan-Nylon-Ankle/dp/B07TQJW6YX/ref=sr_1_149?qid=1679216996&s=sports&sr=1-149,3.4,316,₹199,₹399
"Geekey Multi-Tool – Key Shaped Pocket Tool for Your Keychain w/Bottle Opener, Screwdriver, Ruler, Wrench, Box Cutter, bit ...",sports & fitness,Cycling,https://m.media-amazon.com/images/W/IMAGERENDERING_521856-T2/images/I/71HMLf5v5mL._AC_UL320_.jpg,https://www.amazon.in/Geekey-Multi-Tool-Keychain-Screwdriver-Stainless/dp/B07T5JZD9H/ref=sr_1_150?qid=1679216996&s=sports&sr=1-150,4.6,"6,083",₹599,₹999
Amazon Brand - Solimo Bicycle Frame Saddle Bag with Touchscreen Pocket for Smartphone,sports & fitness,Cycling,https://m.media-amazon.com/images/W/IMAGERENDERING_521856-T2/images/I/81WCblTdhBL._AC_UL320_.jpg,https://www.amazon.in/Amazon-Brand-Solimo-so_flingyrqba_15-Cycling/dp/B084DPX1B9/ref=sr_1_151?qid=1679216996&s=sports&sr=1-151,3.8,536,₹309,₹700
"Leader Speedy Bike 20T Kids Cycle for Age 6 to 10 Years (Black/Orange) | Frame Size 12"" | Unisex Cycle",sports & fitness,Cycling,https://m.media-amazon.com/images/W/IMAGERENDERING_521856-T2/images/I/71rW7pjs7CL._AC_UL320_.jpg,https://www.amazon.in/Leader-Speedy-Single-Bicycle-Suspension/dp/B09L8F82G1/ref=sr_1_152?qid=1679216996&s=sports&sr=1-152,3.5,26,"₹3,999","₹8,775"
"Asian Paints ezyCR8 Rust Remover Spray for Home & Automotive Maintenance, Effective Rust & Grease Removal, Lubricant Spray...",sports & fitness,Cycling,https://m.media-amazon.com/images/W/IMAGERENDERING_521856-T2/images/I/41oo4J5TMQL._AC_UL320_.jpg,https://www.amazon.in/Asian-Paints-MultiPurpose-Maintenance-Transparent/dp/B0B9XZ65LK/ref=sr_1_153?qid=1679216996&s=sports&sr=1-153,4.0,25,₹189,₹210
"NIVIA G 20-20 Plastic Sipper/Bottle - Black (600 ml, Pack of 1)",sports & fitness,Cycling,https://m.media-amazon.com/images/W/IMAGERENDERING_521856-T2/images/I/41lRlWwwxBL._AC_UL320_.jpg,https://www.amazon.in/Nivia-20-20-Plastic-Sipper-Black/dp/B01G8Y6AJ6/ref=sr_1_154?qid=1679216996&s=sports&sr=1-154,3.7,"2,839",₹147.24,₹170
"Nivia Plain Encounter Stockings (M, White) Polyester Blend, Pack of 1 Pair, Unisex, Knee Length",sports & fitness,Cycling,https://m.media-amazon.com/images/W/IMAGERENDERING_521856-T2/images/I/81A29NDsEvL._AC_UL320_.jpg,https://www.amazon.in/Nivia-728MWB-Encounter-Stockings-Medium/dp/B079S6Q2GF/ref=sr_1_155?qid=1679216996&s=sports&sr=1-155,4.1,180,,₹149
AFPIN Kids Adults Cycle Light 3 Modes Cycle Bell Siren Hooter Cycle Bell for Bicycle Horn and Light (Multicolor),sports & fitness,Cycling,https://m.media-amazon.com/images/W/IMAGERENDERING_521856-T2/images/I/41RjM-rFovL._AC_UL320_.jpg,https://www.amazon.in/AFPIN-Adults-Hooter-Bicycle-Multicolor/dp/B08XH7DZMX/ref=sr_1_156?qid=1679216996&s=sports&sr=1-156,3.2,48,₹229,₹699
"Mistie Hub Yoga Socks & Colorful Yoga Socks for Women Non-Slip Grips & Straps, Ideal for Pilates, Pure Barre, Ballet, Danc...",sports & fitness,Cycling,https://m.media-amazon.com/images/W/IMAGERENDERING_521856-T2/images/I/41pnY565MeL._AC_UL320_.jpg,https://www.amazon.in/Mistie-Hub-Yoga-Socks-Colorful/dp/B0BNXKTMWS/ref=sr_1_157?qid=1679216996&s=sports&sr=1-157,4.8,29,₹249,₹999
Fitkit Classic Bottle Shaker 700ml,sports & fitness,Cycling,https://m.media-amazon.com/images/W/IMAGERENDERING_521856-T2/images/I/510gHLM8t4L._AC_UL320_.jpg,https://www.amazon.in/Fitkit-Classic-Bottle-Shaker-700ml/dp/B074VHN2F3/ref=sr_1_158?qid=1679216996&s=sports&sr=1-158,4.1,"18,123",₹220,₹449
"R for Rabbit Tiny Toes T20 Ace with EVA Wheels Kids/Baby Tricycle, Cycle for Kids, Tricycle for Kids for 1.5 to 5 Years, B...",sports & fitness,Cycling,https://m.media-amazon.com/images/W/IMAGERENDERING_521856-T2/images/I/61owxoI1sjL._AC_UL320_.jpg,https://www.amazon.in/Rabbit-Wheels-Tricycle-Container-Storage/dp/B0BBRB64R1/ref=sr_1_159?qid=1679216996&s=sports&sr=1-159,3.9,135,"₹2,999","₹3,996"
Nivia Performance Football,sports & fitness,Cycling,https://m.media-amazon.com/images/W/IMAGERENDERING_521856-T2/images/I/81euRm6ArDL._AC_UL320_.jpg,https://www.amazon.in/Nivia-Performance-Football-Guard-Large/dp/B00KWUPDA0/ref=sr_1_160?qid=1679216996&s=sports&sr=1-160,4.1,"1,639",₹151,₹165
"Toyzoy Maple Grand Kids|Baby Trike|Tricycle with Safety Guardrail for Kids|Boys|Girls Age Group 2 to 5 Years, TZ-531 (Blue)",sports & fitness,Cycling,https://m.media-amazon.com/images/W/IMAGERENDERING_521856-T2/images/I/71NzB2ml7cL._AC_UL320_.jpg,https://www.amazon.in/Toyzoy-Tricycle-Safety-Guardrail-TZ-531/dp/B08ZB6K6JT/ref=sr_1_161?qid=1679216996&s=sports&sr=1-161,3.8,"1,873","₹2,559","₹4,449"
xodi Skin Ultra-Thin Transparent Nylon Summer Skin Socks for Women/Girl's || Ankle Length Socks || Color Beige || Free Size,sports & fitness,Cycling,https://m.media-amazon.com/images/W/IMAGERENDERING_521856-T2/images/I/41VZexn3ZpL._AC_UL320_.jpg,https://www.amazon.in/Ultra-Thin-Transparent-Nylon-Summer-Length/dp/B0999KTGP4/ref=sr_1_162?qid=1679216996&s=sports&sr=1-162,3.5,157,₹98,₹249
Supersox Women's Knee Socks Long Knee High Socks for Women Pure Cotton Thigh Socks Warm sweet gifting Pack Combo Of 3 (Bla...,sports & fitness,Cycling,https://m.media-amazon.com/images/W/IMAGERENDERING_521856-T2/images/I/71HUJjTC29L._AC_UL320_.jpg,https://www.amazon.in/Supersox-Womens-Essentials-Length-Socks/dp/B01N7K77GS/ref=sr_1_163?qid=1679216996&s=sports&sr=1-163,4.1,98,₹380,₹450
"RIANZ Bicycle Cycle Bell Copper Mini, Clearer Louder Longer Tone Horn for Cycling (Black - Pack of 1)",sports & fitness,Cycling,https://m.media-amazon.com/images/W/IMAGERENDERING_521856-T2/images/I/51ZlSvY7MnL._AC_UL320_.jpg,https://www.amazon.in/RIANZ-Bicycle-Copper-Clearer-Cycling/dp/B0B3F3B5XV/ref=sr_1_164?qid=1679216996&s=sports&sr=1-164,3.8,240,₹218,₹595
"AFPIN USB Rechargeable Waterproof Cycle Light, High 300 Lumens Super Bright Headlight- Cycle Light for Bicycle (Multicolor)",sports & fitness,Cycling,https://m.media-amazon.com/images/W/IMAGERENDERING_521856-T2/images/I/61jbB3FDEBL._AC_UL320_.jpg,https://www.amazon.in/AFPIN-Rechargeable-Waterproof-Headlight-Bicycle/dp/B08ZNKXQRS/ref=sr_1_165?qid=1679216996&s=sports&sr=1-165,3.8,291,₹249,₹999
Jockey 2400 Men's Super-Combed Cotton Rich Half Sleeved Thermal Undershirt with Stay Warm & Stay Fresh Technology,sports & fitness,Cycling,https://m.media-amazon.com/images/W/IMAGERENDERING_521856-T2/images/I/61q2d-CXPqL._AC_UL320_.jpg,https://www.amazon.in/Jockey-Mens-Cotton-8901326014400_2400_L_Off-White/dp/B00W055Q16/ref=sr_1_166?qid=1679216996&s=sports&sr=1-166,4.2,"1,848",₹499,₹629
Amazon Brand - Symactive Men's Regular Fit Sports T-Shirt,sports & fitness,Cycling,https://m.media-amazon.com/images/W/IMAGERENDERING_521856-T2/images/I/61uxOb7ZmVL._AC_UL320_.jpg,https://www.amazon.in/Amazon-Brand-Symbol-T-Shirt-AW17-SYSP-04B_Large_Navy/dp/B071KFNBBF/ref=sr_1_167?qid=1679216996&s=sports&sr=1-167,4.1,"2,757",₹309,₹799
Lista Adjustable Bicycle Bottle Holder Seat with Quick Release Clamp,sports & fitness,Cycling,https://m.media-amazon.com/images/W/IMAGERENDERING_521856-T2/images/I/510Orct9twL._AC_UL320_.jpg,https://www.amazon.in/Lista028-Adjustable-Bicycle-Bottle-Release/dp/B075DBMHP2/ref=sr_1_168?qid=1679216996&s=sports&sr=1-168,3.3,"1,373",₹199,₹429
