name,main_category,sub_category,image,link,ratings,no_of_ratings,discount_price,actual_price
ZAVERI PEARLS Green & Pink Stones Ethnic Collar Bone Necklace Earring & Ring Set For Women-ZPFK11665,accessories,Fashion & Silver Jewellery,https://m.media-amazon.com/images/W/IMAGERENDERING_521856-T2/images/I/61UNdghx4cL._AC_UL320_.jpg,https://www.amazon.in/Zaveri-Pearls-Necklace-Earring-Women-ZPFK11665/dp/B09Q18JZTQ/ref=sr_1_76?qid=1679159930&s=jewelry&sr=1-76,3.8,233,₹449,"₹2,495"
Sukkhi Classic LCT Gold Plated Wedding Jewellery Pearl Long Haram Necklace Set For Women (N83782),accessories,Fashion & Silver Jewellery,https://m.media-amazon.com/images/W/IMAGERENDERING_521856-T2/images/I/71YtiyjFXML._AC_UL320_.jpg,https://www.amazon.in/Sukkhi-Classic-Jewellery-Necklace-N83782/dp/B07Z1XTWMY/ref=sr_1_77?qid=1679159930&s=jewelry&sr=1-77,3.8,"1,242",₹280,"₹3,795"
YouBella Jewellery Set for Women Tibetan Pendant Necklace with Earrings for Women & Girls (Gift) Tribal Necklace Jewellery...,accessories,Fashion & Silver Jewellery,https://m.media-amazon.com/images/W/IMAGERENDERING_521856-T2/images/I/71mjFCuBSDL._AC_UL320_.jpg,https://www.amazon.in/YouBella-Afghani-Jewellery-Multicolour-MV-FS6S-86K3/dp/B07L9DMG5K/ref=sr_1_78?qid=1679159930&s=jewelry&sr=1-78,4.1,"2,846",₹267,"₹1,499"
Yellow Chimes Necklace Set for Women And Girls Traditional Jewellery Set for Women Gold-Plated Temple Necklace Set Stone-S...,accessories,Fashion & Silver Jewellery,https://m.media-amazon.com/images/W/IMAGERENDERING_521856-T2/images/I/61V4Z6WqAVL._AC_UL320_.jpg,https://www.amazon.in/Yellow-Chimes-Traditional-Jewellery-Necklace/dp/B09VGYDJS5/ref=sr_1_79?qid=1679159930&s=jewelry&sr=1-79,3.9,101,₹358,"₹1,989"
ZAVERI PEARLS Ethnic Kundan & Pearls Multi Layers Bridal Necklace Set For Women-ZPFK8689,accessories,Fashion & Silver Jewellery,https://m.media-amazon.com/images/W/IMAGERENDERING_521856-T2/images/I/71eaAiL-wjL._AC_UL320_.jpg,https://www.amazon.in/Zaveri-Pearls-Jewellery-Golden-ZPFK8689/dp/B07Q538CC5/ref=sr_1_80?qid=1679159930&s=jewelry&sr=1-80,4.0,"1,443",₹348,"₹3,160"
GIVA 925 Sterling Silver Anushka Sharma Zircon Deer Heart Pendant with Chain | Necklace to Gift Women & Girls | With Certi...,accessories,Fashion & Silver Jewellery,https://m.media-amazon.com/images/W/IMAGERENDERING_521856-T2/images/I/61jFJtxbGPL._AC_UL320_.jpg,https://www.amazon.in/GIVA-Deer-Heart-Necklace-Authenticity/dp/B08LZKKSMV/ref=sr_1_81?qid=1679159930&s=jewelry&sr=1-81,4.0,457,"₹1,709","₹2,999"
Shining Diva Fashion Latest One Gram Gold Plated Set of 8 Traditional Bangles for Women and Girls,accessories,Fashion & Silver Jewellery,https://m.media-amazon.com/images/W/IMAGERENDERING_521856-T2/images/I/81LWpXfWICL._AC_UL320_.jpg,https://www.amazon.in/Shining-Diva-Fashion-Traditional-11712b_2-6/dp/B08K9954FB/ref=sr_1_82?qid=1679159930&s=jewelry&sr=1-82,4.0,"3,429",₹303,"₹1,499"
YouBella Valentine Gifts for Girlfriend/Wife Jewellery Combo of Crystal Stylish Latest Design Necklace Jewellery Set with ...,accessories,Fashion & Silver Jewellery,https://m.media-amazon.com/images/W/IMAGERENDERING_521856-T2/images/I/51jLljhVhhL._AC_UL320_.jpg,https://www.amazon.in/YouBella-Jewellery-Necklace-Earrings-Bracelet/dp/B01FMGKKGK/ref=sr_1_83?qid=1679159930&s=jewelry&sr=1-83,3.7,"2,421",₹289,"₹3,999"
Yellow Chimes Pendant for Women and Girls | Rose Gold Pendant Necklace for Women Western | Stainless Steel Long Chain Pend...,accessories,Fashion & Silver Jewellery,https://m.media-amazon.com/images/W/IMAGERENDERING_521856-T2/images/I/51L4Lwd3zeL._AC_UL320_.jpg,https://www.amazon.in/Yellow-Chimes-Stainless-Butterfly-YCFJPD-283BTRF-RG/dp/B078GLF4MQ/ref=sr_1_84?qid=1679159930&s=jewelry&sr=1-84,4.2,"1,743",₹299,"₹1,299"
Yellow Chimes Earrings for Women & Girls| Traditional Multicolor Drop Earrings| Gold Plated Set| Drop Earring Combo| Acces...,accessories,Fashion & Silver Jewellery,https://m.media-amazon.com/images/W/IMAGERENDERING_521856-T2/images/I/61pYO5D2R7L._AC_UL320_.jpg,https://www.amazon.in/Yellow-Chimes-Traditional-Multi-colour-YCTJER-01LAAC-C-MC/dp/B07PHKD63B/ref=sr_1_85?qid=1679159930&s=jewelry&sr=1-85,3.9,"3,884",₹203,₹899
Bangalore Refinery 999 Purity Silver Bar 250 Gram,accessories,Fashion & Silver Jewellery,https://m.media-amazon.com/images/W/IMAGERENDERING_521856-T2/images/I/71kFpC7XBnL._AC_UL320_.jpg,https://www.amazon.in/Bangalore-Refinery-Purity-Silver-Gram/dp/B019GZJIBQ/ref=sr_1_86?qid=1679159930&s=jewelry&sr=1-86,4.4,583,"₹22,890","₹35,000"
Shining Diva Fashion Latest Stylish Traditional Oxidised Silver Necklace Jewellery Set for Women (13165s),accessories,Fashion & Silver Jewellery,https://m.media-amazon.com/images/W/IMAGERENDERING_521856-T2/images/I/61FxeVe+dwL._AC_UL320_.jpg,https://www.amazon.in/Shining-Diva-Fashion-Traditional-13165s/dp/B0B15GRS3X/ref=sr_1_87?qid=1679159930&s=jewelry&sr=1-87,4.3,60,₹258,"₹1,999"
ZAVERI PEARLS Delicate Ruby Necklace Set For Women - ZPFK6110,accessories,Fashion & Silver Jewellery,https://m.media-amazon.com/images/W/IMAGERENDERING_521856-T2/images/I/61yMqpIGCwL._AC_UL320_.jpg,https://www.amazon.in/Zaveri-Pearls-Necklace-Women-ZPFK6110/dp/B0727WCBJ5/ref=sr_1_88?qid=1679159930&s=jewelry&sr=1-88,4.1,"1,083",₹832,"₹4,160"
Sukkhi Attractive Gold Plated Necklace Kada Combo Set for Women (CBMIX104227),accessories,Fashion & Silver Jewellery,https://m.media-amazon.com/images/W/IMAGERENDERING_521856-T2/images/I/71Pz1oNuAPL._AC_UL320_.jpg,https://www.amazon.in/Sukkhi-Attractive-Plated-Necklace-CBMIX104227/dp/B09Y3DJT2T/ref=sr_1_89?qid=1679159930&s=jewelry&sr=1-89,3.2,329,₹304,"₹1,164"
Shining Diva Fashion Latest pairs Earrings Combo Set Crystal Pearl Stud Earrings for Women,accessories,Fashion & Silver Jewellery,https://m.media-amazon.com/images/W/IMAGERENDERING_521856-T2/images/I/61xmb0cOh9L._AC_UL320_.jpg,https://www.amazon.in/Shining-Diva-Fashion-Earrings-cmb291_10868_10869/dp/B084HHN8LD/ref=sr_1_90?qid=1679159930&s=jewelry&sr=1-90,4.0,"4,952",₹240,"₹1,999"
ZAVERI PEARLS Multicolor Stones & Beads Multistrand Beaded Kundan Choker Necklace Earring & Ring Set For Women-ZPFK15092,accessories,Fashion & Silver Jewellery,https://m.media-amazon.com/images/W/IMAGERENDERING_521856-T2/images/I/715XG5b-RNL._AC_UL320_.jpg,https://www.amazon.in/ZAVERI-PEARLS-Multicolor-Multistrand-Women-ZPFK15092/dp/B0BGSN6WM3/ref=sr_1_91?qid=1679159930&s=jewelry&sr=1-91,3.8,30,₹598,"₹3,450"
"HSR PU Leather Jewelry Box for Earring Rings Necklace Jewelry Holder Organizer Case, Gifts for Girls Women",accessories,Fashion & Silver Jewellery,https://m.media-amazon.com/images/W/IMAGERENDERING_521856-T2/images/I/71RkisDV0QL._AC_UL320_.jpg,https://www.amazon.in/HSR-Leather-Jewelry-Organizer-Necklace/dp/B08XY62L6Y/ref=sr_1_92?qid=1679159930&s=jewelry&sr=1-92,4.4,962,₹637,"₹1,299"
ZAVERI PEARLS Gold Tone Traditional Temple Choker Necklace Set For Women-ZPFK8983,accessories,Fashion & Silver Jewellery,https://m.media-amazon.com/images/W/IMAGERENDERING_521856-T2/images/I/71yqFrgW3QL._AC_UL320_.jpg,https://www.amazon.in/Zaveri-Pearls-Traditional-Necklace-Women-ZPFK8983/dp/B07ZYZGH8G/ref=sr_1_93?qid=1679159930&s=jewelry&sr=1-93,4.0,"2,071",₹442,"₹2,320"
Jewels Galaxy Jewellery For Women Stackable Rings Set,accessories,Fashion & Silver Jewellery,https://m.media-amazon.com/images/W/IMAGERENDERING_521856-T2/images/I/61SglF6LuLL._AC_UL320_.jpg,https://www.amazon.in/Jewels-Galaxy-Jewellery-Contemporary-JG-PC-RNGH-2725/dp/B0BLSXCBL8/ref=sr_1_94?qid=1679159930&s=jewelry&sr=1-94,3.8,22,₹261,"₹1,999"
Zaveri Pearls,accessories,Fashion & Silver Jewellery,https://m.media-amazon.com/images/W/IMAGERENDERING_521856-T2/images/I/61PihX8SyoL._AC_UL320_.jpg,https://www.amazon.in/Zaveri-Pearls-Earrings-Multicolor-ZPFK1194/dp/B00QYQ38J4/ref=sr_1_95?qid=1679159930&s=jewelry&sr=1-95,4.2,"2,742",₹270,"₹1,690"
JewelMaze Traditional Jhumki Earrings Combo For Women and Girls - Set of 4,accessories,Fashion & Silver Jewellery,https://m.media-amazon.com/images/W/IMAGERENDERING_521856-T2/images/I/61dYR2CEy1L._AC_UL320_.jpg,https://www.amazon.in/JewelMaze-Oxidized-Silver-Earrings-Women/dp/B07S3H1BPS/ref=sr_1_96?qid=1679159930&s=jewelry&sr=1-96,4.2,"2,755",₹225,₹599
GIVA 925 Sterling Silver Rose Gold Anushka Sharma Pink Quartz Flower Necklace | Necklace to Gift Women & Girls | With Cert...,accessories,Fashion & Silver Jewellery,https://m.media-amazon.com/images/W/IMAGERENDERING_521856-T2/images/I/61Bfe24F9OL._AC_UL320_.jpg,https://www.amazon.in/GIVA-Sterling-Necklace-Certificate-Authenticity/dp/B09HCH7CYM/ref=sr_1_97?qid=1679159930&s=jewelry&sr=1-97,4.5,131,"₹1,899","₹3,398"
ZAVERI PEARLS Set of 2 Rose Gold Contemporary Cubic Zirconia Brass Kada Style Bracelet For Women-ZPFK11116,accessories,Fashion & Silver Jewellery,https://m.media-amazon.com/images/W/IMAGERENDERING_521856-T2/images/I/71LxR8HzoUL._AC_UL320_.jpg,https://www.amazon.in/Zaveri-Contemporary-Zirconia-Bracelet-Women-ZPFK11116/dp/B09F35MLC1/ref=sr_1_98?qid=1679159930&s=jewelry&sr=1-98,4.2,174,₹358,"₹2,750"
Yellow Chimes Bracelet for Women and Girls | Fashion Multicolor Swiss Zircon Crystal Bracelets for Women and Girls | Acces...,accessories,Fashion & Silver Jewellery,https://m.media-amazon.com/images/W/IMAGERENDERING_521856-T2/images/I/61nhWalhqOL._AC_UL320_.jpg,https://www.amazon.in/Yellow-Chimes-Italian-Crystal-Bracelet/dp/B082PLSBJL/ref=sr_1_99?qid=1679159930&s=jewelry&sr=1-99,4.0,"1,890",₹299,"₹1,196"
Shining Diva Fashion Latest Stylish Traditional Oxidised Silver Necklace Jewellery Set for Women (13110s),accessories,Fashion & Silver Jewellery,https://m.media-amazon.com/images/W/IMAGERENDERING_521856-T2/images/I/71tOKFnZY9L._AC_UL320_.jpg,https://www.amazon.in/Shining-Diva-Fashion-Traditional-13110s/dp/B0B15HGZQB/ref=sr_1_100?qid=1679159930&s=jewelry&sr=1-100,4.0,353,₹299,"₹1,999"
Bangalore Refinery 999 Purity Silver Bar 20 Gram,accessories,Fashion & Silver Jewellery,https://m.media-amazon.com/images/W/IMAGERENDERING_521856-T2/images/I/61tjjflaH3L._AC_UL320_.jpg,https://www.amazon.in/Bangalore-Refinery-Purity-Silver-Gram/dp/B0188QRY9W/ref=sr_1_101?qid=1679159930&s=jewelry&sr=1-101,4.4,575,"₹1,709","₹2,200"
CLARA 925 Sterling Silver Heart Pendant Necklace | with or Without Chain | Gift for Women and Girls,accessories,Fashion & Silver Jewellery,https://m.media-amazon.com/images/W/IMAGERENDERING_521856-T2/images/I/41X4Dd-bKiL._AC_UL320_.jpg,https://www.amazon.in/Sterling-Pendant-Necklace-Rhodium-Zirconia/dp/B09XNB3DZX/ref=sr_1_102?qid=1679159930&s=jewelry&sr=1-102,4.2,45,"₹1,894","₹3,998"
Shining Diva Fashion Latest Collection Gold Plated Combo of 2 Bracelet for Women and Girls (Rose Gold) (cmb285_8306b_9556b),accessories,Fashion & Silver Jewellery,https://m.media-amazon.com/images/W/IMAGERENDERING_521856-T2/images/I/71CV1ddvQAL._AC_UL320_.jpg,https://www.amazon.in/Shining-Diva-Fashion-Collection-cmb285_8306b_9556b/dp/B07DP2ZB5L/ref=sr_1_103?qid=1679159930&s=jewelry&sr=1-103,4.1,"2,667",₹258,"₹3,499"
Clara 92.5 Sterling Silver Swiss Zirconia Pearl Earrings Gift for Women and Girls,accessories,Fashion & Silver Jewellery,https://m.media-amazon.com/images/W/IMAGERENDERING_521856-T2/images/I/51sR7Zq4wkL._AC_UL320_.jpg,https://www.amazon.in/Clara-Sterling-Silver-Zirconia-Earrings/dp/B07JJ2D8QM/ref=sr_1_104?qid=1679159930&s=jewelry&sr=1-104,4.4,769,"₹1,894","₹3,798"
Zaveri Pearls Gold Tone Traditional Kundan & Pearls Jhumki Earring For Women-ZPFK11012,accessories,Fashion & Silver Jewellery,https://m.media-amazon.com/images/W/IMAGERENDERING_521856-T2/images/I/61E5vcYfqAL._AC_UL320_.jpg,https://www.amazon.in/Zaveri-Pearls-Traditional-Earring-Women-ZPFK11012/dp/B09GNGCRW2/ref=sr_1_101?qid=1679159932&s=jewelry&sr=1-101,4.2,249,₹450,"₹2,495"
YouBella Jewellery Crystal Tassel Handmade Gold Plated Earrings for Women (Peach),accessories,Fashion & Silver Jewellery,https://m.media-amazon.com/images/W/IMAGERENDERING_521856-T2/images/I/81DuCjcX6ZL._AC_UL320_.jpg,https://www.amazon.in/YouBella-Jewellery-Earrings-Crystal-Handmade/dp/B08MC9GMFC/ref=sr_1_102?qid=1679159932&s=jewelry&sr=1-102,4.2,502,₹314,"₹1,599"
GIVA 925 Sterling Silver Infinity Heart Necklace with Link Chain | Pendants to Gift Women & Girls | With Certificate of Au...,accessories,Fashion & Silver Jewellery,https://m.media-amazon.com/images/W/IMAGERENDERING_521856-T2/images/I/51X+oY7cs4L._AC_UL320_.jpg,https://www.amazon.in/GIVA-Sterling-Infinity-Certificate-Authenticity/dp/B08PFPD5HQ/ref=sr_1_103?qid=1679159932&s=jewelry&sr=1-103,4.1,175,"₹1,709","₹2,999"
CLARA Pure Real 925 Sterling Silver Adjustable Ring Band Gift for Women and Girls | Multiple Design Options,accessories,Fashion & Silver Jewellery,https://m.media-amazon.com/images/W/IMAGERENDERING_521856-T2/images/I/512dyCsOKRS._AC_UL320_.jpg,https://www.amazon.in/CLARA-Sterling-Silver-Adjustable-Women/dp/B095YJ572B/ref=sr_1_104?qid=1679159932&s=jewelry&sr=1-104,4.2,456,"₹1,229","₹2,398"
