name,main_category,sub_category,image,link,ratings,no_of_ratings,discount_price,actual_price
Bangalore Refinery 999 Purity Silver Bar 1 Kg,accessories,Fashion & Silver Jewellery,https://m.media-amazon.com/images/W/IMAGERENDERING_521856-T2/images/I/71uzgqbJxLL._AC_UL320_.jpg,https://www.amazon.in/Bangalore-Refinery-999-Purity-Silver/dp/B019GYQWSO/ref=sr_1_5?qid=1679159928&s=jewelry&sr=1-5,4.3,218,"₹73,672","₹78,000"
Fashion Frill Men's Jewellery 3D Cuboid Vertical Bar/Stick Stainless Steel Black Silver Locket Pendant Necklace Chain For ...,accessories,Fashion & Silver Jewellery,https://m.media-amazon.com/images/W/IMAGERENDERING_521856-T2/images/I/51P-ohUTdgL._AC_UL320_.jpg,https://www.amazon.in/Fashion-Frill-Jewellery-Vertical-Stainless/dp/B0BH8H9KSL/ref=sr_1_6?qid=1679159928&s=jewelry&sr=1-6,3.8,536,₹129,₹999
Bangalore Refinery 999 Purity Silver Bar 500 Gram,accessories,Fashion & Silver Jewellery,https://m.media-amazon.com/images/W/IMAGERENDERING_521856-T2/images/I/71M5FDd6giL._AC_UL320_.jpg,https://www.amazon.in/Bangalore-Refinery-Purity-Silver-Gram/dp/B0188QRTII/ref=sr_1_7?qid=1679159928&s=jewelry&sr=1-7,4.4,231,"₹37,028","₹41,000"
Shining Diva Fashion Distance Couple Natural Stones Reiki Yoga Healing Onyx and Howlite Unisex Bracelet for Men and Women...,accessories,Fashion & Silver Jewellery,https://m.media-amazon.com/images/W/IMAGERENDERING_521856-T2/images/I/51gsDu5QXLL._AC_UL320_.jpg,https://www.amazon.in/Shining-Diva-Fashion-Multicolour-Bracelets/dp/B07DJPVWHG/ref=sr_1_8?qid=1679159928&s=jewelry&sr=1-8,4.0,611,₹168,"₹2,499"
Bangalore Refinery 999 Purity Silver Bar 100 Gram,accessories,Fashion & Silver Jewellery,https://m.media-amazon.com/images/W/IMAGERENDERING_521856-T2/images/I/613fNgOgrVL._AC_UL320_.jpg,https://www.amazon.in/Bangalore-Refinery-Purity-Silver-Gram/dp/B0188QRVCM/ref=sr_1_9?qid=1679159928&s=jewelry&sr=1-9,4.5,837,"₹7,663","₹8,500"
Brado Jewellery Multi Wearing Heart Necklace 4 Heart Magnetic Rose Gold Necklace Pendant Heart Toggle Necklace Diamond Wom...,accessories,Fashion & Silver Jewellery,https://m.media-amazon.com/images/W/IMAGERENDERING_521856-T2/images/I/51R3cy1wVmL._AC_UL320_.jpg,https://www.amazon.in/Brado-Jewellery-Necklace-Magnetic-Accessories/dp/B09PYB4XJT/ref=sr_1_10?qid=1679159928&s=jewelry&sr=1-10,4.1,"1,486",₹187,₹999
Sukkhi Adorable Gold Plated Pearl Choker Necklace Set for Women,accessories,Fashion & Silver Jewellery,https://m.media-amazon.com/images/W/IMAGERENDERING_521856-T2/images/I/81UaMFQR6kL._AC_UL320_.jpg,https://www.amazon.in/Sukkhi-Lavish-Plated-Necklace-SKR69591/dp/B08S3MSGT9/ref=sr_1_11?qid=1679159928&s=jewelry&sr=1-11,3.8,"7,063",₹160,"₹1,670"
Bangalore Refinery 24k (999.9) 2gm + 1gm Combo Yellow Gold Bars,accessories,Fashion & Silver Jewellery,https://m.media-amazon.com/images/W/IMAGERENDERING_521856-T2/images/I/719MFGbwkFL._AC_UL320_.jpg,https://www.amazon.in/Bangalore-Refinery-999-9-Combo-Yellow/dp/B0BFXW91ZF/ref=sr_1_12?qid=1679159928&s=jewelry&sr=1-12,4.7,47,"₹19,668","₹21,800"
Valentine Gift By Shining Diva Italian Designer Non Precious Metal Jewellery Set for Women (Blue) (rrsdcmb208),accessories,Fashion & Silver Jewellery,https://m.media-amazon.com/images/W/IMAGERENDERING_521856-T2/images/I/61ZA0394h7L._AC_UL320_.jpg,https://www.amazon.in/Valentine-Gift-Shining-Diva-rrsdcmb208/dp/B073MFGJHP/ref=sr_1_13?qid=1679159928&s=jewelry&sr=1-13,3.9,"8,720",₹320,"₹3,999"
Brado Jewellery Gold Plated Combo Of 3 Butterfly Pink Green Black Pendant Chain necklace For Women and Girls,accessories,Fashion & Silver Jewellery,https://m.media-amazon.com/images/W/IMAGERENDERING_521856-T2/images/I/71rw5o-HaDL._AC_UL320_.jpg,https://www.amazon.in/Brado-Jewellery-Butterfly-Green-Black/dp/B0B6FGRKD1/ref=sr_1_14?qid=1679159928&s=jewelry&sr=1-14,3.9,461,₹142,"₹1,499"
Zaveri Pearls Set Of 25 Gold Tone Smart Casual Wear Studs & Hoop Earrings For Women-ZPFK14053,accessories,Fashion & Silver Jewellery,https://m.media-amazon.com/images/W/IMAGERENDERING_521856-T2/images/I/61YawaPRtQL._AC_UL320_.jpg,https://www.amazon.in/Zaveri-Pearls-Casual-Earrings-Women-ZPFK14053/dp/B0B2MP9QDV/ref=sr_1_15?qid=1679159928&s=jewelry&sr=1-15,4.0,127,₹299,"₹1,995"
Zaveri Pearls Combo of 3 Cubic Zirconia & Pearls Contemporary Stud Earrings For Women-ZPFK10381,accessories,Fashion & Silver Jewellery,https://m.media-amazon.com/images/W/IMAGERENDERING_521856-T2/images/I/61Q36kM8geL._AC_UL320_.jpg,https://www.amazon.in/Zaveri-Zirconia-Contemporary-Earrings-Women-ZPFK10381/dp/B0943VVRMN/ref=sr_1_16?qid=1679159928&s=jewelry&sr=1-16,4.0,"1,209",₹370,"₹2,079"
YouBella Jewellery Bracelets for Women Stylish Couple Love Bracelet for Girls/Women/Boys/Men,accessories,Fashion & Silver Jewellery,https://m.media-amazon.com/images/W/IMAGERENDERING_521856-T2/images/I/6109yzldJCL._AC_UL320_.jpg,https://www.amazon.in/YouBella-Jewellery-Bracelet-Multi-Colour-YBBN_91578/dp/B07MKBS915/ref=sr_1_17?qid=1679159928&s=jewelry&sr=1-17,4.2,760,₹195,₹999
YouBella Jewellery Sets for Women Latest Design Gold Plated Pearl Studded Necklace Jewellery set with Earrings For Girls/W...,accessories,Fashion & Silver Jewellery,https://m.media-amazon.com/images/W/IMAGERENDERING_521856-T2/images/I/61Yf6Gbl-fL._AC_UL320_.jpg,https://www.amazon.in/YouBella-Jewellery-Studded-Necklace-Earrings/dp/B07V5HJLG7/ref=sr_1_18?qid=1679159928&s=jewelry&sr=1-18,4.3,"4,697",₹271,"₹1,999"
Bangalore Refinery 999 Purity Silver Bar 50 Gram,accessories,Fashion & Silver Jewellery,https://m.media-amazon.com/images/W/IMAGERENDERING_521856-T2/images/I/61bePScb+7L._AC_UL320_.jpg,https://www.amazon.in/Bangalore-Refinery-Purity-Silver-Gram/dp/B0188QRWSA/ref=sr_1_19?qid=1679159928&s=jewelry&sr=1-19,4.5,580,"₹3,946","₹4,900"
Sukkhi Sparkling Gold Plated Wedding Jewellery Austrian Diamond Set of 4 Necklace Combo for Women (SKR48715),accessories,Fashion & Silver Jewellery,https://m.media-amazon.com/images/W/IMAGERENDERING_521856-T2/images/I/711ZldF8GQL._AC_UL320_.jpg,https://www.amazon.in/Sukkhi-Sparkling-Jewellery-Austrian-SKR48715/dp/B083JG1NDY/ref=sr_1_20?qid=1679159928&s=jewelry&sr=1-20,3.5,"2,824",₹360,"₹6,895"
Euphoria by A.Himanshu 24kt (999) 2 gram Yellow Gold Coin cum Pendant,accessories,Fashion & Silver Jewellery,https://m.media-amazon.com/images/W/IMAGERENDERING_521856-T2/images/I/61y-zLHt+EL._AC_UL320_.jpg,https://www.amazon.in/999-gram-Yellow-Gold-Pendant/dp/B09NG9VF1K/ref=sr_1_25?qid=1679159928&s=jewelry&sr=1-25,4.5,99,"₹12,874","₹15,000"
Zaveri Pearls Glittering Cubic Zirconia Studded Rose Gold Bali Earring For Women-ZPFK7993,accessories,Fashion & Silver Jewellery,https://m.media-amazon.com/images/W/IMAGERENDERING_521856-T2/images/I/61XOZdcPyBL._AC_UL320_.jpg,https://www.amazon.in/Zaveri-Pearls-Glittering-Zirconia-Women-ZPFK7993/dp/B07KP9HBTM/ref=sr_1_26?qid=1679159928&s=jewelry&sr=1-26,3.8,744,₹299,"₹1,663"
Shining Diva Fashion Set of 4 Multilayer Charm Bangle Gold Plated Bracelet for Women and Girls,accessories,Fashion & Silver Jewellery,https://m.media-amazon.com/images/W/IMAGERENDERING_521856-T2/images/I/61oCLzTHSiL._AC_UL320_.jpg,https://www.amazon.in/Shining-Diva-Fashion-Multilayer-10695b/dp/B07RWK1SFQ/ref=sr_1_27?qid=1679159928&s=jewelry&sr=1-27,3.7,"2,582",₹239,"₹1,499"
"Shining Diva Fashion Latest Stylish Fancy Oxidised Silver Tribal Necklace Jewellery Set for Women (12164s), Multicolour, One",accessories,Fashion & Silver Jewellery,https://m.media-amazon.com/images/W/IMAGERENDERING_521856-T2/images/I/71CSGmv8tQL._AC_UL320_.jpg,https://www.amazon.in/Shining-Diva-Fashion-12164s-Multicolour/dp/B09KXGKG36/ref=sr_1_28?qid=1679159928&s=jewelry&sr=1-28,4.2,"1,260",₹258,"₹1,999"
GIVA 925 Sterling Silver Anushka Sharma Falling Dew Necklace with Box Chain | Necklace to Gift Women & Girls | With Certif...,accessories,Fashion & Silver Jewellery,https://m.media-amazon.com/images/W/IMAGERENDERING_521856-T2/images/I/61G3XnVaI3L._AC_UL320_.jpg,https://www.amazon.in/GIVA-Sterling-Necklace-Certificate-Authenticity/dp/B08Z362VZS/ref=sr_1_29?qid=1679159928&s=jewelry&sr=1-29,3.9,728,"₹1,519","₹2,598"
Melbees by Yellow Chimes Hair Clips for Girls Kids Hair Clip Hair Accessories for Girls Set of 26 PCS Cute Animal Characte...,accessories,Fashion & Silver Jewellery,https://m.media-amazon.com/images/W/IMAGERENDERING_521856-T2/images/I/71OtqtHHEUL._AC_UL320_.jpg,https://www.amazon.in/Yellow-Chimes-Characters-Hairpins-Accessories/dp/B09DGB9S23/ref=sr_1_30?qid=1679159928&s=jewelry&sr=1-30,4.2,669,₹295,"₹1,581"
Shining Diva Fashion Latest Stylish Austrian Crystal Rose Gold Charm Bracelet for Women,accessories,Fashion & Silver Jewellery,https://m.media-amazon.com/images/W/IMAGERENDERING_521856-T2/images/I/51rmMr2nSiL._AC_UL320_.jpg,https://www.amazon.in/Shining-Diva-Fashion-Infinity-10672b/dp/B07RY8K8X9/ref=sr_1_31?qid=1679159928&s=jewelry&sr=1-31,4.1,"2,011",₹237,"₹1,499"
ZAVERI PEARLS Pink & Green Beads Cluster Drops Kundan Choker Necklace Earring & Ring Set For Women-ZPFK13800,accessories,Fashion & Silver Jewellery,https://m.media-amazon.com/images/W/IMAGERENDERING_521856-T2/images/I/71K4r1Yd27L._AC_UL320_.jpg,https://www.amazon.in/ZAVERI-PEARLS-Cluster-Necklace-Women-ZPFK13800/dp/B0B2LX5NJT/ref=sr_1_32?qid=1679159928&s=jewelry&sr=1-32,4.1,296,₹539,"₹2,995"
Atasi International Gold Plated Crystal Necklace Jewellery Set with Earrings Suited for Party Wedding Festive for Women,accessories,Fashion & Silver Jewellery,https://m.media-amazon.com/images/W/IMAGERENDERING_521856-T2/images/I/31YY+SAt4TL._AC_UL320_.jpg,https://www.amazon.in/Atasi-International-Necklace-Jewellery-Festivals/dp/B09YQCYQW6/ref=sr_1_33?qid=1679159928&s=jewelry&sr=1-33,4.1,436,₹270,"₹1,999"
Estele Necklace Set for Women,accessories,Fashion & Silver Jewellery,https://m.media-amazon.com/images/W/IMAGERENDERING_521856-T2/images/I/6114nKyrk2L._AC_UL320_.jpg,https://www.amazon.in/Estele-Sublime-Devotion-Antique-Necklace/dp/B099ZJXH22/ref=sr_1_34?qid=1679159928&s=jewelry&sr=1-34,3.5,"1,720",₹538,"₹3,999"
Inditradition 36 Grid Cells Plastic Multipurpose Jewelry Organizer Storage Box - Transparent,accessories,Fashion & Silver Jewellery,https://m.media-amazon.com/images/W/IMAGERENDERING_521856-T2/images/I/61jskHpc6FL._AC_UL320_.jpg,https://www.amazon.in/Inditradition-Plastic-Multipurpose-Jewelry-Organizer/dp/B07176JZ33/ref=sr_1_35?qid=1679159928&s=jewelry&sr=1-35,4.2,"1,464",₹229,₹500
Joyalukkas Flower Design 2 grams 24kt Gold Bar,accessories,Fashion & Silver Jewellery,https://m.media-amazon.com/images/W/IMAGERENDERING_521856-T2/images/I/61ZRBnl7KxL._AC_UL320_.jpg,https://www.amazon.in/Joyalukkas-Flower-Design-grams-24kt/dp/B09NSV59RH/ref=sr_1_36?qid=1679159928&s=jewelry&sr=1-36,4.7,168,"₹13,075","₹14,383"
YouBella Jewellery Celebrity Inspired Gold Plated Earrings Combo for Girls and Women,accessories,Fashion & Silver Jewellery,https://m.media-amazon.com/images/W/IMAGERENDERING_521856-T2/images/I/61MjYLcoo8L._AC_UL320_.jpg,https://www.amazon.in/YouBella-Jewellery-Celebrity-Inspired-Earrings/dp/B09HNZHNKN/ref=sr_1_37?qid=1679159928&s=jewelry&sr=1-37,3.9,463,₹225,"₹1,299"
Voylla Brass Oxidized Silver Plating Flower Shape Dangler Earrings with Black Stone for Women and Girls,accessories,Fashion & Silver Jewellery,https://m.media-amazon.com/images/W/IMAGERENDERING_521856-T2/images/I/616fwbk5FpS._AC_UL320_.jpg,https://www.amazon.in/Voylla-Work-Essentials-Round-Earrings/dp/B07JM3F3G1/ref=sr_1_38?qid=1679159928&s=jewelry&sr=1-38,4.3,571,₹187,₹449
Sukkhi Trendy Kundan Gold Plated Wedding Jewellery Pearl Choker Necklace Set for Women (N73544),accessories,Fashion & Silver Jewellery,https://m.media-amazon.com/images/W/IMAGERENDERING_521856-T2/images/I/81IQvh43G8L._AC_UL320_.jpg,https://www.amazon.in/Sukkhi-Wedding-Engagement-Jewellery-N73544/dp/B07P73DF79/ref=sr_1_39?qid=1679159928&s=jewelry&sr=1-39,3.8,"3,941",₹286,"₹5,445"
YouBella Hair Jewellery Clip Set for Baby Band for Girls (Pack of 18) (Pink),accessories,Fashion & Silver Jewellery,https://m.media-amazon.com/images/W/IMAGERENDERING_521856-T2/images/I/51zTckSsvSL._AC_UL320_.jpg,https://www.amazon.in/YouBella-Hair-Jewellery-Clip-Girls/dp/B08T64VPNC/ref=sr_1_40?qid=1679159928&s=jewelry&sr=1-40,3.9,777,₹271,₹999
Shining Diva Fashion Latest Stylish Traditional Tibetan Pendant Necklace Jewellery Set for Women (13208s),accessories,Fashion & Silver Jewellery,https://m.media-amazon.com/images/W/IMAGERENDERING_521856-T2/images/I/617BH0hUF1L._AC_UL320_.jpg,https://www.amazon.in/Shining-Diva-Fashion-Traditional-13208s/dp/B0B15GYNS4/ref=sr_1_41?qid=1679159928&s=jewelry&sr=1-41,4.1,241,₹258,"₹1,999"
atorakushon Women's Velvet 16 Pair Earrings Organizer Jewellery Box (Maroon),accessories,Fashion & Silver Jewellery,https://m.media-amazon.com/images/W/IMAGERENDERING_521856-T2/images/I/71qipDbrOML._AC_UL320_.jpg,https://www.amazon.in/atorakushon-Velvet-Earrings-Organizer-Jewellery/dp/B07MCLCSPC/ref=sr_1_42?qid=1679159928&s=jewelry&sr=1-42,3.9,"1,144",₹269,"₹1,099"
Sukkhi Glamorous Gold Plated Choker Necklace Set Combo For Women,accessories,Fashion & Silver Jewellery,https://m.media-amazon.com/images/W/IMAGERENDERING_521856-T2/images/I/912iX-Sve0L._AC_UL320_.jpg,https://www.amazon.in/Sukkhi-Glamorous-Plated-Choker-Necklace/dp/B07DFNQD2Z/ref=sr_1_43?qid=1679159928&s=jewelry&sr=1-43,3.3,"13,870",₹251,"₹5,645"
GIVA 925 Sterling Silver Rose Gold Princess Earrings | Studs to Gift Women & Girls | With Certificate of Authenticity and ...,accessories,Fashion & Silver Jewellery,https://m.media-amazon.com/images/W/IMAGERENDERING_521856-T2/images/I/616FzN286RL._AC_UL320_.jpg,https://www.amazon.in/GIVA-Sterling-Princess-Certificate-Authenticity/dp/B09DGLW1TG/ref=sr_1_44?qid=1679159928&s=jewelry&sr=1-44,3.8,207,"₹1,614","₹3,399"
GIVA Pearl Earrings For Women,accessories,Fashion & Silver Jewellery,https://m.media-amazon.com/images/W/IMAGERENDERING_521856-T2/images/I/41uy3xEk0IL._AC_UL320_.jpg,https://www.amazon.in/GIVA-sterling-Original-Freshwater-Hallmarked/dp/B07T6SWZZ3/ref=sr_1_45?qid=1679159928&s=jewelry&sr=1-45,4.0,"2,549",₹569,"₹1,199"
YouBella Celebrity Inspired Jewellery Adjustable Kamarband Wasist Belt Gold Plated Belly Chain for Women (Golden) (YB_Belt_2),accessories,Fashion & Silver Jewellery,https://m.media-amazon.com/images/W/IMAGERENDERING_521856-T2/images/I/41QBH6WXWBL._AC_UL320_.jpg,https://www.amazon.in/YouBella-Jewellery-Celebrity-Adjustable-Kamarband/dp/B08NG8XM45/ref=sr_1_46?qid=1679159928&s=jewelry&sr=1-46,4.1,"1,945",₹314,"₹1,599"
Shining Diva Fashion 18k Rose Gold Plated Latest Fancy Stylish Copper Zircon Bali Earrings for Women and Girls,accessories,Fashion & Silver Jewellery,https://m.media-amazon.com/images/W/IMAGERENDERING_521856-T2/images/I/513MF4mXUcL._AC_UL320_.jpg,https://www.amazon.in/Shining-Diva-Fashion-Earrings-12838er/dp/B099S9FJ52/ref=sr_1_47?qid=1679159928&s=jewelry&sr=1-47,4.1,"1,052",₹348,"₹1,999"
YouBella Jewellery Bracelets for Women Stylish Rose Gold Plated Crystal Bracelet Bangle Jewellery for Girls and Women,accessories,Fashion & Silver Jewellery,https://m.media-amazon.com/images/W/IMAGERENDERING_521856-T2/images/I/71P8z0DrFRL._AC_UL320_.jpg,https://www.amazon.in/YouBella-Plated-Bracelet-Golden-YBBN_91340A/dp/B071CMQ6N2/ref=sr_1_48?qid=1679159928&s=jewelry&sr=1-48,3.9,"10,837",₹195,"₹1,999"
ZAVERI PEARLS Antique Gold Tone Traditional Kundan Jhumki Earring & Ring Set For Women-ZPFK13163,accessories,Fashion & Silver Jewellery,https://m.media-amazon.com/images/W/IMAGERENDERING_521856-T2/images/I/711ym+72EBL._AC_UL320_.jpg,https://www.amazon.in/Zaveri-Antique-Traditional-Earring-Women-ZPFK13163/dp/B09Z8BHWQ7/ref=sr_1_49?qid=1679159928&s=jewelry&sr=1-49,3.8,119,₹370,"₹2,495"
"ITOS365 Jewellery Box for Women Wooden Flip Flap Flower Carved Design Handmade Gift, 8 inches",accessories,Fashion & Silver Jewellery,https://m.media-amazon.com/images/W/IMAGERENDERING_521856-T2/images/I/81mavw0VuUL._AC_UL320_.jpg,https://www.amazon.in/ITOS365-Jewellery-Wooden-Flower-Handmade/dp/B01691KLOS/ref=sr_1_50?qid=1679159928&s=jewelry&sr=1-50,4.1,"3,487",₹499,₹699
Jewels Galaxy Gold Plated Hoops Earrings Combo For Women/Girls,accessories,Fashion & Silver Jewellery,https://m.media-amazon.com/images/W/IMAGERENDERING_521856-T2/images/I/619JjFL2kSS._AC_UL320_.jpg,https://www.amazon.in/Jewels-Galaxy-Plated-Hoops-Earrings/dp/B098LDQ57Y/ref=sr_1_51?qid=1679159928&s=jewelry&sr=1-51,4.2,903,₹243,"₹1,999"
Vama Fashions Safety Dupatta and Dress Pins Brooch and Hijab Patli Lock stone Saree Pin for women,accessories,Fashion & Silver Jewellery,https://m.media-amazon.com/images/W/IMAGERENDERING_521856-T2/images/I/71GZGnVCcKL._AC_UL320_.jpg,https://www.amazon.in/Fashions-Safety-Dupatta-Dress-Brooch/dp/B0B3NCTKGC/ref=sr_1_52?qid=1679159928&s=jewelry&sr=1-52,4.2,50,₹256,"₹1,200"
"Shining Diva Fashion Latest Stylish Rose Gold Austrian Crystal Bracelet For Women And Girls (11942B), Free",accessories,Fashion & Silver Jewellery,https://m.media-amazon.com/images/W/IMAGERENDERING_521856-T2/images/I/51JBNLtPvQS._AC_UL320_.jpg,https://www.amazon.in/Shining-Diva-Fashion-Austrian-11942b/dp/B091MK45DB/ref=sr_1_53?qid=1679159928&s=jewelry&sr=1-53,3.8,763,₹258,"₹1,999"
GIVA 925 Sterling Silver 18k Gold Plated Anushka Sharma Star Constellation Necklace | Gift for Women & Girls | With Certif...,accessories,Fashion & Silver Jewellery,https://m.media-amazon.com/images/W/IMAGERENDERING_521856-T2/images/I/51Z+7mqgAXL._AC_UL320_.jpg,https://www.amazon.in/GIVA-Sterling-Constellation-Certificate-Authenticity/dp/B08Z328SSC/ref=sr_1_54?qid=1679159928&s=jewelry&sr=1-54,4.0,694,"₹1,614","₹2,998"
Party Propz Birthday Sash and Crown,accessories,Fashion & Silver Jewellery,https://m.media-amazon.com/images/W/IMAGERENDERING_521856-T2/images/I/51zgRUv-ZoL._AC_UL320_.jpg,https://www.amazon.in/party-birthday-decorations-friend-headband/dp/B08HGL2BXB/ref=sr_1_55?qid=1679159928&s=jewelry&sr=1-55,4.5,"1,357",₹544,₹799
Peora Gold Plated Crystal Pearl Long Necklace with Drop Earrings Traditional Ethnic Jewellery Set for Women Girls,accessories,Fashion & Silver Jewellery,https://m.media-amazon.com/images/W/IMAGERENDERING_521856-T2/images/I/71hDlS2ylwL._AC_UL320_.jpg,https://www.amazon.in/Peora-Necklace-Earrings-Traditional-Jewellery/dp/B08M3WZBB3/ref=sr_1_56?qid=1679159928&s=jewelry&sr=1-56,4.0,659,₹429,"₹2,626"
Brado Jewellery Micro Rose Gold Plated White American Diamond Butterfly Shape Necklace Golden Chain Pendant for Women and ...,accessories,Fashion & Silver Jewellery,https://m.media-amazon.com/images/W/IMAGERENDERING_521856-T2/images/I/61gxZw2mP4S._AC_UL320_.jpg,https://www.amazon.in/Brado-Jewellery-American-Butterfly-Necklace/dp/B092VBS5FQ/ref=sr_1_53_mod_primary_new?qid=1679159930&s=jewelry&sbo=RZvfv%2F%2FHxDF%2BO5021pAnSA%3D%3D&sr=1-53,3.9,"1,623",₹123,₹999
Sukkhi Ethnic Gold Plated Kundan Multi-String Set of 3 Necklace Combo for Women (SKR48716),accessories,Fashion & Silver Jewellery,https://m.media-amazon.com/images/W/IMAGERENDERING_521856-T2/images/I/71qsZwPnzOL._AC_UL320_.jpg,https://www.amazon.in/Sukkhi-Jewellery-Multi-String-Necklace-SKR48716/dp/B083JGH84Y/ref=sr_1_54?qid=1679159930&s=jewelry&sr=1-54,3.4,"4,756",₹368,"₹6,895"
ZAVERI PEARLS Multicolor Stones & Beads Multistrand Beaded Kundan Choker Necklace Earring & Ring Set For Women-ZPFK15095,accessories,Fashion & Silver Jewellery,https://m.media-amazon.com/images/W/IMAGERENDERING_521856-T2/images/I/71X00Abc83L._AC_UL320_.jpg,https://www.amazon.in/ZAVERI-PEARLS-Multicolor-Multistrand-Women-ZPFK15095/dp/B0BGSKTQR2/ref=sr_1_55?qid=1679159930&s=jewelry&sr=1-55,4.0,28,₹681,"₹3,450"
Jewels Galaxy Jewellery For Women Stackable Rings Set,accessories,Fashion & Silver Jewellery,https://m.media-amazon.com/images/W/IMAGERENDERING_521856-T2/images/I/61krTnTHulL._AC_UL320_.jpg,https://www.amazon.in/Jewels-Galaxy-Jewellery-Contemporary-JG-PC-RNGH-993/dp/B0BLSS64C6/ref=sr_1_56?qid=1679159930&s=jewelry&sr=1-56,4.3,33,₹261,"₹1,999"
ZAVERI PEARLS Gold Tone Kundan & Pearls Traditional Earring & Maangtikka Set For Women-ZPFK8541,accessories,Fashion & Silver Jewellery,https://m.media-amazon.com/images/W/IMAGERENDERING_521856-T2/images/I/71KVEoaT3QL._AC_UL320_.jpg,https://www.amazon.in/Zaveri-Pearls-Kundan-Jewellery-ZPFK8541/dp/B07PB53X68/ref=sr_1_57?qid=1679159930&s=jewelry&sr=1-57,4.1,"2,555",₹415,"₹1,997"
GIVA 925 Sterling Silver Mystic Blue Leaf Pendant with Link Chain | Necklace to Gift Women & Girls | With Certificate of A...,accessories,Fashion & Silver Jewellery,https://m.media-amazon.com/images/W/IMAGERENDERING_521856-T2/images/I/618RtEYXsiL._AC_UL320_.jpg,https://www.amazon.in/GIVA-Sterling-Necklace-Certificate-Authenticity/dp/B09DGMVYHW/ref=sr_1_58?qid=1679159930&s=jewelry&sr=1-58,4.2,211,"₹1,899","₹3,798"
Fashion Frill Charming Infinity Butterfly Neck Wear Gold Plated Chain Necklace For Women Girls Combo of 2 Chain Pendant Fo...,accessories,Fashion & Silver Jewellery,https://m.media-amazon.com/images/W/IMAGERENDERING_521856-T2/images/I/61rsaPCKnmL._AC_UL320_.jpg,https://www.amazon.in/Fashion-Frill-Charming-Infinity-Butterfly/dp/B0BDM8Y4NB/ref=sr_1_59?qid=1679159930&s=jewelry&sr=1-59,3.4,46,₹209,₹899
Cinderella Collection By Shining Diva Pearl Stud Earring For Women ( White )(Rrrrrrr6768Er),accessories,Fashion & Silver Jewellery,https://m.media-amazon.com/images/W/IMAGERENDERING_521856-T2/images/I/617oEnBNdhL._AC_UL320_.jpg,https://www.amazon.in/Cinderella-Collection-Shining-Diva-rrrrrrr6768er/dp/B00V6789R2/ref=sr_1_60?qid=1679159930&s=jewelry&sr=1-60,4.1,304,₹191,₹830
YouBella,accessories,Fashion & Silver Jewellery,https://m.media-amazon.com/images/W/IMAGERENDERING_521856-T2/images/I/71iJUvjnOZL._AC_UL320_.jpg,https://www.amazon.in/YouBella-Plated-Earrings-Off-White-YBEAR_31191/dp/B01N2WJ0OR/ref=sr_1_61?qid=1679159930&s=jewelry&sr=1-61,4.1,"2,973",₹195,"₹1,999"
Zaveri Pearls Multicolor Beaded Contemporary Butterfly Studs Earring For Women-ZPFK14364,accessories,Fashion & Silver Jewellery,https://m.media-amazon.com/images/W/IMAGERENDERING_521856-T2/images/I/71KAFRREFuL._AC_UL320_.jpg,https://www.amazon.in/Multicolor-Contemporary-Butterfly-Earring-Women-ZPFK14364/dp/B0B6HYPY4B/ref=sr_1_62?qid=1679159930&s=jewelry&sr=1-62,4.4,95,₹307,"₹2,050"
ZAVERI PEARLS Gold Tone Kundan Choker Necklace Earring Maangtikka & Ring Set For Women-ZPFK10799,accessories,Fashion & Silver Jewellery,https://m.media-amazon.com/images/W/IMAGERENDERING_521856-T2/images/I/81Bkqg-dDnL._AC_UL320_.jpg,https://www.amazon.in/Zaveri-Necklace-Earring-Maangtikka-Women-ZPFK10799/dp/B09GN9HGPN/ref=sr_1_63?qid=1679159930&s=jewelry&sr=1-63,4.1,177,₹753,"₹3,995"
Brado Jewellery Valentine Gift Gold Plated White American Diamond Square And One Love Heart Shape Pendant With Love Heart ...,accessories,Fashion & Silver Jewellery,https://m.media-amazon.com/images/W/IMAGERENDERING_521856-T2/images/I/71-zR18JEZL._AC_UL320_.jpg,https://www.amazon.in/Brado-Jewellery-Zirconia-Love-Heart/dp/B08TMQDKCZ/ref=sr_1_64?qid=1679159930&s=jewelry&sr=1-64,3.8,"2,018",₹175,₹999
Shining Diva Fashion Latest Choker Design Antique Kundan Traditional Necklace Jewellery Set for Women,accessories,Fashion & Silver Jewellery,https://m.media-amazon.com/images/W/IMAGERENDERING_521856-T2/images/I/81vLw-6u5NL._AC_UL320_.jpg,https://www.amazon.in/Shining-Diva-Fashion-Traditional-11279s/dp/B08L13PPNS/ref=sr_1_65?qid=1679159930&s=jewelry&sr=1-65,3.9,"2,645",₹258,"₹1,999"
Yellow Chimes Girls Friendship's Day Special 4 Best Friends Forever BFF Base Metal Crystal Alloy Necklace Chain Pendant Co...,accessories,Fashion & Silver Jewellery,https://m.media-amazon.com/images/W/IMAGERENDERING_521856-T2/images/I/61JVRvkXKvL._AC_UL320_.jpg,https://www.amazon.in/Yellow-Chimes-Friends-Pendant-YCFJPD-N31BST-SL/dp/B07GS2CJYH/ref=sr_1_66?qid=1679159930&s=jewelry&sr=1-66,4.0,"1,005",₹299,"₹1,375"
Clara 92.5 Sterling Silver White Gold Plated Heart Solitaire Pendant Chain Necklace for Women & Girls (Silver),accessories,Fashion & Silver Jewellery,https://m.media-amazon.com/images/W/IMAGERENDERING_521856-T2/images/I/516qD0+t16L._AC_UL320_.jpg,https://www.amazon.in/Clara-Sterling-Solitaire-Pendant-Necklace/dp/B079MB3VCJ/ref=sr_1_67?qid=1679159930&s=jewelry&sr=1-67,4.1,"1,442","₹1,419","₹3,331"
YouBella Jewellery Bohemian Multi-Color Earrings for Girls and Women,accessories,Fashion & Silver Jewellery,https://m.media-amazon.com/images/W/IMAGERENDERING_521856-T2/images/I/710dnChlpcS._AC_UL320_.jpg,https://www.amazon.in/YouBella-Precious-Jewellery-Bohemian-Multi-Color/dp/B01MU6O7H7/ref=sr_1_68?qid=1679159930&s=jewelry&sr=1-68,4.1,"7,345",₹195,"₹1,999"
Om Jewells Valentine Gift Rose Gold Plated Jewellery Combo Of 5 Adjustable Chain Bangle Bracelet Emblished With White Crys...,accessories,Fashion & Silver Jewellery,https://m.media-amazon.com/images/W/IMAGERENDERING_521856-T2/images/I/81zlKLbRAfL._AC_UL320_.jpg,https://www.amazon.in/Om-Jewells-Jewellery-Adjustable-CO1000280/dp/B07X34QNKP/ref=sr_1_73?qid=1679159930&s=jewelry&sr=1-73,3.8,"1,982",₹399,"₹2,399"
Fashion Frill Trendy Heart 18K Rose Gold Plated American Diamond Designer Adjustable Rings For Women Girls Combo of 3 Anni...,accessories,Fashion & Silver Jewellery,https://m.media-amazon.com/images/W/IMAGERENDERING_521856-T2/images/I/81OadPXqWaL._AC_UL320_.jpg,https://www.amazon.in/Fashion-Frill-American-Designer-Adjustable/dp/B0B7F56XB1/ref=sr_1_74?qid=1679159930&s=jewelry&sr=1-74,4.4,24,₹259,₹999
Yellow Chimes,accessories,Fashion & Silver Jewellery,https://m.media-amazon.com/images/W/IMAGERENDERING_521856-T2/images/I/41FB2hvq3mL._AC_UL320_.jpg,https://www.amazon.in/Yellow-Chimes-Crystal-Collection-YCFJPD-56WOLF-BK/dp/B07CV7LSWN/ref=sr_1_75?qid=1679159930&s=jewelry&sr=1-75,3.8,"2,932",₹219,"₹1,245"
