name,main_category,sub_category,image,link,ratings,no_of_ratings,discount_price,actual_price
CONSONANTIAM Tummy Trimmer Pump + Sweat Slim Belt A Complete Slimming Exercise Kit.,sports & fitness,Fitness Accessories,https://m.media-amazon.com/images/W/IMAGERENDERING_521856-T2/images/I/41aISaFyYQL._AC_UL320_.jpg,https://www.amazon.in/CONSONANTIAM-Tummy-Trimmer-Complete-Slimming/dp/B07ZL1Y5FP/ref=sr_1_865?qid=1679217671&s=sports&sr=1-865,3.5,481,₹399,₹990
Simran Sports Cotton Rope Fitness Skipping Rope Green,sports & fitness,Fitness Accessories,https://m.media-amazon.com/images/W/IMAGERENDERING_521856-T2/images/I/61J4b5EdYXL._AC_UL320_.jpg,https://www.amazon.in/Simran-Sports-Cotton-Fitness-Skipping/dp/B07QLJDZTB/ref=sr_1_866?qid=1679217671&s=sports&sr=1-866,,,₹145,₹599
"Simran Sports Skipping Rope, Skipping Rope for Exercise, PVC Handle Fitness Rope, Exercise Rope, PVC Rope Fitness Skipping...",sports & fitness,Fitness Accessories,https://m.media-amazon.com/images/W/IMAGERENDERING_521856-T2/images/I/91EIK-1oCUL._AC_UL320_.jpg,https://www.amazon.in/Simran-Sports-Handle-Fitness-Skipping/dp/B08D8DX4RJ/ref=sr_1_867?qid=1679217671&s=sports&sr=1-867,3.8,16,₹139,₹399
RT Body Shape Gym Shaker Bottle 700ML,sports & fitness,Fitness Accessories,https://m.media-amazon.com/images/W/IMAGERENDERING_521856-T2/images/I/61-ZZShIInL._AC_UL320_.jpg,https://www.amazon.in/Body-Shape-Shaker-Bottle-700ML/dp/B0BGCQRT23/ref=sr_1_868?qid=1679217671&s=sports&sr=1-868,,,₹299,₹450
Bybugy Men's and Women's Waist Slimming Neoprene Ab Belt Trainer for Faster Weight Loss Fat Burner Wrap Tummy Control/Bell...,sports & fitness,Fitness Accessories,https://m.media-amazon.com/images/W/IMAGERENDERING_521856-T2/images/I/71EEFMDy8VL._AC_UL320_.jpg,https://www.amazon.in/Bikart-Slimming-Neoprene-Trainer-Exercise/dp/B096L2T9G4/ref=sr_1_869?qid=1679217671&s=sports&sr=1-869,3.2,8,₹399,"₹1,099"
Sweat Belt for Women & Men Waist Trimmer Back Support Band & Tummy Control Sauna Belt for Stomach and Back Lumbar Support,sports & fitness,Fitness Accessories,https://m.media-amazon.com/images/W/IMAGERENDERING_521856-T2/images/I/71y4mPVUsqL._AC_UL320_.jpg,https://www.amazon.in/Trimmer-Support-Control-Stomach-Lumbar/dp/B0BGPS5TRG/ref=sr_1_870?qid=1679217671&s=sports&sr=1-870,2.8,3,₹227,₹749
"DOVEAZ® XTREME Sports Water Bottle for Gym, Protein Shaker Bottle, Gallon Water Bottle (1.5 LTR) with Mixer Ball and Strai...",sports & fitness,Fitness Accessories,https://m.media-amazon.com/images/W/IMAGERENDERING_521856-T2/images/I/61Uam5dSY2L._AC_UL320_.jpg,https://www.amazon.in/Sports-Unbreakable-Freezer-Gallon-Strainer/dp/B07YDYLLV6/ref=sr_1_871?qid=1679217671&s=sports&sr=1-871,4.3,23,₹230,₹499
Onekbhalo Wintex Plastic Flying Disc (Multicolour),sports & fitness,Fitness Accessories,https://m.media-amazon.com/images/W/IMAGERENDERING_521856-T2/images/I/61QMRQEiaDL._AC_UL320_.jpg,https://www.amazon.in/Wintex-Plastic-Multicolor-Flying-Disc/dp/B076DK3CCM/ref=sr_1_872?qid=1679217671&s=sports&sr=1-872,3.4,54,₹158,₹220
AJRO DEAL Double Spring Tummy Trimmer Premium Natural Latex and Foam Wrapped Handle Tummy Trimmer with Exercise Resistance...,sports & fitness,Fitness Accessories,https://m.media-amazon.com/images/W/IMAGERENDERING_521856-T2/images/I/61bTUajZPBL._AC_UL320_.jpg,https://www.amazon.in/Trimmer-Exercise-Resistance-Stretchable-Abdominal/dp/B0BCWM6BG3/ref=sr_1_873?qid=1679217671&s=sports&sr=1-873,5.0,1,₹529,₹569
ASHWAN SPORTS Gym Ball (95 cm),sports & fitness,Fitness Accessories,https://m.media-amazon.com/images/W/IMAGERENDERING_521856-T2/images/I/61n2lDzoS0L._AC_UL320_.jpg,https://www.amazon.in/ASHWAN-SPORTS-Gym-Ball-95/dp/B0B4FWTG2W/ref=sr_1_874?qid=1679217671&s=sports&sr=1-874,,,₹999,"₹1,799"
USI UNIVERSAL THE UNBEATABLE STALKY Skipping Rope (629ST),sports & fitness,Fitness Accessories,https://m.media-amazon.com/images/W/IMAGERENDERING_521856-T2/images/I/51SJL3ih++L._AC_UL320_.jpg,https://www.amazon.in/USI-Skipping-Rope-Stalky-Black/dp/B00IOQGMMW/ref=sr_1_875?qid=1679217671&s=sports&sr=1-875,4.4,6,₹449,₹499
"MSB SPORTS Hoop,Exercise Ring for Fitness (Multi-Colour) for Adults",sports & fitness,Fitness Accessories,https://m.media-amazon.com/images/W/IMAGERENDERING_521856-T2/images/I/41lvZx9PbFL._AC_UL320_.jpg,https://www.amazon.in/MSB-SPORTS-Exercise-Fitness-Multi-Colour/dp/B0B3RLQ9L7/ref=sr_1_876?qid=1679217671&s=sports&sr=1-876,5.0,2,₹198,"₹1,149"
"APRODO Torrido Fitness Gym Gloves with Wrist Wrap Support, for Men and Women, Free Size",sports & fitness,Fitness Accessories,https://m.media-amazon.com/images/W/IMAGERENDERING_521856-T2/images/I/71in0uJ4P8L._AC_UL320_.jpg,https://www.amazon.in/APRODO-Torrido-Fitness-Gloves-Support/dp/B09GB4TKQF/ref=sr_1_877?qid=1679217671&s=sports&sr=1-877,3.9,41,,₹299
Liffo® Gym Gloves for Men Women with Wrist Support Workout Weight Lifting and Exercise1 (Black Red) Neoprene Material,sports & fitness,Fitness Accessories,https://m.media-amazon.com/images/W/IMAGERENDERING_521856-T2/images/I/61HoNiUzLLL._AC_UL320_.jpg,https://www.amazon.in/Liffo%C2%AE-Sports-Support-Lifting-Exercise/dp/B08PD189HQ/ref=sr_1_878?qid=1679217671&s=sports&sr=1-878,3.9,576,₹299,₹649
"ArrowMax Exercise Gym Gloves for Men Workout with Wrist ,Cross Training, Weightlifting, Calisthenics, Great Hand Grip | Id...",sports & fitness,Fitness Accessories,https://m.media-amazon.com/images/W/IMAGERENDERING_521856-T2/images/I/91G3FQJl5fL._AC_UL320_.jpg,https://www.amazon.in/Arrowmax-Exercise-Weightlifting-Calisthenics-Activities/dp/B0974MVQQ9/ref=sr_1_879?qid=1679217671&s=sports&sr=1-879,4.4,11,₹385,₹845
"Nivia Python Sports Gloves, (X-Large) Sky Blue",sports & fitness,Fitness Accessories,https://m.media-amazon.com/images/W/IMAGERENDERING_521856-T2/images/I/61evuxoxATL._AC_UL320_.jpg,https://www.amazon.in/Nivia-887SB-Python-Sports-X-Large/dp/B07NBXCVXK/ref=sr_1_880?qid=1679217671&s=sports&sr=1-880,3.8,29,₹499,₹590
"SIGNATRON Fitness Puzzle Mat, Gym Floor Mat, Exercise Mat, EVA Foam Interlocking Tiles, Protective Flooring for Gym Equipm...",sports & fitness,Fitness Accessories,https://m.media-amazon.com/images/W/IMAGERENDERING_521856-T2/images/I/71B3aTVZN9L._AC_UL320_.jpg,https://www.amazon.in/SIGNATRON-Exercise-Interlocking-Protective-Equipment/dp/B09JSCPWV4/ref=sr_1_881?qid=1679217671&s=sports&sr=1-881,,,"₹2,499","₹3,999"
Stysol Hula Hoop for Girls Hola Hoopa Ring Ftness Gym Hoopla for Kids Hooping Adult 23 Inch,sports & fitness,Fitness Accessories,https://m.media-amazon.com/images/W/IMAGERENDERING_521856-T2/images/I/71Dq1ssHP0L._AC_UL320_.jpg,https://www.amazon.in/Stysol-Hula-Hoop-Ftness-Hooping/dp/B0B93M1Q5M/ref=sr_1_882?qid=1679217671&s=sports&sr=1-882,,,₹279,₹599
Kobo WTG-26 Weight Lifting Gym Gloves Hand Protector for Fitness Training,sports & fitness,Fitness Accessories,https://m.media-amazon.com/images/W/IMAGERENDERING_521856-T2/images/I/91u+Lrd37TL._AC_UL320_.jpg,https://www.amazon.in/Kobo-WTG-26-XL-Lifting-Protector-Training/dp/B07Q5T81GY/ref=sr_1_883_mod_primary_new?qid=1679217671&s=sports&sbo=RZvfv%2F%2FHxDF%2BO5021pAnSA%3D%3D&sr=1-883,3.8,268,₹415,₹450
ProsourceFit Slide Board,sports & fitness,Fitness Accessories,https://m.media-amazon.com/images/W/IMAGERENDERING_521856-T2/images/I/711MrIkz0RL._AC_UL320_.jpg,https://www.amazon.in/ProsourceFit-Exercise-Carrying-Low-Impact-Workouts/dp/B07FQV5WT6/ref=sr_1_884?qid=1679217671&s=sports&sr=1-884,,,,"₹10,568"
cotton black power workout exercise fitness weightlifting gym wrists wraps weight lifting strap with soft neoprene (Black),sports & fitness,Fitness Accessories,https://m.media-amazon.com/images/W/IMAGERENDERING_521856-T2/images/I/51ZqSwClutL._AC_UL320_.jpg,https://www.amazon.in/workout-exercise-fitness-weightlifting-neoprene/dp/B0BLZ775QY/ref=sr_1_885?qid=1679217671&s=sports&sr=1-885,,,₹299,₹999
"Skipping Rope with Adjustable Height for Women and Men Jumping Rope for Kids Sports Fitness Speed Skipping Rope, Girls Gym...",sports & fitness,Fitness Accessories,https://m.media-amazon.com/images/W/IMAGERENDERING_521856-T2/images/I/51QYPMq0kML._AC_UL320_.jpg,https://www.amazon.in/Skipping-Adjustable-Jumping-Fitness-Exercise/dp/B0BRQ58VDP/ref=sr_1_886?qid=1679217671&s=sports&sr=1-886,,,₹189,₹399
Pomic fit 600ml Shaker Bottles Workout Supplement Protein Shake Gym Sipper Bottle Protein Shaker Bottle For Men Women gym ...,sports & fitness,Fitness Accessories,https://m.media-amazon.com/images/W/IMAGERENDERING_521856-T2/images/I/61X2Ce2H9SL._AC_UL320_.jpg,https://www.amazon.in/Pomic-fit-Protein-Cycling-Stainless/dp/B09HCD4KW5/ref=sr_1_887?qid=1679217671&s=sports&sr=1-887,5.0,15,₹299,₹999
VICTORY Ultra Skin FIT Gym & Fitness Gloves (Camouflage Military Style),sports & fitness,Fitness Accessories,https://m.media-amazon.com/images/W/IMAGERENDERING_521856-T2/images/I/91gS95LfCsL._AC_UL320_.jpg,https://www.amazon.in/VICTORY-Fitness-Gloves-Camouflage-Military/dp/B08BS34V7H/ref=sr_1_888?qid=1679217671&s=sports&sr=1-888,,,₹280,₹499
Kobo WTA-04 Power Cotton Gym Support (Camouflage-Green)&Kobo WTA-03 Gym Support (Black),sports & fitness,Fitness Accessories,https://m.media-amazon.com/images/W/IMAGERENDERING_521856-T2/images/I/51n-d+3x3VL._AC_UL320_.jpg,https://www.amazon.in/Kobo-WTA-04-Cotton-Support-Camouflage-Green/dp/B08ZN4W7C9/ref=sr_1_889?qid=1679217673&s=sports&sr=1-889,4.0,1,,₹789
"Technix Professional Heavy Duty Exercise Ball, Gym Ball (Extra Thick PVC Material & Anti-Burst Material) Size 65 cm , Blue",sports & fitness,Fitness Accessories,https://m.media-amazon.com/images/W/IMAGERENDERING_521856-T2/images/I/616XzCqMU4L._AC_UL320_.jpg,https://www.amazon.in/Technix-Anti-Burst-Ball-Hand/dp/B07SPRH1LC/ref=sr_1_890?qid=1679217673&s=sports&sr=1-890,4.0,71,"₹1,299","₹1,750"
"Ring fight Weight-Lifting Workout Fitness Gloves | Callus-Guard Gym Barehand Grips | Support Alpha Cross-Training, Rowing,...",sports & fitness,Fitness Accessories,https://m.media-amazon.com/images/W/IMAGERENDERING_521856-T2/images/I/618zsWw0jRL._AC_UL320_.jpg,https://www.amazon.in/Ring-Weight-Lifting-Callus-Guard-Cross-Training-Power-Lifting/dp/B0B2JVLVP3/ref=sr_1_891?qid=1679217673&s=sports&sr=1-891,2.8,8,₹249,₹400
"Upsham Fitness Exercise Stability Yoga Ball/Swiss, Birthing, Gym Ball 65 cm",sports & fitness,Fitness Accessories,https://m.media-amazon.com/images/W/IMAGERENDERING_521856-T2/images/I/716dYLCSZmL._AC_UL320_.jpg,https://www.amazon.in/Upsham-Fitness-Exercise-Stability-Birthing/dp/B07PCGRSH2/ref=sr_1_892?qid=1679217673&s=sports&sr=1-892,3.0,2,₹569,₹999
