name,main_category,sub_category,image,link,ratings,no_of_ratings,discount_price,actual_price
"EasyHealth Professional Grade 22"" Wrist Supporter for Gym, Wrist Band for Gym Men and Women, Wrist Wrap/Straps Gym Accesso...",sports & fitness,Fitness Accessories,https://m.media-amazon.com/images/W/IMAGERENDERING_521856-T1/images/I/81jwPup+8+L._AC_UL320_.jpg,https://www.amazon.in/EasyHealth-Wrist-Wraps-Professional-Support/dp/B07Q8JBSX2/ref=sr_1_313?qid=1679217661&s=sports&sr=1-313,4.3,"1,943",₹249,₹499
"ALN Sweat Slim Belt Free Size Fat Burning Sauna Hot Neoprene Material Shaper Waist Trimmer Weight Loss, Lower Back Posture...",sports & fitness,Fitness Accessories,https://m.media-amazon.com/images/W/IMAGERENDERING_521856-T1/images/I/71W-l987ngL._AC_UL320_.jpg,https://www.amazon.in/ALN-Burning-Neoprene-Material-Multicolor/dp/B08LGB28PD/ref=sr_1_314?qid=1679217661&s=sports&sr=1-314,3.0,412,₹195,"₹1,899"
"Amazon Brand - Symactive Badminton Kit with 2 Racquets for Intermediate Players and Feather Shuttles, S333",sports & fitness,Fitness Accessories,https://m.media-amazon.com/images/W/IMAGERENDERING_521856-T1/images/I/81xrhOHl+sS._AC_UL320_.jpg,https://www.amazon.in/AmazonBasics-absym_saxgh3_86-Fitness-Accessory/dp/B08PWCYBFG/ref=sr_1_315?qid=1679217661&s=sports&sr=1-315,3.7,34,₹619,"₹1,179"
ALN® 5 in 1 Ab Tummy Trimmer with Sweat Belt Combo Weight Loss Fitness Equipment for Women & Men Multipurpose Body Toner S...,sports & fitness,Fitness Accessories,https://m.media-amazon.com/images/W/IMAGERENDERING_521856-T1/images/I/31lwgEhuSgL._AC_UL320_.jpg,https://www.amazon.in/Trimmer-Weight-Fitness-Equipment-Multipurpose/dp/B07XNVRBFG/ref=sr_1_316?qid=1679217661&s=sports&sr=1-316,3.5,961,₹329,"₹1,299"
8 Shaped Walking Exercise Mat,sports & fitness,Fitness Accessories,https://m.media-amazon.com/images/W/IMAGERENDERING_521856-T1/images/I/41G4DlDVZHS._AC_UL320_.jpg,https://www.amazon.in/Shaped-Walking-Exercise-Mat-White/dp/B081H5M94Y/ref=sr_1_317?qid=1679217661&s=sports&sr=1-317,4.2,70,"₹1,510","₹1,897"
"ELKO Natural Latex Tube Tummy Trimmer for Men & Women, Waist Fat Buster, Abs Exercise & Body Toner Equipment for Home & Gy...",sports & fitness,Fitness Accessories,https://m.media-amazon.com/images/W/IMAGERENDERING_521856-T1/images/I/61sTfzVP9YL._AC_UL320_.jpg,https://www.amazon.in/ELKO-Natural-Trimmer-Exercise-Equipment/dp/B09RPFRHBP/ref=sr_1_318?qid=1679217661&s=sports&sr=1-318,3.7,17,₹599,"₹1,299"
NAVEX Fitness Gym Ball (Multi-Color) (95CM),sports & fitness,Fitness Accessories,https://m.media-amazon.com/images/W/IMAGERENDERING_521856-T1/images/I/61PNKXQefzL._AC_UL320_.jpg,https://www.amazon.in/NAVEX-Fitness-Ball-Multi-Color-95CM/dp/B08KY833H6/ref=sr_1_319?qid=1679217661&s=sports&sr=1-319,5.0,1,₹995,"₹1,325"
Rexez Double Spring Tummy Trimmer Pro Waist Trimmer Abs Exerciser Body Toner Fat Buster Home Gym Home Exercise Equipment A...,sports & fitness,Fitness Accessories,https://m.media-amazon.com/images/W/IMAGERENDERING_521856-T1/images/I/41nNxPx16WL._AC_UL320_.jpg,https://www.amazon.in/Rexez-Exerciser-Exercise-Equipment-Abdominal/dp/B08DNXNKGW/ref=sr_1_320?qid=1679217661&s=sports&sr=1-320,3.1,7,₹255,₹999
Natural Yoga rope - Pocket Gym Rope - Abdominal Exercise Fitness Rope For Men And Women (yellow),sports & fitness,Fitness Accessories,https://m.media-amazon.com/images/W/IMAGERENDERING_521856-T1/images/I/61+Vh6rGZLL._AC_UL320_.jpg,https://www.amazon.in/Natural-Pocket-Abdominal-Exercise-yellow/dp/B08ZNFDXFF/ref=sr_1_321?qid=1679217661&s=sports&sr=1-321,3.8,85,₹399,₹500
"AURION Wrist Wraps 19"" Professional Grade with Thumb Loops - Wrist Support Braces for Men & Women - Weight Lifting, Xfit, ...",sports & fitness,Fitness Accessories,https://m.media-amazon.com/images/W/IMAGERENDERING_521856-T1/images/I/71ow9t6JAcL._AC_UL320_.jpg,https://www.amazon.in/Aurion-GYMWRAP-RED-Cotton-Lifting-Powerlifting/dp/B07PDYDXQR/ref=sr_1_322?qid=1679217661&s=sports&sr=1-322,3.8,50,₹177.35,₹199
"Walito Sauna Slim Belt/ Sweat Belt for Fat Loss, Tummy Trimming, for Both Men and Women (Red) by P-YOG",sports & fitness,Fitness Accessories,https://m.media-amazon.com/images/W/IMAGERENDERING_521856-T1/images/I/31akMNlUSWL._AC_UL320_.jpg,https://www.amazon.in/Walito-Sauna-Sweat-Tummy-Trimming/dp/B0BG4KS69Q/ref=sr_1_323?qid=1679217661&s=sports&sr=1-323,4.4,187,₹399,"₹1,499"
"Fitsy Adjustable Padded Ankle Straps for Cable Machine Gym Attachment, Legs, Butt, Glute Workout Exercises for Men and Wom...",sports & fitness,Fitness Accessories,https://m.media-amazon.com/images/W/IMAGERENDERING_521856-T1/images/I/61rAEogbacL._AC_UL320_.jpg,https://www.amazon.in/Fitsy-Adjustable-Attachment-Exercises-AR3083X2/dp/B08WX41JGK/ref=sr_1_324?qid=1679217661&s=sports&sr=1-324,4.2,38,₹399,₹749
"Puma Unisex-Adult TR Bottle Sportstyle, Varsity Green (5351818)",sports & fitness,Fitness Accessories,https://m.media-amazon.com/images/W/IMAGERENDERING_521856-T1/images/I/51qceI6Y--L._AC_UL320_.jpg,https://www.amazon.in/Puma-Unisex-Adult-Sportstyle-Varsity-5351818/dp/B0B3JTGJDC/ref=sr_1_325?qid=1679217661&s=sports&sr=1-325,5.0,2,₹900,₹999
Kobo Power Weight Lifting Training Gym Straps Hook Bar with Padded Wrist Support,sports & fitness,Fitness Accessories,https://m.media-amazon.com/images/W/IMAGERENDERING_521856-T1/images/I/4193Bi4u6sL._AC_UL320_.jpg,https://www.amazon.in/Kobo-WTA-01-Gym-Support-Black/dp/B00XXO2Q9I/ref=sr_1_326?qid=1679217661&s=sports&sr=1-326,3.8,126,₹844,₹950
"PANFIKH Cotton Grade Weight Lifting Strap for Gym with Neoprene Padded, Deadlift Strap for Weightlifting, Bodybuilding, Po...",sports & fitness,Fitness Accessories,https://m.media-amazon.com/images/W/IMAGERENDERING_521856-T1/images/I/71jeqhai-dL._AC_UL320_.jpg,https://www.amazon.in/PANFIKH-Premium-Cotton-Lifting-Padding/dp/B09ZYHMXSF/ref=sr_1_327?qid=1679217661&s=sports&sr=1-327,3.6,12,₹395,₹799
Reebok Resistance Tube,sports & fitness,Fitness Accessories,https://m.media-amazon.com/images/W/IMAGERENDERING_521856-T1/images/I/71qBQx1VPnS._AC_UL320_.jpg,https://www.amazon.in/Reebok-Heavy-Resistance-Tube-Free/dp/B014KPLYSC/ref=sr_1_328?qid=1679217661&s=sports&sr=1-328,4.4,737,"₹1,359","₹1,699"
"AmazonBasics Gym Gloves for Training and Exercise, L",sports & fitness,Fitness Accessories,https://m.media-amazon.com/images/W/IMAGERENDERING_521856-T1/images/I/81wMMV+IcKL._AC_UL320_.jpg,https://www.amazon.in/AmazonBasics-Gym-Gloves-Training-Exercise/dp/B08P6LTMYD/ref=sr_1_329?qid=1679217661&s=sports&sr=1-329,3.5,28,₹170,₹799
"INCHDOWN Double Spring Tummy Trimmer | Tone Muscle & Get Thinner, Solid Chrome Stainless Steel | Build to Last & Fit all B...",sports & fitness,Fitness Accessories,https://m.media-amazon.com/images/W/IMAGERENDERING_521856-T1/images/I/61SNEU3wrgL._AC_UL320_.jpg,https://www.amazon.in/INCHDOWN-Double-Trimmer-Thinner-Stainless/dp/B08KM3D24H/ref=sr_1_330?qid=1679217661&s=sports&sr=1-330,4.0,170,₹899,"₹1,499"
"FITSY® Adjustable Wrist Band for Gym Workout/Wrist Support Wraps for Weightlifting, Sports, Gym for Men Women, 1 Pair (NWA...",sports & fitness,Fitness Accessories,https://m.media-amazon.com/images/W/IMAGERENDERING_521856-T1/images/I/71d+IW1ONWL._AC_UL320_.jpg,https://www.amazon.in/Adjustable-Workout-Support-Weightlifting-NWAR3085/dp/B08KF4L6RH/ref=sr_1_331?qid=1679217661&s=sports&sr=1-331,3.7,15,₹499,₹799
"FIERCE FITNESS Sweat Slim Belt for Men and Women - Sauna Belt for Weight Loss Made of Neoprene, Tummy Trimmer and Gym Bag ...",sports & fitness,Fitness Accessories,https://m.media-amazon.com/images/W/IMAGERENDERING_521856-T1/images/I/71PLvE5jPjL._AC_UL320_.jpg,https://www.amazon.in/FIERCE-FITNESS-Sweat-Slim-Women/dp/B0BJ36628D/ref=sr_1_332?qid=1679217661&s=sports&sr=1-332,3.3,10,₹999,"₹2,999"
Cosco Anti Burst Gym Ball with Foot Pump,sports & fitness,Fitness Accessories,https://m.media-amazon.com/images/W/IMAGERENDERING_521856-T1/images/I/91y3XoLg2vL._AC_UL320_.jpg,https://www.amazon.in/Cosco-Anti-Burst-Ball-Foot/dp/B00KG604MM/ref=sr_1_333?qid=1679217661&s=sports&sr=1-333,4.2,245,"₹1,070","₹1,085"
Gmefvr 1 Pair Black Wrist Band for Tennis Badminton Volleyball Band 3.5 Inch,sports & fitness,Fitness Accessories,https://m.media-amazon.com/images/W/IMAGERENDERING_521856-T1/images/I/31eApHPZOiL._AC_UL320_.jpg,https://www.amazon.in/Gmefvr-Black-Tennis-Badminton-Volleyball/dp/B0B7XQ26GG/ref=sr_1_334?qid=1679217661&s=sports&sr=1-334,5.0,1,,₹125
"Omtex Sweat Band Soft, Stretchable and Super Absorbent Material Ideal for All Sports - 5 inches - Black",sports & fitness,Fitness Accessories,https://m.media-amazon.com/images/W/IMAGERENDERING_521856-T1/images/I/519qYp+MYYL._AC_UL320_.jpg,https://www.amazon.in/Omtex-Wrist-Sweat-Band-inches/dp/B07T8YX2X6/ref=sr_1_335?qid=1679217661&s=sports&sr=1-335,4.0,421,₹190,₹250
"DOVEAZ® Xtreme Sports Plastic Water Bottles for Office Use, Protein Shaker Bottle, Gallon Water Bottle (1 Liter) with Mixe...",sports & fitness,Fitness Accessories,https://m.media-amazon.com/images/W/IMAGERENDERING_521856-T1/images/I/61enpEPkQKS._AC_UL320_.jpg,https://www.amazon.in/DOVEAZ%C2%AE-Bottles-Protein-BPA-Free-Unbreakable/dp/B0993T1NKP/ref=sr_1_336?qid=1679217661&s=sports&sr=1-336,3.5,102,₹199,₹399
"Joyfit Fat Grip Pair for Lifting Heavy Weights, Foam Tubing Grips for Dumbbell, and Barbell, Thick Bar Grips for Weight an...",sports & fitness,Fitness Accessories,https://m.media-amazon.com/images/I/71D9KgBb9YL._AC_UL320_.jpg,https://www.amazon.in/Joyfit-Weightlifting-Non-Slip-Dumbbell-Building/dp/B07WG5K4TQ/ref=sr_1_481?qid=1679217664&s=sports&sr=1-481,4.0,34,,₹799
Neska Moda Unisex Dark Blue Cotton Wrist Band-MFN-WB31,sports & fitness,Fitness Accessories,https://m.media-amazon.com/images/I/81bPCm7L7sL._AC_UL320_.jpg,https://www.amazon.in/Neska-Moda-Unisex-Cotton-Band-MFN-WB31/dp/B07TFFPRX9/ref=sr_1_482?qid=1679217664&s=sports&sr=1-482,3.6,3,₹199,₹599
Xfinity Fitness Mens Gym Gloves with 12 inch Wrist Support and Anti Slip Grip Medium Size,sports & fitness,Fitness Accessories,https://m.media-amazon.com/images/I/61vg2LmXFjL._AC_UL320_.jpg,https://www.amazon.in/Xfinity-Fitness-Gloves-Wrist-Support/dp/B07R71BDGN/ref=sr_1_483?qid=1679217664&s=sports&sr=1-483,3.9,151,₹549,₹999
"Fit Vision Sweat Slim Belt, Men/Women - with Diet Plan, Waist Trainer Abs Sauna Belt, Pack of Sweat Sim Belt & Headband",sports & fitness,Fitness Accessories,https://m.media-amazon.com/images/I/71eMNOoor3L._AC_UL320_.jpg,https://www.amazon.in/Vision-Workout-Exercise-Stomach-Headband/dp/B09G781MKH/ref=sr_1_484?qid=1679217664&s=sports&sr=1-484,3.9,22,₹749,"₹2,499"
"Wyvern 5 In 1 Combo Tummy Twister With Abs Cruncher Tummy Trimmer Useful For Figure Tone-Up, Spine Fitness, Abs Trimming",sports & fitness,Fitness Accessories,https://m.media-amazon.com/images/I/61XDuiCo68L._AC_UL320_.jpg,https://www.amazon.in/Twister-Cruncher-Trimmer-Tone-Up-Trimming/dp/B07583Z521/ref=sr_1_485?qid=1679217664&s=sports&sr=1-485,3.8,21,₹594,₹899
"Kobo 4"" Foam Padded Weight Lifting Belt Back Gym Strap Training Support Fitness Exercise Bodybuilding",sports & fitness,Fitness Accessories,https://m.media-amazon.com/images/I/810KzGk3oPL._AC_UL320_.jpg,https://www.amazon.in/Kobo-WTB-04-Neoprene-Weight-Lifting/dp/B071VS3LXG/ref=sr_1_486?qid=1679217664&s=sports&sr=1-486,3.9,613,₹616,₹660
"AmazonBasics High Density Exercise Equipment and Treadmill Gym PVC Floor Mat - 2.5 x 6 Feet, Black",sports & fitness,Fitness Accessories,https://m.media-amazon.com/images/I/71yJonLso3S._AC_UL320_.jpg,https://www.amazon.in/AmazonBasics-Density-Exercise-Equipment-Treadmill/dp/B07BLBQZ93/ref=sr_1_487?qid=1679217664&s=sports&sr=1-487,4.5,"1,678","₹2,099","₹3,900"
"DIABLO Weight Lifting Bar Straps, Wrist Support/Gym Strap",sports & fitness,Fitness Accessories,https://m.media-amazon.com/images/I/616ox6OLUWL._AC_UL320_.jpg,https://www.amazon.in/DIABLO-Weight-Lifting-bar-Straps/dp/B007RLBJFK/ref=sr_1_488?qid=1679217664&s=sports&sr=1-488,4.0,19,₹219,₹599
Leosportz Weight Lifting Straps with Wrist Support - Wrist Straps for Weightlifting - Superior Deadlift Straps and Workout...,sports & fitness,Fitness Accessories,https://m.media-amazon.com/images/I/71v+9VoZYvL._AC_UL320_.jpg,https://www.amazon.in/Leosportz-Weight-Lifting-Straps-Support/dp/B09G3L9KML/ref=sr_1_489?qid=1679217664&s=sports&sr=1-489,3.2,26,₹284.05,₹500
"LIVOX Push up Rack Board and Dual Wheel Abs Roller with Tummy Trimmer, Skipping Rope - Home Gym Equipments for Men and Wom...",sports & fitness,Fitness Accessories,https://m.media-amazon.com/images/I/81+Y3dZ6A2L._AC_UL320_.jpg,https://www.amazon.in/LIVOX-Board-Roller-Trimmer-Skipping/dp/B09QZ1QPVF/ref=sr_1_490?qid=1679217664&s=sports&sr=1-490,5.0,2,₹989,"₹2,800"
"JetFire Gym Gloves Pure Leather | Weight Lifting Gloves with 12"" Wrist Wraps Support for Gym Workout, Crossfit, Weightlift...",sports & fitness,Fitness Accessories,https://m.media-amazon.com/images/I/71e0IA99LOL._AC_UL320_.jpg,https://www.amazon.in/JetFire-Leather-Crossfit-Weightlifting-Training/dp/B07CZXD8VT/ref=sr_1_491?qid=1679217664&s=sports&sr=1-491,3.6,83,₹199,₹999
Rilekh Spike Gym Ball Large Sensory Ball Fitness Anti Burst Slip Resistant Yoga Exercise Balls Gym Fitness Point Massage B...,sports & fitness,Fitness Accessories,https://m.media-amazon.com/images/I/41vjziGLwbL._AC_UL320_.jpg,https://www.amazon.in/Rilekh-Sensory-Fitness-Resistant-Exercise/dp/B0BWF663P6/ref=sr_1_492?qid=1679217664&s=sports&sr=1-492,,,"₹1,780","₹2,800"
"Massage Yoga Exercise Ball, 65cm / 85cm Yoga Sport Ball Sensory Massage Trigger Point for Full Body Muscle Reflexology, Yo...",sports & fitness,Fitness Accessories,https://m.media-amazon.com/images/I/714Q6XkIbML._AC_UL320_.jpg,https://www.amazon.in/SAVING-BASKET-Burst-Exercise-Rubber/dp/B01EAOQWDU/ref=sr_1_493?qid=1679217664&s=sports&sr=1-493,3.9,61,₹699,"₹1,200"
UJEAVETTE Jump Rope Pad 58cm Non Slip Shock Absorption Sound Insulation Skipping Mat 58cmx58cmx0.6cm Blue,sports & fitness,Fitness Accessories,https://m.media-amazon.com/images/I/61oe517KGEL._AC_UL320_.jpg,https://www.amazon.in/UJEAVETTE-Absorption-Insulation-Skipping-58cmx58cmx0-6cm/dp/B0BJV1R85F/ref=sr_1_494?qid=1679217664&s=sports&sr=1-494,,,"₹1,598","₹3,226"
"Nivia Street Sports 750 ml Shaker, Plastic, Yellow",sports & fitness,Fitness Accessories,https://m.media-amazon.com/images/I/71Cv4zIQRFL._AC_UL320_.jpg,https://www.amazon.in/Nivia-1304-Street-Plastic-Sports/dp/B07GRSJMQX/ref=sr_1_495?qid=1679217664&s=sports&sr=1-495,3.9,178,₹215.99,₹230
Verceys Unisex Sports Wrist Sweatbands Hand Wrap Tennis Badminton Band (Black) -Pack of 6,sports & fitness,Fitness Accessories,https://m.media-amazon.com/images/I/819-DfJmwgL._AC_UL320_.jpg,https://www.amazon.in/Verceys-Unisex-Sports-Sweatbands-Badminton/dp/B072FK5DPG/ref=sr_1_496?qid=1679217664&s=sports&sr=1-496,3.8,53,₹249,₹897
"Nasmodo 4-16 pcs 1 Inch/25mm Gym Floor mat for Heavy Workout Puzzle mat Home Exercise, Gym Equipment mat Interlocking Eva ...",sports & fitness,Fitness Accessories,https://m.media-amazon.com/images/I/811-hqlOvyL._AC_UL320_.jpg,https://www.amazon.in/Nasmodo-Workout-Exercise-Interlocking-Flooring/dp/B09RMKVXKH/ref=sr_1_497?qid=1679217664&s=sports&sr=1-497,3.9,106,"₹6,499","₹12,000"
"USI UNIVERSAL THE UNBEATABLE Knee Wraps 203cm(80""), 733KW3 Line Weight Lifting Knee Wraps Training Straps Power Lifting Gy...",sports & fitness,Fitness Accessories,https://m.media-amazon.com/images/I/61JNDBC1XaL._AC_UL320_.jpg,https://www.amazon.in/USI-LINE-KNEE-WRAPS/dp/B01NBKVB3I/ref=sr_1_498?qid=1679217664&s=sports&sr=1-498,4.3,19,"₹1,836","₹2,149"
YUVI TRADERS Unisex Steel Tummy Trimmer -Sweat Belt-Twister -Toning Tube (4 in 1 Combo) Burn Off Tummy Fat Extra Calories ...,sports & fitness,Fitness Accessories,https://m.media-amazon.com/images/I/71wrSIt4JEL._AC_UL320_.jpg,https://www.amazon.in/YUVI-TRADERS-Belt-Twister-Equipment-Multicolour/dp/B08XWC6GG6/ref=sr_1_499?qid=1679217664&s=sports&sr=1-499,3.7,56,₹685,"₹1,499"
Amazon Basics Thigh Exerciser,sports & fitness,Fitness Accessories,https://m.media-amazon.com/images/I/61PR2VurbOL._AC_UL320_.jpg,https://www.amazon.in/AmazonBasics-absym_saxgh3_25-Thigh-Exerciser/dp/B08P6LVMVF/ref=sr_1_500?qid=1679217664&s=sports&sr=1-500,3.7,9,₹274.48,₹749
"Reebok B78436 Speed Rope, Free Size (Grey)",sports & fitness,Fitness Accessories,https://m.media-amazon.com/images/I/71Y4IUVxw9L._AC_UL320_.jpg,https://www.amazon.in/Reebok-B78436-Speed-Rope-Free/dp/B014KPLT9Q/ref=sr_1_501?qid=1679217664&s=sports&sr=1-501,4.0,386,₹796,₹799
"AmazonBasics Power Twister for Arm Exercise, 20 Kg, Beginner",sports & fitness,Fitness Accessories,https://m.media-amazon.com/images/I/61+4Ph6-jXL._AC_UL320_.jpg,https://www.amazon.in/AmazonBasics-Power-Twister-Exercise-Beginner/dp/B08P6M5PG3/ref=sr_1_502?qid=1679217664&s=sports&sr=1-502,4.4,49,₹569,₹999
"Toyshine Thick Cotton Wristbands (5 INCH), Athletic Sweat Bands for Sports Activities - Pack of 2 Pairs Blue/Neon (SSTP)",sports & fitness,Fitness Accessories,https://m.media-amazon.com/images/I/81HqfKcdbVL._AC_UL320_.jpg,https://www.amazon.in/Toyshine-Cotton-Wristbands-Athletic-Activities/dp/B0BL2PXNR3/ref=sr_1_503?qid=1679217664&s=sports&sr=1-503,3.4,3,₹521,₹749
"Vifitkit Skipping Rope for Men and Women, Jump Rope With Adjustable Height for Exercise, Gym, Sports, Lightweight, Tangle-...",sports & fitness,Fitness Accessories,https://m.media-amazon.com/images/I/71gqT2u-w-L._AC_UL320_.jpg,https://www.amazon.in/Vifitkit-Skipping-Activities-Lightweight-Comfortable/dp/B0B45NR4B6/ref=sr_1_504?qid=1679217664&s=sports&sr=1-504,3.8,18,₹99,₹499
"Puma Unisex-Adult TR stainless steel bottle, Black-Fur Real (5386807)",sports & fitness,Fitness Accessories,https://m.media-amazon.com/images/I/61T+zBZttfL._AC_UL320_.jpg,https://www.amazon.in/Puma-Unisex-Adult-stainless-Black-Fur-5386807/dp/B0B3JSV5GQ/ref=sr_1_673?qid=1679217668&s=sports&sr=1-673,,,₹779,"₹1,299"
"C I Hula Hoop , Hoopa Hula , Exercise Ring for Fitness for Boys , Girls , Kids and Adults ( Multi Color ) | Fitness Hoops...",sports & fitness,Fitness Accessories,https://m.media-amazon.com/images/I/51zOa-YYjAL._AC_UL320_.jpg,https://www.amazon.in/Exercise-Fitness-Adults-Equipments-Outdoors/dp/B09C664G25/ref=sr_1_674?qid=1679217668&s=sports&sr=1-674,3.6,109,₹295,₹599
"HASHTAG FITNESS Wall/Ceiling Mount Anchor Hooks, Battle Rope Anchor Hooks, Home Gym Strength Training Equipments",sports & fitness,Fitness Accessories,https://m.media-amazon.com/images/I/612keyVkuvL._AC_UL320_.jpg,https://www.amazon.in/HASHTAG-FITNESS-Strength-Training-Equipments/dp/B09LR5ZZ9M/ref=sr_1_675?qid=1679217668&s=sports&sr=1-675,3.5,2,₹369,"₹2,599"
"RUNNING Rope for Men, Women & Children - Jump Rope for Exercise Workout Ball Bearing Skipping Rope",sports & fitness,Fitness Accessories,https://m.media-amazon.com/images/I/512HIN8ll0L._AC_UL320_.jpg,https://www.amazon.in/RUNNING-Rope-Men-Women-Children/dp/B0BPPJ2Y1J/ref=sr_1_676?qid=1679217668&s=sports&sr=1-676,5.0,1,₹179,₹299
"QUADA Gloves for Men, Gym Gloves for Women for Workout, Gym Gloves for Boys with Wrist Support, Hand Gloves for Gym, Fitne...",sports & fitness,Fitness Accessories,https://m.media-amazon.com/images/I/51XSfyyOsOL._AC_UL320_.jpg,https://www.amazon.in/QUADA-Workout-Support-Weightlifting-Exercise/dp/B08W1FJFD2/ref=sr_1_677?qid=1679217668&s=sports&sr=1-677,3.4,5,₹245,₹699
Reebok Professional Aerobic Step (White/Black),sports & fitness,Fitness Accessories,https://m.media-amazon.com/images/I/61glurHHC6L._AC_UL320_.jpg,https://www.amazon.in/Reebok-Professional-Aerobic-White-Black/dp/B08TP13QW7/ref=sr_1_678?qid=1679217668&s=sports&sr=1-678,4.8,258,"₹9,000","₹14,999"
"Glaceon Foam Flotation Belt for Water Aerobics, EVA Self-Taught Swim Floating Belt Swimming Equipment Floating Waist Ring ...",sports & fitness,Fitness Accessories,https://m.media-amazon.com/images/I/41GII4+u3dS._AC_UL320_.jpg,https://www.amazon.in/Glaceon-Flotation-Self-Taught-Equipment-Beginners/dp/B097TN93P7/ref=sr_1_679?qid=1679217668&s=sports&sr=1-679,,,₹899,"₹1,999"
"Theraband PVC Exercise Mini Ball, Size 9 Inch Diameter, (Yellow)",sports & fitness,Fitness Accessories,https://m.media-amazon.com/images/I/71sk8YMfoSL._AC_UL320_.jpg,https://www.amazon.in/TheraBand-23095-Mini-Ball/dp/B005VXFJ7K/ref=sr_1_680?qid=1679217668&s=sports&sr=1-680,4.3,77,"₹1,930","₹2,500"
Cougar Weight Lifting Strap Non - Slip Weight Lifting Straps Power Lifting Dead-Lifts Gym bar Wrist Wrap Support Dumbbell ...,sports & fitness,Fitness Accessories,https://m.media-amazon.com/images/I/71V3am-LsEL._AC_UL320_.jpg,https://www.amazon.in/Cougar-Weight-Lifting-Strap-Colour/dp/B07HK88LDM/ref=sr_1_681?qid=1679217668&s=sports&sr=1-681,4.2,24,₹415,₹430
Wearslim® Skipping Rope with Ball Bearings Rapid Speed Jump Rope Cable and 6” Memory Foam Handles Ideal for Aerobic Exerci...,sports & fitness,Fitness Accessories,https://m.media-amazon.com/images/I/71FKYB6DqQL._AC_UL320_.jpg,https://www.amazon.in/Wearslim%C2%AE-Skipping-Bearings-Exercise-Training/dp/B0963TVJCX/ref=sr_1_682?qid=1679217668&s=sports&sr=1-682,3.9,157,₹224,₹999
Spinway Power Ball,sports & fitness,Fitness Accessories,https://m.media-amazon.com/images/I/713Wp5qhWnL._AC_UL320_.jpg,https://www.amazon.in/Spinway%C2%AE-Forearm-strengthener-exerciser-Yellow/dp/B0752639HB/ref=sr_1_683?qid=1679217668&s=sports&sr=1-683,3.4,8,"₹1,380","₹2,599"
"AJRO DEAL Tummy Trimmer for Men & Women - Ab Exerciser Equipment, Abdominal Workout Tummy Trimmer for Home & Gym Use - Sto...",sports & fitness,Fitness Accessories,https://m.media-amazon.com/images/I/51QKYj38vBL._AC_UL320_.jpg,https://www.amazon.in/Tummy-Trimmer-Men-Women-Exerciser/dp/B0BCVKFVFR/ref=sr_1_684?qid=1679217668&s=sports&sr=1-684,,,₹249,₹349
"JoyFit Workout Gloves with Wrist Support, Comfortable Padding and Finger Protection for Home and Gym Training, Fitness, We...",sports & fitness,Fitness Accessories,https://m.media-amazon.com/images/I/71Fua3stwyS._AC_UL320_.jpg,https://www.amazon.in/Joyfit-Support-Workout-Training-Activities/dp/B0774LLDNY/ref=sr_1_685?qid=1679217668&s=sports&sr=1-685,4.1,177,₹899,"₹1,300"
Skypremium wooden jumping rope for men women,sports & fitness,Fitness Accessories,https://m.media-amazon.com/images/I/7141x7IwZ4S._AC_UL320_.jpg,https://www.amazon.in/Skypremium-wooden-jumping-rope-women/dp/B09GM3T2R3/ref=sr_1_686?qid=1679217668&s=sports&sr=1-686,3.8,222,₹150,₹300
SWEET SWEAT WAIST TRIMMER Shaper Belt Non-Tearable Tummy Trimmer Slimming Belt for Men and Women,sports & fitness,Fitness Accessories,https://m.media-amazon.com/images/I/51BvRhCHppL._AC_UL320_.jpg,https://www.amazon.in/SWEET-SWEAT-WAIST-TRIMMER-Non-Tearable/dp/B08PCQZRC8/ref=sr_1_687?qid=1679217668&s=sports&sr=1-687,2.9,11,₹399,₹999
"Vaquita- Interlocking EVA Foam Padding, Non-Toxic Floor Tiles Mat (Multicolour, 24 inch X 24 inches X 12MM) - 8 Pack",sports & fitness,Fitness Accessories,https://m.media-amazon.com/images/I/719B5pCMvRL._AC_UL320_.jpg,https://www.amazon.in/Vaquita-Interlocking-Padding-Non-Toxic-Multicolour/dp/B08KXZL24R/ref=sr_1_688?qid=1679217668&s=sports&sr=1-688,3.8,17,"₹2,289","₹8,000"
"Red Venus Wooden Handle Steel Wire Transparent Adjustable PVC Skipping Rope | Jump Rope for Men, Women and Kids",sports & fitness,Fitness Accessories,https://m.media-amazon.com/images/I/81g7UckYoXL._AC_UL320_.jpg,https://www.amazon.in/VenusTM-Skipping-Adjustable-Training-Exercise/dp/B08F2V8GTX/ref=sr_1_689?qid=1679217668&s=sports&sr=1-689,4.3,25,₹282,"₹1,499"
"EMERET® Unisex Sweat Fat Burner-Waist Trimmer Slimming Belt (Black, Free Size)",sports & fitness,Fitness Accessories,https://m.media-amazon.com/images/I/41+d3NeGk3L._AC_UL320_.jpg,https://www.amazon.in/EMERET%C2%AE-Unisex-Burner-Waist-Trimmer-Slimming/dp/B089K8GCQD/ref=sr_1_690?qid=1679217668&s=sports&sr=1-690,3.4,58,₹172,₹499
"PD Belt, Adjustable Breathable Peritoneal Dialysis Belt For Hospital Nephrology Patients For Peritoneal Dialysis (L)",sports & fitness,Fitness Accessories,https://m.media-amazon.com/images/I/61nFRqo+Y+L._AC_UL320_.jpg,https://www.amazon.in/Adjustable-Breathable-Peritoneal-Dialysis-Nephrology/dp/B0BPVX7VX8/ref=sr_1_691?qid=1679217668&s=sports&sr=1-691,,,₹837,"₹1,918"
Kobo Imported Back Support Weight Lifting Belt - Gym Belt,sports & fitness,Fitness Accessories,https://m.media-amazon.com/images/I/51lOYP1dU4L._AC_UL320_.jpg,https://www.amazon.in/Kobo-WTB-03-Neoprene-Support-Medium/dp/B011BRVL3K/ref=sr_1_692?qid=1679217668&s=sports&sr=1-692,4.2,370,₹800,₹810
"LEOPAX Waist Support Belt Neoprene Ab Belt Trainer, Stomach Wrap Tummy Belt/Belly Tummy Yoga Wrap Back Exercise Body Wrap...",sports & fitness,Fitness Accessories,https://m.media-amazon.com/images/I/7100CvVk0VL._AC_UL320_.jpg,https://www.amazon.in/LEOPAX-Support-Neoprene-Trainer-Exercise/dp/B09N999QTQ/ref=sr_1_693?qid=1679217668&s=sports&sr=1-693,4.6,5,₹524,"₹1,699"
"JUMP ROPES WORLD | Long Handle Beaded Skipping Rope | Jumping Rope | Athletics | (9-ft, Red)",sports & fitness,Fitness Accessories,https://m.media-amazon.com/images/I/91xxDTO42IL._AC_UL320_.jpg,https://www.amazon.in/Handle-Beaded-Skipping-Jumping-Athletics/dp/B0BFKV31ND/ref=sr_1_694?qid=1679217668&s=sports&sr=1-694,,,₹320,₹509
RPC99® Tummy Trimmer Single Spring Ab Exerciser Fat Burner for Men & Women Ab Exerciser (Black),sports & fitness,Fitness Accessories,https://m.media-amazon.com/images/I/410LuB1GqDL._AC_UL320_.jpg,https://www.amazon.in/Trends-Maker-Trimmer-Single-Exerciser/dp/B08CRMK61C/ref=sr_1_695?qid=1679217668&s=sports&sr=1-695,3.7,43,₹249,₹399
"JUMP ROPES WORLD,MIDDLE HANDLE Beaded Skipping Rope For Men's, Kids Beaded Jump Rope. (10ft, Rainbow)",sports & fitness,Fitness Accessories,https://m.media-amazon.com/images/I/81ErTjfYjNL._AC_UL320_.jpg,https://www.amazon.in/MIDDLE-HANDLE-Beaded-Skipping-Rainbow/dp/B0BKL151L4/ref=sr_1_696?qid=1679217668&s=sports&sr=1-696,4.5,2,₹290,₹540
