name,main_category,sub_category,image,link,ratings,no_of_ratings,discount_price,actual_price
Agrico Tata Garden Tools-Hedge Shear Wooden Handle Lawn Or Grass Cutter | Made Of Chrome Vanadium Steel | 8 Blade Size,home & kitchen,Garden & Outdoors,https://m.media-amazon.com/images/W/IMAGERENDERING_521856-T2/images/I/71TUJV28LzL._AC_UL320_.jpg,https://www.amazon.in/TATA-AGRICO-Wooden-Handle-Cutter/dp/B075BWSTQ9/ref=sr_1_885?qid=1679213610&s=garden&sr=1-885,4.2,706,₹612,₹719
"Kundi 6-Tier Cart Planter Stand, Outdoor Flower Rack Flower Pot Display Rack 62x69x22cm (White) (White)",home & kitchen,Garden & Outdoors,https://m.media-amazon.com/images/W/IMAGERENDERING_521856-T2/images/I/715IrZrgpvL._AC_UL320_.jpg,https://www.amazon.in/Kundi-Planter-Outdoor-Display-62x69x22cm/dp/B0BMP2634H/ref=sr_1_886?qid=1679213610&s=garden&sr=1-886,3.9,572,"₹1,450","₹2,999"
"Garden of eden 10 KG 100% Organic Loose Cocopeat for Indoor & Outdoor Plants, Kitchen Garden, Terrace Gardening Soil Manur...",home & kitchen,Garden & Outdoors,https://m.media-amazon.com/images/W/IMAGERENDERING_521856-T2/images/I/61cmh8MkjmL._AC_UL320_.jpg,https://www.amazon.in/Garden-eden-Organic-Cocopeat-Gardening/dp/B0B3T6JYGG/ref=sr_1_887?qid=1679213610&s=garden&sr=1-887,3.6,89,₹399,₹799
Dharti Enterprise Grow Bag Plant Bag Black UV Protected - 12 X 12 inch (40),home & kitchen,Garden & Outdoors,https://m.media-amazon.com/images/W/IMAGERENDERING_521856-T2/images/I/61iTWicnn1L._AC_UL320_.jpg,https://www.amazon.in/Dharti-Enterprise-Nursery-Plastic-Protected/dp/B07CS7W8PZ/ref=sr_1_888?qid=1679213610&s=garden&sr=1-888,3.8,"1,800",₹169,₹299
"LifeKrafts Hook and Loop Tape (Size 25 Meter x 20mm Width) Self Adhesive Hook Tape & Non-Adhesive Loop, Strong Glue with D...",home & kitchen,Garden & Outdoors,https://m.media-amazon.com/images/I/71kjPkULc0L._AC_UL320_.jpg,https://www.amazon.in/LifeKrafts-Adhesive-Strong-Durable-Quality/dp/B085GKQFCT/ref=sr_1_1057?qid=1679213613&s=garden&sr=1-1057,4.2,451,₹759,"₹1,299"
ANANDI GREEN'S Hdpe Uv Protected 260 GSM Round Green Colour Plants Grow Bags Suitable for Terrace and Vegetable Gardening ...,home & kitchen,Garden & Outdoors,https://m.media-amazon.com/images/I/61r-Qb3Op9L._AC_UL320_.jpg,https://www.amazon.in/Anandi-Greens-Protected-Standing-Gardening/dp/B09MW9CQ39/ref=sr_1_1058?qid=1679213613&s=garden&sr=1-1058,4.0,72,₹404,₹649
KriVat Water Pressure Washing Nozzle Sprayer Adjustable Heavy Duty Nozzle with High Pressure Water Gun for Car Bike Window...,home & kitchen,Garden & Outdoors,https://m.media-amazon.com/images/I/31ZezjBXwHL._AC_UL320_.jpg,https://www.amazon.in/KriVat-Pressure-Washing-Adjustable-Cleaning/dp/B0BCH88F5D/ref=sr_1_1059?qid=1679213613&s=garden&sr=1-1059,3.2,38,₹449,₹999
"Naitik Creation Soil Tester 3-in-1 Soil Moisture, pH Meter Test Kit with Light pH Acidity Detector Analyzer for Agricultur...",home & kitchen,Garden & Outdoors,https://m.media-amazon.com/images/I/71RJrvuuGbL._AC_UL320_.jpg,https://www.amazon.in/Naitik-Creation-Moisture-Hydroponic-Intensity/dp/B07FNQDLSY/ref=sr_1_1060?qid=1679213613&s=garden&sr=1-1060,3.9,657,₹581,"₹1,499"
Daily Dump Compost Speedup with Microbes for Quality Composting - 950gms (1kg),home & kitchen,Garden & Outdoors,https://m.media-amazon.com/images/I/71B-dsHOnJL._AC_UL320_.jpg,https://www.amazon.in/Daily-Dump-Compost-Speedup-Microbes/dp/B013JUAMIW/ref=sr_1_1061?qid=1679213613&s=garden&sr=1-1061,4.1,522,₹299,₹300
Zollyss Harmless Mouse Rat Insect Glue Traps Terminator (Set of 6 Pc),home & kitchen,Garden & Outdoors,https://m.media-amazon.com/images/I/61Gg04BfKZL._AC_UL320_.jpg,https://www.amazon.in/Zollyss-Terminator-Powerful-Repeller-Harmless/dp/B0798N61MP/ref=sr_1_1062?qid=1679213613&s=garden&sr=1-1062,3.5,315,₹349,₹899
"YUVAGREEN Terrace Gardening Leafy Vegetable Green Grow Bag (12"" X 12"") - (Pack of 5)",home & kitchen,Garden & Outdoors,https://m.media-amazon.com/images/I/61G6O1NSdoL._AC_UL320_.jpg,https://www.amazon.in/Evergreen-Gardening-Green-Grow-Bag/dp/B0744BWVRM/ref=sr_1_1063?qid=1679213613&s=garden&sr=1-1063,4.3,"1,632",₹499,₹699
Mangalam CamPure Air Freshener (Combo) Pack of 4 - Original Camphor | Rose & Camphor | Jasmine & Camphor | Lemon & Camphor...,home & kitchen,Garden & Outdoors,https://m.media-amazon.com/images/I/719BvhcCc6L._AC_UL320_.jpg,https://www.amazon.in/Mangalam-CamPure-Freshener-Original-Camphor/dp/B07P41MBDM/ref=sr_1_1064?qid=1679213613&s=garden&sr=1-1064,4.0,382,₹569,₹796
"UGAOO Lady Finger or Okra Vegetable Seeds (Green, Pack of 10g)",home & kitchen,Garden & Outdoors,https://m.media-amazon.com/images/I/71MoWfMSzmL._AC_UL320_.jpg,https://www.amazon.in/UGAOO-Finger-Vegetable-Seeds-Green/dp/B09MLPVD74/ref=sr_1_1065?qid=1679213613&s=garden&sr=1-1065,3.7,19,,₹99
"SSUCA Solar Charge Controller 10A 20A 30A, Intelligent Battery Regulator for Solar Panel LCD Display with USB Port 12 Volt...",home & kitchen,Garden & Outdoors,https://m.media-amazon.com/images/I/615wPRou6aL._AC_UL320_.jpg,https://www.amazon.in/SSUCA-Controller-Intelligent-Battery-Regulator/dp/B0BHZ3NYYB/ref=sr_1_1066?qid=1679213613&s=garden&sr=1-1066,4.0,38,₹699.99,"₹2,999"
"Kraft Seeds Balsam Mix Flower Seeds (1 Packet, 300 Seeds ) Fragrant Flowering Plants Seeds for Home Gardening | Natural an...",home & kitchen,Garden & Outdoors,https://m.media-amazon.com/images/I/51PKCmhbmUL._AC_UL320_.jpg,https://www.amazon.in/Kraft-Seeds-Heirloom-Non-GMO-Variety/dp/B09XMRZYQQ/ref=sr_1_1067?qid=1679213613&s=garden&sr=1-1067,3.7,8,₹139,₹149
Jakmister 500W Red Colour Air Blower,home & kitchen,Garden & Outdoors,https://m.media-amazon.com/images/I/51V4-wQAc2L._AC_UL320_.jpg,https://www.amazon.in/Jakmister-500W-Red-Colour-Blower/dp/B07R3WWR37/ref=sr_1_1068?qid=1679213613&s=garden&sr=1-1068,3.8,560,₹649,"₹1,900"
"All Out Sattva (Single Refill), Pack of 1",home & kitchen,Garden & Outdoors,https://m.media-amazon.com/images/I/81pa-dA7CLL._AC_UL320_.jpg,https://www.amazon.in/All-Out-Sattva-Refill/dp/B07J2ZG1QZ/ref=sr_1_1069?qid=1679213613&s=garden&sr=1-1069,4.1,211,₹58,₹75
Swingzy Cotton Netted Rope Hanging Swing Chair for Adults & Kids/Swing for Balcony/Outdoor Swing Chair/Hammock Swing for H...,home & kitchen,Garden & Outdoors,https://m.media-amazon.com/images/I/61FSSVRUcgL._AC_UL320_.jpg,https://www.amazon.in/Swingzy-Hanging-Outdoor-Balcony-Capacity/dp/B089WCK31T/ref=sr_1_1070?qid=1679213613&s=garden&sr=1-1070,3.8,"3,394",₹930,"₹3,290"
"Garden Genie Hydro Grow A & B Nutrient (250ML) | NPK, Macro & Micro Nutrients for Plants | Balanced Plant Nutrition for Hy...",home & kitchen,Garden & Outdoors,https://m.media-amazon.com/images/I/51oM3IeCgwL._AC_UL320_.jpg,https://www.amazon.in/Garden-Genie-Hydro-Grow-Nutrient/dp/B09J1F9RLQ/ref=sr_1_1071?qid=1679213613&s=garden&sr=1-1071,3.8,29,₹290,₹600
"Waste Decomposer 4 Bottles | NCOF Certified Organic Waste Decomposer for Agriculture, Plants, Gardening, and Farming | Com...",home & kitchen,Garden & Outdoors,https://m.media-amazon.com/images/I/61FXwyYuHxL._AC_UL320_.jpg,https://www.amazon.in/Decomposer-Certified-Agriculture-Gardening-Vegetable/dp/B0BQ2SBBTZ/ref=sr_1_1072?qid=1679213613&s=garden&sr=1-1072,3.0,1,₹150,₹300
"Ugaoo ZZ Plant, Zamia Air Purifer Plant With Self Watering Pot (Zamioculcas Zamiifolia)",home & kitchen,Garden & Outdoors,https://m.media-amazon.com/images/I/61pXhWDEmUL._AC_UL320_.jpg,https://www.amazon.in/Ugaoo-Plant-Purifer-Zamioculcas-Zamiifolia/dp/B07TT4MKRN/ref=sr_1_1073?qid=1679213613&s=garden&sr=1-1073,4.1,596,₹499,₹995
Ugaoo Liquid Seaweed Fertilizer for Plant - Growth Booster Plants Tonic (250 ml),home & kitchen,Garden & Outdoors,https://m.media-amazon.com/images/I/518st+EUzmL._AC_UL320_.jpg,https://www.amazon.in/Ugaoo-Liquid-Seaweed-Fertilizer-Plant/dp/B08TR2GCLS/ref=sr_1_1074?qid=1679213613&s=garden&sr=1-1074,3.9,102,₹149,₹399
"Concorde Fan Sprinkler Rose Big, Garden Tool",home & kitchen,Garden & Outdoors,https://m.media-amazon.com/images/I/31IP+MF7FGL._AC_UL320_.jpg,https://www.amazon.in/Concorde-Sprinkler-Rose-Garden-Tool/dp/B00T9BJ1I8/ref=sr_1_1075_mod_primary_new?qid=1679213613&s=garden&sbo=RZvfv%2F%2FHxDF%2BO5021pAnSA%3D%3D&sr=1-1075,4.2,168,₹94,₹150
"UGAOO Cosmos Flower Seeds (Purple and White, Pack of 100)",home & kitchen,Garden & Outdoors,https://m.media-amazon.com/images/I/61lknL7FscL._AC_UL320_.jpg,https://www.amazon.in/UGAOO-Cosmos-Flower-Seeds-Purple/dp/B09MLP9N9X/ref=sr_1_1076?qid=1679213613&s=garden&sr=1-1076,3.5,41,₹99,₹155
"HASTHIP® 4Pcs Universal Tap Connector, Brass Pipe Connector for Tap, Garden Hose Quick Connectors, 1/2 & 3/4 Inch Universa...",home & kitchen,Garden & Outdoors,https://m.media-amazon.com/images/I/61SiPoeg66L._AC_UL320_.jpg,https://www.amazon.in/HASTHIP%C2%AE-4PCS-Brass-Hose-Connectors/dp/B09DFPFBP7/ref=sr_1_1077?qid=1679213613&s=garden&sr=1-1077,4.0,53,₹789,"₹1,108"
Rolling Nature Combo of Good Luck Air Purifying Live Pink Syngonium and Green Syngonium Plant in Red Ceramic Pot,home & kitchen,Garden & Outdoors,https://m.media-amazon.com/images/I/71lAIQ7qkiL._AC_UL320_.jpg,https://www.amazon.in/Rolling-Nature-Purifying-Syngonium-Ceramic/dp/B07DW64RJK/ref=sr_1_1078?qid=1679213613&s=garden&sr=1-1078,3.6,532,₹649,"₹1,499"
"Rare Climbing Rose Live Flower Plant (Climbing Rose Plant, Purple)",home & kitchen,Garden & Outdoors,https://m.media-amazon.com/images/I/512-zCdYwwL._AC_UL320_.jpg,https://www.amazon.in/Rare-Climbing-Flower-Plant-Purple/dp/B0BJLQ6L8D/ref=sr_1_1079?qid=1679213613&s=garden&sr=1-1079,2.9,5,₹299,₹599
Homehop Solar Light Outdoor Waterproof Flickering Mashaal Flame Torch Garden Pathway Lawn Lamp,home & kitchen,Garden & Outdoors,https://m.media-amazon.com/images/I/71Z0rRW1V4L._AC_UL320_.jpg,https://www.amazon.in/Homehop-Outdoor-Waterproof-Flickering-Mashaal/dp/B0BHNBK7TT/ref=sr_1_1080?qid=1679213613&s=garden&sr=1-1080,3.4,93,₹699,"₹1,520"
"NIPPO Terminator II Rechargeable Mosquito Bat, Fast Charging, Lithium-Ion Battery, Shock-Proof, Insect Killer, 6 Months Wa...",home & kitchen,Garden & Outdoors,https://m.media-amazon.com/images/I/81Ll3Krl85L._AC_UL320_.jpg,https://www.amazon.in/Nippo-Terminator-II-Mosquito-Bat/dp/B07SH4DBMD/ref=sr_1_1129?qid=1679213615&s=garden&sr=1-1129,3.8,"1,383",₹780,"₹1,140"
"Polygon Green 50 Pcs 6” Thermoform Plastic Nursery Pot/Pots, Plant Pots, Seed Starting Pot Flower Plant Container (Black)-...",home & kitchen,Garden & Outdoors,https://m.media-amazon.com/images/I/61hDx5tIaML._AC_UL320_.jpg,https://www.amazon.in/Thermoform-Nursery-Starting-Container-Polythene/dp/B0BLSTTRB5/ref=sr_1_1130?qid=1679213615&s=garden&sr=1-1130,2.8,9,₹599,"₹1,999"
"THEMISTO Digital LCD Cooking Food Meat Probe Kitchen BQB Thermometer Temperature Test Pen - Instant Read,Plastic, pack of 1",home & kitchen,Garden & Outdoors,https://m.media-amazon.com/images/I/613mIGZFCcL._AC_UL320_.jpg,https://www.amazon.in/THEMISTO-Digital-Cooking-Thermometer-Temperature/dp/B08ZJ1849Z/ref=sr_1_1131?qid=1679213615&s=garden&sr=1-1131,4.0,82,₹234,₹599
Tree House Wooden Plant Stand for Balcony Living Room Indoor Outdoor Plant Stand Foldable Display Rack Storage Rack for Pa...,home & kitchen,Garden & Outdoors,https://m.media-amazon.com/images/I/61iaeIpLVcL._AC_UL320_.jpg,https://www.amazon.in/Tree-House-Balcony-Outdoor-Foldable/dp/B0BTTFPFDB/ref=sr_1_1132?qid=1679213615&s=garden&sr=1-1132,2.5,3,₹468,"₹2,999"
