name,main_category,sub_category,image,link,ratings,no_of_ratings,discount_price,actual_price
IMPOWER Self Defence Pepper Spray for Woman Safety - 55 ML (Pack of 2),home & kitchen,Garden & Outdoors,https://m.media-amazon.com/images/W/IMAGERENDERING_521856-T1/images/I/61vYHhnKALL._AC_UL320_.jpg,https://www.amazon.in/IMPOWER-Defence-Unisex-Pepper-Sprays/dp/B075XRD8DT/ref=sr_1_385?qid=1679213602&s=garden&sr=1-385,4.3,913,₹299,₹700
"FESTEL Skytuch Shock Proof Multipurpose 8-to-24 Foot Extendable Telescopic Pole with (2 Attachments) Coconut Plucker, Mang...",home & kitchen,Garden & Outdoors,https://m.media-amazon.com/images/W/IMAGERENDERING_521856-T1/images/I/61gqXkRRz6L._AC_UL320_.jpg,https://www.amazon.in/Festel-Skytuch-Telescopic-Coconut-Plucker/dp/B08DVB54G7/ref=sr_1_386?qid=1679213602&s=garden&sr=1-386,4.1,754,"₹3,500","₹5,000"
"Yellow Weaves Canvas Cloth Insulated Travel Lunch/Tiffin/Storage Bag for Office, College & School (Grey, Big Size)",home & kitchen,Garden & Outdoors,https://m.media-amazon.com/images/W/IMAGERENDERING_521856-T1/images/I/91ECJPr9PPS._AC_UL320_.jpg,https://www.amazon.in/Yellow-Weaves-Insulated-Storage-College/dp/B085HCT4N8/ref=sr_1_387?qid=1679213602&s=garden&sr=1-387,4.1,"1,463",₹289,₹448
Sharpex Garden Steel Material Hose Hanger - Wall Mounted Watering Hose Holders - Heavy Duty Portable Irrigation Hose Hange...,home & kitchen,Garden & Outdoors,https://m.media-amazon.com/images/W/IMAGERENDERING_521856-T1/images/I/81X0M8GZc1L._AC_UL320_.jpg,https://www.amazon.in/Sharpex-Mount-Hanger-Durable-Material/dp/B00M0N1NAG/ref=sr_1_388?qid=1679213602&s=garden&sr=1-388,4.3,"1,835",₹859,₹999
"Kraft Seeds Cocopeat for Home Garden (1kg) | Expands Upto 5 Ltrs | Natural and Eco-Friendly | Hydroponic Plants, Kitchen a...",home & kitchen,Garden & Outdoors,https://m.media-amazon.com/images/W/IMAGERENDERING_521856-T1/images/I/71knonPnIGL._AC_UL320_.jpg,https://www.amazon.in/Kraft-Seeds-Cocopeat-Gardening-Expands/dp/B08KVJSMP8/ref=sr_1_389?qid=1679213602&s=garden&sr=1-389,4.2,"2,014",₹119,₹150
"Kraft Seeds Plastic Window Planters (1 Pc, 13 Inch, Red) | Planting Pots for Home Plants | Flower Plant Pots for Home & Ba...",home & kitchen,Garden & Outdoors,https://m.media-amazon.com/images/W/IMAGERENDERING_521856-T1/images/I/51Le-mg+UuL._AC_UL320_.jpg,https://www.amazon.in/Kraft-Seeds-Planter-Jupiter-Balcony/dp/B08PCH4RVP/ref=sr_1_390?qid=1679213602&s=garden&sr=1-390,3.9,154,,₹99
"Sulfar 3pcs Mini Wire Brush Set (Steel/Nylon/Brass Brush), Black, 0244",home & kitchen,Garden & Outdoors,https://m.media-amazon.com/images/W/IMAGERENDERING_521856-T1/images/I/51XuOAq01JL._AC_UL320_.jpg,https://www.amazon.in/Sulfar-Brush-Steel-Nylon-0244/dp/B09BYXMJJL/ref=sr_1_391?qid=1679213602&s=garden&sr=1-391,3.9,364,,₹99
"Leafy Tales Bone Meal Manure for Plants - 1 KG, Brown",home & kitchen,Garden & Outdoors,https://m.media-amazon.com/images/W/IMAGERENDERING_521856-T1/images/I/61IiinrbaPL._AC_UL320_.jpg,https://www.amazon.in/Leafy-Tales-Bone-Meal-Manure/dp/B0963N4QW4/ref=sr_1_392?qid=1679213602&s=garden&sr=1-392,3.7,127,₹112,₹149
"Leafy Tales Plastic Small Hook Hanging Pot, Multicolor 20.5 x 14.5 x 8.5 cm, 5 Pieces (Small Hook - 5)",home & kitchen,Garden & Outdoors,https://m.media-amazon.com/images/W/IMAGERENDERING_521856-T1/images/I/61+jd6XO8KS._AC_UL320_.jpg,https://www.amazon.in/Leafy-Tales-Small-Hook-Multicolor/dp/B08WZ2P6P9/ref=sr_1_393?qid=1679213602&s=garden&sr=1-393,4.1,162,₹291,₹349
Nutri Organics Halim Seeds 250 Grams - Aliv Seeds | Haleem Seeds | Seeds for Eating | Immunity Booster Superfood | Asaliy...,home & kitchen,Garden & Outdoors,https://m.media-amazon.com/images/W/IMAGERENDERING_521856-T1/images/I/61qWsn5cM5L._AC_UL320_.jpg,https://www.amazon.in/Nutri-Organics-Gondh-Combo-Pouch/dp/B08HV569TF/ref=sr_1_394?qid=1679213602&s=garden&sr=1-394,3.7,42,₹99,₹199
IronLands Heavy 2 in 1 Step With Rubberized Base Indoor Outdoor Flower Pot Plant Stand 29 inches (2.5 Feet) Length Floor R...,home & kitchen,Garden & Outdoors,https://m.media-amazon.com/images/W/IMAGERENDERING_521856-T1/images/I/71J9PJAkERL._AC_UL320_.jpg,https://www.amazon.in/Raj-Rubberized-Indoor-Outdoor-Balcony/dp/B08ZMT3Z45/ref=sr_1_395?qid=1679213602&s=garden&sr=1-395,4.0,971,"₹1,350","₹3,500"
"TrustBasket 3 Step Stand for Multiple Plants and Pots Stand, Indoor Shelf Holder Rack, Gardening Stand,Indoor Outdoor (Bla...",home & kitchen,Garden & Outdoors,https://m.media-amazon.com/images/W/IMAGERENDERING_521856-T1/images/I/71I+cRJbIbL._AC_UL320_.jpg,https://www.amazon.in/TrustBasket-Multiple-Plants-Gardening-Outdoor/dp/B0846M9L1R/ref=sr_1_396?qid=1679213602&s=garden&sr=1-396,4.0,"1,837","₹2,899","₹3,210"
Earth Rated Mosquito Bats Racket Killer Five Nights Mosquito Killer Racket Rechargeable Handheld Electric Fly Swatter Mosq...,home & kitchen,Garden & Outdoors,https://m.media-amazon.com/images/W/IMAGERENDERING_521856-T1/images/I/61S4W8bd6dL._AC_UL320_.jpg,https://www.amazon.in/Earth-Rated-Mosquito-Rechargeable-Handheld/dp/B0BS6Y6CPY/ref=sr_1_397?qid=1679213602&s=garden&sr=1-397,4.3,132,₹799,"₹1,499"
"Kraft Seeds Plastic Hanging Planters for Home & Balcony Garden (12 Pcs, 8 Inch, Multicolor) | Flower Hanging Pots for Plan...",home & kitchen,Garden & Outdoors,https://m.media-amazon.com/images/W/IMAGERENDERING_521856-T1/images/I/71Q6JWR9x4L._AC_UL320_.jpg,https://www.amazon.in/Kraft-Seeds-Flower-Pots-25/dp/B09CNG966R/ref=sr_1_398?qid=1679213602&s=garden&sr=1-398,4.2,998,₹625,₹799
"Kraft Seeds Plastic Window Planters (1 Pc, 13 Inch, White) | Planting Pots for Home Plants | Flower Planters for Home Gard...",home & kitchen,Garden & Outdoors,https://m.media-amazon.com/images/W/IMAGERENDERING_521856-T1/images/I/41utk15m9-L._AC_UL320_.jpg,https://www.amazon.in/Kraft-Seeds-Planter-Jupiter-Balcony/dp/B08PCLGQJ4/ref=sr_1_399?qid=1679213602&s=garden&sr=1-399,4.1,258,,₹99
Rushwak 30pcs Plant Climbing Wall Clips Self-Adhesive Money Plant Support Clips Vine Plant Climbing Fixing Clip Hook Invis...,home & kitchen,Garden & Outdoors,https://m.media-amazon.com/images/W/IMAGERENDERING_521856-T1/images/I/61+S1khbuUL._AC_UL320_.jpg,https://www.amazon.in/Rushwak-Climbing-Self-Adhesive-Invisible-Climbers/dp/B09SGCSW13/ref=sr_1_400?qid=1679213602&s=garden&sr=1-400,3.6,365,₹299,₹999
"Sampri Nx Eco Friendly Mosquito Killer Trap Lamp, Mosquito Killer lamp for Home, USB Powered Electronic Fly Inhaler (Blac...",home & kitchen,Garden & Outdoors,https://m.media-amazon.com/images/W/IMAGERENDERING_521856-T1/images/I/413M9Ub594L._AC_UL320_.jpg,https://www.amazon.in/Sampri-Nx-Friendly-Electronic-Black-Cobra-VV/dp/B0BW7BT896/ref=sr_1_401?qid=1679213602&s=garden&sr=1-401,3.8,62,₹699,"₹2,899"
"Doctor Heally Lizard Repellent For Home Best, Insect Killer, Lizard Killer, Lizard Spray for Home Herbal Lizard Repellent ...",home & kitchen,Garden & Outdoors,https://m.media-amazon.com/images/W/IMAGERENDERING_521856-T1/images/I/416L7pPke+L._AC_UL320_.jpg,https://www.amazon.in/Doctor-Repellent-Sage-Choice-Repellant/dp/B0BVRS7SXY/ref=sr_1_402?qid=1679213602&s=garden&sr=1-402,4.7,24,₹329,"₹1,000"
Kuber Industries Mosquito Net for Double Bed|Easily Foldable Machardani|Nylon Strong Net|King Queen Size & Corrosion Resis...,home & kitchen,Garden & Outdoors,https://m.media-amazon.com/images/W/IMAGERENDERING_521856-T1/images/I/61VyVCnTQtL._AC_UL320_.jpg,https://www.amazon.in/Kuber-Industries-Mosquito-Foldable-Saviours/dp/B083QX5WDG/ref=sr_1_403?qid=1679213602&s=garden&sr=1-403,3.8,"1,686",₹689,"₹1,699"
GRAND SHOP Balloon Arch Garland Decorating Reusable Strip Dot Glue Tape (Pack of 2),home & kitchen,Garden & Outdoors,https://m.media-amazon.com/images/W/IMAGERENDERING_521856-T1/images/I/710zwrMgNXS._AC_UL320_.jpg,https://www.amazon.in/GRAND-SHOP-Plastic-Decorating-Transparent/dp/B098BFCVT4/ref=sr_1_404?qid=1679213602&s=garden&sr=1-404,4.0,457,₹176,₹250
Chefman Premium Barbeque Grill with 6 Skewers Coal-Base Gardening Barbeque (Black),home & kitchen,Garden & Outdoors,https://m.media-amazon.com/images/W/IMAGERENDERING_521856-T1/images/I/71z2vJCor1L._AC_UL320_.jpg,https://www.amazon.in/Chefman-Barbeque-Skewers-Coal-Base-Gardening/dp/B07X7J8THF/ref=sr_1_405?qid=1679213602&s=garden&sr=1-405,3.7,85,₹723.17,"₹2,999"
"Bayer Peak Traders Maxforce Forte Gel For Cockroaches, 30 Grams Gel Per Tube",home & kitchen,Garden & Outdoors,https://m.media-amazon.com/images/W/IMAGERENDERING_521856-T1/images/I/51VYzkHJOhL._AC_UL320_.jpg,https://www.amazon.in/Bayer-Maxforce-Forte-Cockroaches-Gram/dp/B07HKHW4HZ/ref=sr_1_406_mod_primary_new?qid=1679213602&s=garden&sbo=RZvfv%2F%2FHxDF%2BO5021pAnSA%3D%3D&sr=1-406,3.9,387,₹550,₹650
"UGANIO PLANT Plastic Pot Saucer, Base Plate Planter Tray (Brown, 6-inch) - Set of 12",home & kitchen,Garden & Outdoors,https://m.media-amazon.com/images/W/IMAGERENDERING_521856-T1/images/I/71grJwrqKRL._AC_UL320_.jpg,https://www.amazon.in/Uganio-Plastic-Saucer-Planter-6-inch/dp/B09Z968NSG/ref=sr_1_407?qid=1679213602&s=garden&sr=1-407,3.8,111,₹199,₹348
"GOLDFLOWER Garden Sprinkler, Adjustable 360 Degree Rotation Lawn Sprinkler, Large Area Coverage, Multipurpose Yard Sprinkl...",home & kitchen,Garden & Outdoors,https://m.media-amazon.com/images/W/IMAGERENDERING_521856-T1/images/I/91k2zQqFEJL._AC_UL320_.jpg,https://www.amazon.in/GOLDFLOWER-Adjustable-Multipurpose-Sprinklers-Irrigation/dp/B08VDK5L5S/ref=sr_1_408?qid=1679213602&s=garden&sr=1-408,3.8,"3,030",₹299,₹999
"Tong Garden Imported - Salted Peanuts Combo, 400g",home & kitchen,Garden & Outdoors,https://m.media-amazon.com/images/I/81vQ72tAMXL._AC_UL320_.jpg,https://www.amazon.in/Tong-Garden-Salted-Peanuts-400g/dp/B00M7TFH3W/ref=sr_1_793?qid=1679213608&s=garden&sr=1-793,4.4,"1,084",,₹350
"LAFILLETTE High Pressure Brass Hose Nozzle Adjustable Water Spray gun for car Motorbike And Any Vehicle Cleaning, Gardenin...",home & kitchen,Garden & Outdoors,https://m.media-amazon.com/images/I/71tT0Eb8J+L._AC_UL320_.jpg,https://www.amazon.in/SGL-Adjustable-Water-Spray-Gun/dp/B07G529GTX/ref=sr_1_794?qid=1679213608&s=garden&sr=1-794,3.4,"1,489",₹316,"₹1,199"
"Oblivion Gardening Tools - Flower Cutter/Garden Shear/Pruner & Big Garden Tool Set Wooden Handle Hand Cultivator,Trowel, G...",home & kitchen,Garden & Outdoors,https://m.media-amazon.com/images/I/51Ru1mAcNfL._AC_UL320_.jpg,https://www.amazon.in/Oblivion-Gardening-Tools-Flover-Cultivator/dp/B08NVMNQRP/ref=sr_1_795?qid=1679213608&s=garden&sr=1-795,3.8,"1,116",₹219,₹499
"SCOTMEN Terrace Gardening Leafy Vegetable Grow Bag - 15""X06"" (Green , Pack of 5)",home & kitchen,Garden & Outdoors,https://m.media-amazon.com/images/I/31vtuzSfZBL._AC_UL320_.jpg,https://www.amazon.in/SCOTMEN-Terrace-Gardening-Leafy-Vegetable/dp/B085414JBC/ref=sr_1_796?qid=1679213608&s=garden&sr=1-796,4.3,115,₹399,₹405
Nano Gold Agriculture Growth Promoter for All Plants & Crops | 1 Litre,home & kitchen,Garden & Outdoors,https://m.media-amazon.com/images/I/51Vtb5wUi4L._AC_UL320_.jpg,https://www.amazon.in/Nano-Gold-Agriculture-Growth-Promoter/dp/B09H72TM87/ref=sr_1_797?qid=1679213608&s=garden&sr=1-797,3.8,81,₹649,₹999
"SIOPAWORLD Plant Climbing Wall Fixture Clips 30Pcs, Self-Adhesive Hook Vines Traction Invisible Holder Supporting Wire Fix...",home & kitchen,Garden & Outdoors,https://m.media-amazon.com/images/I/61m4pKn6rkL._AC_UL320_.jpg,https://www.amazon.in/SIOPAWORLD-Wall-Self-Adhesive-Supporting-Fixing/dp/B0BTMCFV23/ref=sr_1_798?qid=1679213608&s=garden&sr=1-798,5.0,2,₹199,₹499
"TrustBasket Bird Feeder – Garden Bird Feeder,Hanging Metal Feeder for Balcony,Home,Indoor and Outdoor(Black)",home & kitchen,Garden & Outdoors,https://m.media-amazon.com/images/I/61JMOEt7ETL._AC_UL320_.jpg,https://www.amazon.in/TrustBasket-Bird-Feeder-Hanging-Balcony/dp/B08N4F6XKD/ref=sr_1_799?qid=1679213608&s=garden&sr=1-799,3.9,327,₹249,₹399
"Seedscare Morning Glory, 50 Seeds Mixed",home & kitchen,Garden & Outdoors,https://m.media-amazon.com/images/I/81EJK1WkmXL._AC_UL320_.jpg,https://www.amazon.in/Seedscare-Morning-Glory-Mixed-Seeds/dp/B01DR0S7SQ/ref=sr_1_800?qid=1679213608&s=garden&sr=1-800,3.4,"5,739",₹176,₹180
Unitedlys Diatomaceous Earth Powder | 100% Organic Pest Control for your Garden | Effective Ant Repellent and Cockroach Ki...,home & kitchen,Garden & Outdoors,https://m.media-amazon.com/images/I/71z-lYu24OL._AC_UL320_.jpg,https://www.amazon.in/Unitedlys%C2%AE-Diatomaceous-Effective-Organic-Friendly/dp/B08LBCT648/ref=sr_1_801?qid=1679213608&s=garden&sr=1-801,3.7,407,₹236,₹499
Ugaoo Sansevieria Golden Hahnii Snake Plant with Self Watering Pot,home & kitchen,Garden & Outdoors,https://m.media-amazon.com/images/I/51+8PuVqdfL._AC_UL320_.jpg,https://www.amazon.in/Ugaoo-Sansevieria-Golden-Hahnii-Snake/dp/B071NMHPSY/ref=sr_1_802?qid=1679213608&s=garden&sr=1-802,4.0,"1,043",₹399,₹595
The Gifti® White Double Gudhal/Hibiscus Live Plant in Poly Bags [Plant Hight 28 CM],home & kitchen,Garden & Outdoors,https://m.media-amazon.com/images/I/51PTG+IgBkL._AC_UL320_.jpg,https://www.amazon.in/GIFTI-Gardening-Double-Gudhal-Hibiscus/dp/B09VDDSDV8/ref=sr_1_803?qid=1679213608&s=garden&sr=1-803,2.6,14,₹255,₹933
"Swingzy Cotton Netted Rope Hanging Swing Chair for Adults/Swing for Balcony/Outdoor Swing Chair/Hammock Swing for Home, Pa...",home & kitchen,Garden & Outdoors,https://m.media-amazon.com/images/I/71G9qw7kKWL._AC_UL320_.jpg,https://www.amazon.in/Swingzy-Hanging-Capacity-Accessories-Included/dp/B099WZV4K4/ref=sr_1_804?qid=1679213608&s=garden&sr=1-804,3.8,506,₹999,"₹3,490"
"Kraft Seeds Garden Tool Kit - 9 Pcs (Weeder, Trowels, Hand Fork, Cultivator, Scissors, Pruner, Gardening Hand Gloves, Spra...",home & kitchen,Garden & Outdoors,https://m.media-amazon.com/images/I/71jM6l2E3PL._AC_UL320_.jpg,https://www.amazon.in/Kraft-Seeds-Garden-Scissors-Comfortable/dp/B09CQ8VGTC/ref=sr_1_805?qid=1679213608&s=garden&sr=1-805,4.4,227,₹494,₹549
Topinon Mouse Insect Rodent Lizard Trap Rat Catcher Adhesive Sticky Glue Pad - Non Poisonous - Non Toxic - Odourless - Rat...,home & kitchen,Garden & Outdoors,https://m.media-amazon.com/images/I/812C+gA866L._AC_UL320_.jpg,https://www.amazon.in/Topinon-Insect-Rodent-Catcher-Adhesive/dp/B0BPY6CXDF/ref=sr_1_806?qid=1679213608&s=garden&sr=1-806,5.0,3,₹345,₹899
"Leafy Tales Hanging Flower Pot Holder Railing Potted Plant Stand for Home Balcony Décor, Black, Set of 2 (Metal Basket-2)",home & kitchen,Garden & Outdoors,https://m.media-amazon.com/images/I/71DvzBFGG1L._AC_UL320_.jpg,https://www.amazon.in/Leafy-Tales-Hanging-Metal-Basket-2/dp/B09C1YPHYT/ref=sr_1_807?qid=1679213608&s=garden&sr=1-807,4.3,305,,₹375
Namo Organics - Halim Seeds ( Aliv Seeds For Eating ) - 400 Gm - Protein Rich Garden Cress Seeds for Hair Growth,home & kitchen,Garden & Outdoors,https://m.media-amazon.com/images/I/71JOTcggzeL._AC_UL320_.jpg,https://www.amazon.in/Namo-Organics-Halim-Seeds-Organic/dp/B08F3VH829/ref=sr_1_808?qid=1679213608&s=garden&sr=1-808,4.1,"1,964",₹198,₹249
"PESTERO Herbal Ant Repellent | Room Spray | Completely Herbal | Ant Repellent Spray | Made with Lemongrass, Cedarwood & Ne...",home & kitchen,Garden & Outdoors,https://m.media-amazon.com/images/I/71mYeOQu5fL._AC_UL320_.jpg,https://www.amazon.in/Repellent-Completely-Lemongrass-Cedarwood-Eco-friendly/dp/B0BSS41KT6/ref=sr_1_809?qid=1679213608&s=garden&sr=1-809,4.7,43,₹399,₹799
Phulwa Lucky Bamboo 2 layers Indoor Plant for Feng Shui (Lucky bambo 2 layers square glass pot),home & kitchen,Garden & Outdoors,https://m.media-amazon.com/images/I/41sMSMpN33L._AC_UL320_.jpg,https://www.amazon.in/Phulwa-Bamboo-layers-Indoor-square/dp/B0BSV1X39Q/ref=sr_1_810?qid=1679213608&s=garden&sr=1-810,5.0,2,₹269,₹749
Bayer Premise SC Termite Control use for Pre- Construction and Post Construction - 250ml,home & kitchen,Garden & Outdoors,https://m.media-amazon.com/images/I/51DYm3J4UqL._AC_UL320_.jpg,https://www.amazon.in/Bayer-Premise-250ml-Construction-Contruction/dp/B071XXKFQV/ref=sr_1_811_mod_primary_new?qid=1679213608&s=garden&sbo=RZvfv%2F%2FHxDF%2BO5021pAnSA%3D%3D&sr=1-811,4.4,507,₹900,"₹1,000"
TrustBasket Round Railing Pots with Polka Dots (Pack of 5) - (Multicolour) Dotted Railing Metal Planters for Balcony and H...,home & kitchen,Garden & Outdoors,https://m.media-amazon.com/images/I/71dx4RHcY3L._AC_UL320_.jpg,https://www.amazon.in/Trust-basket-Single-Railing-Planter/dp/B01DXMFC8G/ref=sr_1_812?qid=1679213608&s=garden&sr=1-812,4.4,"3,142",₹789,₹799
"LUHI Mosquito Net Double Bed Nets for King Size Foldable Mosquitoes Net with Adults Child Maskito, 3 Pair Saviours, Mosqui...",home & kitchen,Garden & Outdoors,https://m.media-amazon.com/images/I/71S0NyffxZL._AC_UL320_.jpg,https://www.amazon.in/LUHI-Mosquito-Net-Double-Bed/dp/B0BYDS6PL4/ref=sr_1_813?qid=1679213608&s=garden&sr=1-813,,,₹699,"₹1,999"
"Yellow Sticky Trap for Insects in The Garden & Farm, Glue Trap/ Fly Trap/Insect Trap/Sticky Pads for Whiteflies, Thrips, A...",home & kitchen,Garden & Outdoors,https://m.media-amazon.com/images/I/71Q5gTqrlgL._AC_UL320_.jpg,https://www.amazon.in/Yellow-Sticky-Insects-Whiteflies-Harmful/dp/B0BT1K3SDZ/ref=sr_1_814?qid=1679213608&s=garden&sr=1-814,5.0,1,₹199,₹300
Jakmister 3in1-900W-Variiable Speed Water Blower/Sanitizer Machine/ Vacuum Cleaner/ Paint Sprayer/Air Blower Machine Dust ...,home & kitchen,Garden & Outdoors,https://m.media-amazon.com/images/I/61uxbNDSybL._AC_UL320_.jpg,https://www.amazon.in/Jakmister-3in1-900W-Variiable-Anti-Vibration-Unbreakable-Multi-Purpose/dp/B09DWBSXXN/ref=sr_1_815?qid=1679213608&s=garden&sr=1-815,3.5,349,"₹1,050","₹3,200"
"Go Garden Fertilizer for Abundant Flowering and Plant Growth, 100% Water Soluble, Large 400Gm Pack (NPK 15 15 15 Complex)",home & kitchen,Garden & Outdoors,https://m.media-amazon.com/images/I/81fBXwhpbXL._AC_UL320_.jpg,https://www.amazon.in/Trendz-Handpicked-Fertilizer-Abundant-Flowering/dp/B075KRVCX2/ref=sr_1_816?qid=1679213608&s=garden&sr=1-816,4.0,628,₹209,₹399
"Kyari.co Kyari Metal Golden Print Pot with Stand for Home Decoration/Living Room/Balcony - Design2, Pack of 1",home & kitchen,Garden & Outdoors,https://m.media-amazon.com/images/W/IMAGERENDERING_521856-T2/images/I/716E9o9lYtL._AC_UL320_.jpg,https://www.amazon.in/Kyari-Golden-Decoration-Living-Balcony/dp/B09SLTDWRG/ref=sr_1_865?qid=1679213610&s=garden&sr=1-865,4.4,208,₹399,₹699
"SYGA Fruit Picker Head Basket or Fruit Picking Tools, Fruits Catcher for Harvest Picking Apple Citrus,Pear,Peach, etc",home & kitchen,Garden & Outdoors,https://m.media-amazon.com/images/W/IMAGERENDERING_521856-T2/images/I/51LuXsUt53L._AC_UL320_.jpg,https://www.amazon.in/Picker-Basket-Picking-Catcher-Harvest/dp/B07N1JF426/ref=sr_1_866?qid=1679213610&s=garden&sr=1-866,4.2,496,₹299,₹550
"amiciSense Digital Hygrometer Thermometer, AS-55 Temperature and Humidity Monitoring Weather Station with Clock and 2xAAA ...",home & kitchen,Garden & Outdoors,https://m.media-amazon.com/images/W/IMAGERENDERING_521856-T2/images/I/612Y1T55M7L._AC_UL320_.jpg,https://www.amazon.in/amiciSense-Touchscreen-Temperature-Hygrometer-Thermometer/dp/B07K7MRJDV/ref=sr_1_867?qid=1679213610&s=garden&sr=1-867,4.3,426,"₹1,781.01","₹2,500"
"Decorlily 2 Lucky Bamboo Plant with Big Round Glass Bowl and Colored Jelly Balls (Pack of 1, Green)",home & kitchen,Garden & Outdoors,https://m.media-amazon.com/images/W/IMAGERENDERING_521856-T2/images/I/61oxW6enjWL._AC_UL320_.jpg,https://www.amazon.in/Decorlily-Lucky-Bamboo-Plant-Colored/dp/B0BQFFP1GT/ref=sr_1_868?qid=1679213610&s=garden&sr=1-868,3.2,4,₹195,₹299
Dime Store Plant Stand Flower Pot Stand for Balcony Living Room Outdoor Indoor Plants Plant Holder Home Decor Item (Plante...,home & kitchen,Garden & Outdoors,https://m.media-amazon.com/images/W/IMAGERENDERING_521856-T2/images/I/612JaYn-t3L._AC_UL320_.jpg,https://www.amazon.in/Dime-Store-Balcony-Outdoor-Planter/dp/B08VHLVCR9/ref=sr_1_869?qid=1679213610&s=garden&sr=1-869,3.8,"1,429",₹885,"₹1,499"
Going Greens Rootex Rooting Hormone Powder for All Plants (25 GM),home & kitchen,Garden & Outdoors,https://m.media-amazon.com/images/W/IMAGERENDERING_521856-T2/images/I/61jOY+Ym58S._AC_UL320_.jpg,https://www.amazon.in/Going-Greens-Rootex-Rooting-Hormone/dp/B07PQKXRP8/ref=sr_1_870?qid=1679213610&s=garden&sr=1-870,3.5,960,₹115,₹120
ORCHID ENGINEERS Flower pot stand | Gamla stand | Plant stand for balcony | Pot stand for indoor plants | planter stand | ...,home & kitchen,Garden & Outdoors,https://m.media-amazon.com/images/W/IMAGERENDERING_521856-T2/images/I/71xCtnI-HEL._AC_UL320_.jpg,https://www.amazon.in/ORCHID-ENGINEERS-Plant-Indoor-Living/dp/B09G5595HL/ref=sr_1_871?qid=1679213610&s=garden&sr=1-871,4.2,557,₹849,₹999
"Kraft Seeds Fleshy Flower Pots With Bottom Trays (Pack of 6, Multicolour) Planters for Plants With Drainage Plate |Flower ...",home & kitchen,Garden & Outdoors,https://m.media-amazon.com/images/W/IMAGERENDERING_521856-T2/images/I/51IR2FOxj5L._AC_UL320_.jpg,https://www.amazon.in/Kraft-Seeds-Seedlings-Colourful-Container/dp/B086KCDGM9/ref=sr_1_872?qid=1679213610&s=garden&sr=1-872,4.3,"3,195",₹649,₹699
Kraft Seeds Fresh Vegetable Seeds for Home Gardening (3gm each )Vegetable Seeds for Outdoors | Gardening Planting Seeds fo...,home & kitchen,Garden & Outdoors,https://m.media-amazon.com/images/W/IMAGERENDERING_521856-T2/images/I/71G277+JN8L._AC_UL320_.jpg,https://www.amazon.in/Kraft-Seeds-Vegetable-Multicolor-KSVEG30SC/dp/B09FLSRFQ1/ref=sr_1_873?qid=1679213610&s=garden&sr=1-873,3.6,94,,₹175
"Kraft Seeds Gardening Gloves (2 Pairs, Free Size) | Washable Gardening Hand Gloves | Soft and Reusable Gloves for Gardenin...",home & kitchen,Garden & Outdoors,https://m.media-amazon.com/images/W/IMAGERENDERING_521856-T2/images/I/71XSrW1aJjL._AC_UL320_.jpg,https://www.amazon.in/Kraft-Seeds-Free-Gardening-Gloves/dp/B09MPBF1YY/ref=sr_1_874?qid=1679213610&s=garden&sr=1-874,3.8,25,₹149,₹199
"VOZICA International Eco Friendly Electronic LED Mosquito Killer Machine Trap Lamp, Theory Screen Protector Mosquito Kille...",home & kitchen,Garden & Outdoors,https://m.media-amazon.com/images/W/IMAGERENDERING_521856-T2/images/I/616ejMUpcAL._AC_UL320_.jpg,https://www.amazon.in/International-Electronic-Mosquito-Killer-Lamp/dp/B0B5V8FZW6/ref=sr_1_875?qid=1679213610&s=garden&sr=1-875,2.2,6,₹699,"₹2,999"
HASTHIP® 15pcs Plant Stakes Wire Plant Stake Flower Support Stake Rings Plant Support Sticks for Phalaenopsis Orchid Singl...,home & kitchen,Garden & Outdoors,https://m.media-amazon.com/images/W/IMAGERENDERING_521856-T2/images/I/612vIbKILDL._AC_UL320_.jpg,https://www.amazon.in/HASTHIP%C2%AE-Support-Phalaenopsis-Flowers-Amaryllis/dp/B09YYGXFQV/ref=sr_1_876?qid=1679213610&s=garden&sr=1-876,2.9,36,₹375,₹525
"H&B Men's Jute Tiffin Bags with zip for lunch (Medium Size, Print: Dine 3, Beige, Size: 11x9x6 Inch).",home & kitchen,Garden & Outdoors,https://m.media-amazon.com/images/W/IMAGERENDERING_521856-T2/images/I/71TYi4KAevL._AC_UL320_.jpg,https://www.amazon.in/Jute-Bag-Tiffin-office-11x9x6/dp/B01NAGVPP1/ref=sr_1_877?qid=1679213610&s=garden&sr=1-877,4.1,"2,288",₹269,₹499
Home-Secure Snake Shield Non-Toxic Snake Repellent Powder | Non Toxic Snake Repellent | Snake Repellent for Outdoors | Sna...,home & kitchen,Garden & Outdoors,https://m.media-amazon.com/images/W/IMAGERENDERING_521856-T2/images/I/71cT6jz5cAL._AC_UL320_.jpg,https://www.amazon.in/Snake-Shield-Snake-Shield-Non-Toxic-Repellent/dp/B08HSGJC3W/ref=sr_1_878?qid=1679213610&s=garden&sr=1-878,3.6,266,₹899,"₹2,499"
Babique CocoPeat 100% Organic Loose Ready to use Low EC for Indoor & Outdoor Plants & Home Gardening (1 Kg),home & kitchen,Garden & Outdoors,https://m.media-amazon.com/images/W/IMAGERENDERING_521856-T2/images/I/81b4WToKOeL._AC_UL320_.jpg,https://www.amazon.in/Babique-CocoPeat-Organic-Outdoor-Gardening/dp/B09WPS1GHP/ref=sr_1_879?qid=1679213610&s=garden&sr=1-879,3.2,171,₹57,₹499
Oncarnival Long Spout Watering Can for Indoor and Outdoor Plants (2L),home & kitchen,Garden & Outdoors,https://m.media-amazon.com/images/W/IMAGERENDERING_521856-T2/images/I/315199pmj8L._AC_UL320_.jpg,https://www.amazon.in/Oncarnival-Watering-Indoor-Outdoor-Plants/dp/B0BMV7T7S5/ref=sr_1_880?qid=1679213610&s=garden&sr=1-880,3.9,4,₹179,₹699
LEBONY Electric Insect Mosquito Killer Cum Night Lamp Insect Killer Mosquito Trapper Fly Trap Indoor Lamp for Indoor Home ...,home & kitchen,Garden & Outdoors,https://m.media-amazon.com/images/W/IMAGERENDERING_521856-T2/images/I/31BjiesxPUL._AC_UL320_.jpg,https://www.amazon.in/LEBONY-Electric-Mosquito-Trapper-Bedroom/dp/B0BVVL6KL7/ref=sr_1_881?qid=1679213610&s=garden&sr=1-881,3.0,2,₹269,₹999
"Rolling Nature Combo of Live Indoor Plants Jade, Aralia, Green Syngonium and Njoy Money plants in White Square Glacier Cer...",home & kitchen,Garden & Outdoors,https://m.media-amazon.com/images/W/IMAGERENDERING_521856-T2/images/I/81089thThzL._AC_UL320_.jpg,https://www.amazon.in/Rolling-Nature-Syngonium-Glacier-Ceramic/dp/B09G6SVS73/ref=sr_1_882?qid=1679213610&s=garden&sr=1-882,3.5,209,₹996,"₹2,999"
"Leafy Tales Moss Stick- Green Grass Pole for Plants Support, Moss Stick for Money Plant, Climbing Indoor Plants (Set of 4)...",home & kitchen,Garden & Outdoors,https://m.media-amazon.com/images/W/IMAGERENDERING_521856-T2/images/I/81eExDI+dQL._AC_UL320_.jpg,https://www.amazon.in/Leafy-Tales-Set-Mostick-Ft/dp/B09GLTGV5C/ref=sr_1_883?qid=1679213610&s=garden&sr=1-883,3.8,294,₹467,₹649
"Luminous Plastic Solar Charge Controller 10Amp - Blue, AS03",home & kitchen,Garden & Outdoors,https://m.media-amazon.com/images/W/IMAGERENDERING_521856-T2/images/I/71ZNx3OAPzL._AC_UL320_.jpg,https://www.amazon.in/Luminous-Plastic-Solar-Charge-Controller/dp/B016V6CPPY/ref=sr_1_884_mod_primary_new?qid=1679213610&s=garden&sbo=RZvfv%2F%2FHxDF%2BO5021pAnSA%3D%3D&sr=1-884,3.7,"1,054",₹439,"₹1,195"
