name,main_category,sub_category,image,link,ratings,no_of_ratings,discount_price,actual_price
DOMENICO Waterproof Colorful Children Bib Cute Cartoon Animals Baby Bibs Full Sleeve Children Apron Long Sleeve Feeding Bibs,toys & baby products,Nursing & Feeding,https://m.media-amazon.com/images/W/IMAGERENDERING_521856-T1/images/I/61Ne6OM4+4L._AC_UL320_.jpg,https://www.amazon.in/DOMENICO-Waterproof-Colorful-Children-Cartoon/dp/B09DPG6Q51/ref=sr_1_385?qid=1679220243&s=baby&sr=1-385,4.1,271,₹295,₹499
"Fisher-Price Baby's Food Mash and Serve Bowl Set (3 Months+, Blue and Red)",toys & baby products,Nursing & Feeding,https://m.media-amazon.com/images/W/IMAGERENDERING_521856-T1/images/I/51xbLqimAvL._AC_UL320_.jpg,https://www.amazon.in/Fisher-Price-Babys-Food-Serve-Months/dp/B07FZ2JDQT/ref=sr_1_386?qid=1679220243&s=baby&sr=1-386,4.4,"3,277",₹266,₹315
"Chicco Teat Perfect 5 with Anti-Colic Effect, Nipple For Wide Neck Feeding Bottles, Food Flow, For Babies 6m+ (Pack of 2)",toys & baby products,Nursing & Feeding,https://m.media-amazon.com/images/W/IMAGERENDERING_521856-T1/images/I/61NIbwFGfKL._AC_UL320_.jpg,https://www.amazon.in/Chicco-Teats-Perfect-Food-Nipple/dp/B084HLSDVH/ref=sr_1_387?qid=1679220243&s=baby&sr=1-387,4.4,"1,204",,₹299
Naughty Kidz Water Filled Soft Cooling Teether Bpa Free Specially Designed to Ease Teething,toys & baby products,Nursing & Feeding,https://m.media-amazon.com/images/W/IMAGERENDERING_521856-T1/images/I/71TAdjJePNL._AC_UL320_.jpg,https://www.amazon.in/Naughty-Kidz-BPA-free-Specially-Multicolour/dp/B07WV1KBK9/ref=sr_1_388?qid=1679220243&s=baby&sr=1-388,3.1,455,₹175,₹360
"Baybee Silicone Bottle Cleaning Brush for Baby Feeding Bottle, Hangable & Portable Cup Brush Cleaning Kit with Bottle Brus...",toys & baby products,Nursing & Feeding,https://m.media-amazon.com/images/W/IMAGERENDERING_521856-T1/images/I/71s2EhnR8DL._AC_UL320_.jpg,https://www.amazon.in/Silicone-Cleaning-Feeding-Hangable-Portable/dp/B09DFTMHKF/ref=sr_1_389?qid=1679220243&s=baby&sr=1-389,4.1,746,₹329,₹429
"BeeBaby Apple Fruit Shape Soft Silicone Teether for 3-6 Months with Carrying Case, BPA Free Teething Toy for Babies with T...",toys & baby products,Nursing & Feeding,https://m.media-amazon.com/images/W/IMAGERENDERING_521856-T1/images/I/61iKqT2Ki2L._AC_UL320_.jpg,https://www.amazon.in/Silicone-Carrying-Teething-Textured-Soothing/dp/B0B32R7BFY/ref=sr_1_390?qid=1679220243&s=baby&sr=1-390,4.1,"1,568",₹141,₹249
"Baybee 5 in 1 Baby Bottle Warmer & Sterilizer |Electric Baby Food,Water & Milk Heater & Defrost with Manual Temperature Ad...",toys & baby products,Nursing & Feeding,https://m.media-amazon.com/images/W/IMAGERENDERING_521856-T1/images/I/61q3q1WHTPL._AC_UL320_.jpg,https://www.amazon.in/Sterilizer-Electric-Defrost-Temperature-Display/dp/B08LQKW1YT/ref=sr_1_391?qid=1679220243&s=baby&sr=1-391,4.0,579,"₹1,699","₹2,299"
"Luv Lap Silicone Baby Teether for 3months+ baby, Teething and chewing Toys for babies with Hygienic Carrying case, 3m+, BP...",toys & baby products,Nursing & Feeding,https://m.media-amazon.com/images/W/IMAGERENDERING_521856-T1/images/I/71lHYWyqm0L._AC_UL320_.jpg,https://www.amazon.in/LuvLap-Silicone-Teether-Bottle-Light/dp/B07VYTVWBK/ref=sr_1_392_mod_primary_new?qid=1679220243&s=baby&sbo=RZvfv%2F%2FHxDF%2BO5021pAnSA%3D%3D&sr=1-392,4.1,"11,419",₹230,₹249
"Luvlap Anti-Colic Natura Flo Teat/Nipple for Wide Neck Bottle, 4pcs, Medium Flow, 3m+",toys & baby products,Nursing & Feeding,https://m.media-amazon.com/images/W/IMAGERENDERING_521856-T1/images/I/81rrbSy2QBL._AC_UL320_.jpg,https://www.amazon.in/LuvLap-Anti-Colic-Natura-Nipple-Bottle/dp/B08FT2K6WF/ref=sr_1_393?qid=1679220243&s=baby&sr=1-393,4.2,"3,262",,₹190
KRADYL KROFT 5in1 Baby Feeding Pillow with Detachable Cover (Pythagoras) KK5in1-229,toys & baby products,Nursing & Feeding,https://m.media-amazon.com/images/W/IMAGERENDERING_521856-T1/images/I/71ozehh+14L._AC_UL320_.jpg,https://www.amazon.in/Kradyl-Kroft-Detachable-Pythagoras-KK5in1-229/dp/B07BZK8P3T/ref=sr_1_394?qid=1679220243&s=baby&sr=1-394,4.3,"10,471","₹1,049","₹2,199"
GNR Tilismi Moti for Babies Oral Health Care - 2 Piece,toys & baby products,Nursing & Feeding,https://m.media-amazon.com/images/W/IMAGERENDERING_521856-T1/images/I/5147+XYX0fL._AC_UL320_.jpg,https://www.amazon.in/Tilismi-Moti-babies-oral-health/dp/B08KS2TYZ8/ref=sr_1_395?qid=1679220243&s=baby&sr=1-395,4.0,179,₹149,₹199
"Luv Lap Silicone 2 in 1 Baby Soother, Pacifier & Teether with Textured Surface & Round Handle, Air Holes for Safety, Anti ...",toys & baby products,Nursing & Feeding,https://m.media-amazon.com/images/W/IMAGERENDERING_521856-T1/images/I/61I3D0QzgdL._AC_UL320_.jpg,https://www.amazon.in/Silicone-Soother-Pacifier-Textured-Mechanism/dp/B09PHS8D1W/ref=sr_1_396?qid=1679220243&s=baby&sr=1-396,2.9,123,₹269,₹339
"BeeBaby Fingers Teethers for 6 to 12 Months BPA Free. Cooling Water Filled Baby Teether, Soft Teething Toy for Babies with...",toys & baby products,Nursing & Feeding,https://m.media-amazon.com/images/W/IMAGERENDERING_521856-T1/images/I/71rJ7CYbTpL._AC_UL320_.jpg,https://www.amazon.in/BeeBaby-Fingers-Teethers-Cooling-Teething/dp/B09XJ42911/ref=sr_1_397?qid=1679220243&s=baby&sr=1-397,3.8,246,₹89.40,₹149
"Munchkin Miracle 360 Trainer Cup, 7 Ounce, 2 Count (Green/Blue)",toys & baby products,Nursing & Feeding,https://m.media-amazon.com/images/W/IMAGERENDERING_521856-T1/images/I/61szZg7FZ1L._AC_UL320_.jpg,https://www.amazon.in/Munchkin-Miracle-Trainer-Ounce-Count/dp/B00MRZIFD0/ref=sr_1_398?qid=1679220243&s=baby&sr=1-398,4.7,"44,365","₹1,495","₹1,598"
"Real Baby Pure Cotton Bibs Multicolored (0-2 Years, Pack of 6)",toys & baby products,Nursing & Feeding,https://m.media-amazon.com/images/W/IMAGERENDERING_521856-T1/images/I/91ix2JKM4qS._AC_UL320_.jpg,https://www.amazon.in/Real-Baby-Cotton-Multicolored-Years/dp/B089G1LTLH/ref=sr_1_399?qid=1679220243&s=baby&sr=1-399,4.2,"1,004",₹470,"₹1,299"
"LuvLap 4 Piece Baby Tableware Meal Set, Plate, Bowl, Tumbler and Spoon for Infants & Kids, Attractive Colours, Non Toxic, ...",toys & baby products,Nursing & Feeding,https://m.media-amazon.com/images/W/IMAGERENDERING_521856-T1/images/I/61Pw5IaGSUL._AC_UL320_.jpg,https://www.amazon.in/Tableware-Tumbler-Infants-Attractive-Colours/dp/B09N8PYMTD/ref=sr_1_400?qid=1679220243&s=baby&sr=1-400,4.3,166,₹449,₹549
Breast Milk Storage Bags - 24 Bags,toys & baby products,Nursing & Feeding,https://m.media-amazon.com/images/W/IMAGERENDERING_521856-T1/images/I/7117SdGMcWL._AC_UL320_.jpg,https://www.amazon.in/Breast-Milk-Storage-Bags-24/dp/B09SPRZ4CJ/ref=sr_1_401?qid=1679220243&s=baby&sr=1-401,4.5,451,₹379,₹399
SYGA 3 Layer Cute Bear Portable Baby Food Milk Powder Storage Box Bottle Container_Purple (Design May Very),toys & baby products,Nursing & Feeding,https://m.media-amazon.com/images/W/IMAGERENDERING_521856-T1/images/I/514drs5S3UL._AC_UL320_.jpg,https://www.amazon.in/Portable-Powder-Storage-Bottle-Container_Purple/dp/B07VDRV8TX/ref=sr_1_402?qid=1679220243&s=baby&sr=1-402,4.3,326,₹249,₹550
"Munchkin Miracle 360 Cup Colors May Vary, 7 oz",toys & baby products,Nursing & Feeding,https://m.media-amazon.com/images/W/IMAGERENDERING_521856-T1/images/I/51RKn-ZTuoL._AC_UL320_.jpg,https://www.amazon.in/Munchkin-Miracle-360-Colors-Vary/dp/B00OBT466A/ref=sr_1_403?qid=1679220243&s=baby&sr=1-403,4.3,"6,429",₹549,₹599
"Mee Mee BPA Free, Easy Grip 360 Trainer Sipper Cup for Babies/Toddlers/Kids with Soft Silicone Rim/Ergonomic Design (240m...",toys & baby products,Nursing & Feeding,https://m.media-amazon.com/images/W/IMAGERENDERING_521856-T1/images/I/415taPdK-qL._AC_UL320_.jpg,https://www.amazon.in/Mee-Resistant-Spout-Sipper-Green/dp/B07HMF7GTP/ref=sr_1_404?qid=1679220243&s=baby&sr=1-404,4.2,"3,950",₹299,₹399
"R for Rabbit Baby Tusky Pacifier Ultra Light Soft Silicone Nipple, Orthodontic Design, BPA-Free for Kids of 6 Months +|Med...",toys & baby products,Nursing & Feeding,https://m.media-amazon.com/images/W/IMAGERENDERING_521856-T1/images/I/510CD0YhmlL._AC_UL320_.jpg,https://www.amazon.in/Rabbit-Pacifier-Silicone-Orthodontic-BPA-Free/dp/B09HXTTVQP/ref=sr_1_405?qid=1679220243&s=baby&sr=1-405,4.0,387,₹251,₹297
SYGA Foldable Baby Bottle Drying Racks Feeding Cup Nipple Storage Shelf Stand Holder (Green),toys & baby products,Nursing & Feeding,https://m.media-amazon.com/images/W/IMAGERENDERING_521856-T1/images/I/51FBKOY18WL._AC_UL320_.jpg,https://www.amazon.in/Foldable-Bottle-Drying-Feeding-Storage/dp/B07MXGZ1QW/ref=sr_1_406?qid=1679220243&s=baby&sr=1-406,4.4,"1,070",₹190,₹550
"BEEBABY Free-Flow, Hard Spout Sipper for Kids, Twin Handle Sippy Cup for Easy Grip, 100% BPA Free, Leak Proof Baby Sipper ...",toys & baby products,Nursing & Feeding,https://m.media-amazon.com/images/W/IMAGERENDERING_521856-T1/images/I/51MqrL4qwfL._AC_UL320_.jpg,https://www.amazon.in/Beebaby-Handle-Spout-Sipper-Violet/dp/B07MD8SVLC/ref=sr_1_407?qid=1679220243&s=baby&sr=1-407,3.8,"1,146",₹110,₹179
VGRASSP Unicorn Family Baby Spoon and Fork Cutlery for Babies and Kids - Stainless Steel (304) Tableware Set with Comforta...,toys & baby products,Nursing & Feeding,https://m.media-amazon.com/images/W/IMAGERENDERING_521856-T1/images/I/71maUt86GsL._AC_UL320_.jpg,https://www.amazon.in/VGRASSP-Stainless-Unicorn-Family-Cutlery/dp/B08WKNS7RK/ref=sr_1_408?qid=1679220243&s=baby&sr=1-408,4.5,250,₹299,₹999
"SMIC Manual Baby Feeding Bottle Electric Steam Sterilizer & Warmer for Bottles, Pacifiers, Cups, Toys, Teethers & Other Ac...",toys & baby products,Nursing & Feeding,https://m.media-amazon.com/images/I/31H1nyAqdxL._AC_UL320_.jpg,https://www.amazon.in/SMIC-Sterilizer-Pacifiers-Accessories-Measuring/dp/B0BR41Q4QD/ref=sr_1_865?qid=1679220249&s=baby&sr=1-865,3.1,2,₹849,"₹1,599"
"Chicco Well-Being 250 ml Feeding Bottle, Advanced Anti-Colic System, BPA Free, Hygienic Silicone Teat (Blue)",toys & baby products,Nursing & Feeding,https://m.media-amazon.com/images/I/61nLvBblVbS._AC_UL320_.jpg,https://www.amazon.in/Chicco-Well-Being-Advanced-Anti-Colic-Hygienic/dp/B0929H43RR/ref=sr_1_866?qid=1679220249&s=baby&sr=1-866,4.4,748,,₹299
THE LITTLE LOOKERS Bottle Cover for Philips Avent/Wide Neck Feeders Soft Plush Stretchable Baby Feeding Bottle Cover with ...,toys & baby products,Nursing & Feeding,https://m.media-amazon.com/images/I/616WHIUoxVL._AC_UL320_.jpg,https://www.amazon.in/LITTLE-LOOKERS-Philips-Feeders-Stretchable/dp/B09C4JCM27/ref=sr_1_867?qid=1679220249&s=baby&sr=1-867,4.4,19,₹254,₹499
"Chicco Natural Feeling Teat with Anti-Colic Effect, Angled Nipple for Wide Neck Natural Feeling Bottles, Regular & Slow Fl...",toys & baby products,Nursing & Feeding,https://m.media-amazon.com/images/I/61efx+f+yML._AC_UL320_.jpg,https://www.amazon.in/Chicco-Regular-Natural-Feeling-White/dp/B00GN5W3V0/ref=sr_1_868?qid=1679220249&s=baby&sr=1-868,4.0,468,₹298,₹299
THE LITTLE LOOKERS Soft Plush Stretchable Baby Feeding Bottle Cover with Easy to Hold Strap | Cute Animated Overall Print ...,toys & baby products,Nursing & Feeding,https://m.media-amazon.com/images/I/81NZ4VyiSvL._AC_UL320_.jpg,https://www.amazon.in/LITTLE-LOOKERS%C2%AE-Stretchable-Feeding-Suitable/dp/B084CSQVP8/ref=sr_1_869?qid=1679220249&s=baby&sr=1-869,4.3,196,₹242,₹449
"Dr. Brown's Preemie Flow Silicone Options Narrow Neck Nipple C (Pack of 2, White)",toys & baby products,Nursing & Feeding,https://m.media-amazon.com/images/I/619oQ+ByBCS._AC_UL320_.jpg,https://www.amazon.in/Browns-Preemie-Silicone-Options-Narrow-Neck/dp/B071HT38FD/ref=sr_1_870?qid=1679220249&s=baby&sr=1-870,4.3,106,₹474,₹549
Dr. Brown's Milk Powder Dispenser (Blue)(Pack of 1),toys & baby products,Nursing & Feeding,https://m.media-amazon.com/images/I/61DHQU2ThTL._AC_UL320_.jpg,https://www.amazon.in/Dr-Browns-Milk-Powder-Dispenser/dp/B013RCJEDQ/ref=sr_1_871_mod_primary_new?qid=1679220249&s=baby&sbo=RZvfv%2F%2FHxDF%2BO5021pAnSA%3D%3D&sr=1-871,4.5,620,₹474,₹499
"Pigeon Peristaltic Nipple S,For 0+ Month Babies,BPS Free,BPA Free",toys & baby products,Nursing & Feeding,https://m.media-amazon.com/images/I/51gkd11nSRS._AC_UL320_.jpg,https://www.amazon.in/Pigeon-Peristaltic-Nipple-Transparent-88118/dp/B08R3ZVDHY/ref=sr_1_872?qid=1679220249&s=baby&sr=1-872,4.4,280,,₹99
JUSTLIST Combo of Fruit Nibbler & Soother New Baby Food Pacifier Baby Nipple Feeder Silicone Pacifier Fruits Infant Feedin...,toys & baby products,Nursing & Feeding,https://m.media-amazon.com/images/I/61P7tDTA1vL._AC_UL320_.jpg,https://www.amazon.in/JUSTLIST-Pacifier-Silicone-Supplies-Multicolor/dp/B08XLS2BG3/ref=sr_1_873?qid=1679220249&s=baby&sr=1-873,3.5,15,₹249,₹399
Da Anushi Soft Cotton Washable & Reusable Multicolor Highly Absorbing/Comfortable and Easily Adjustable Feeding Bibs In Ap...,toys & baby products,Nursing & Feeding,https://m.media-amazon.com/images/I/81lw0boXJeL._AC_UL320_.jpg,https://www.amazon.in/Anushi-Multicolor-Absorbing-Comfortable-Adjustable/dp/B09C6G54R8/ref=sr_1_874?qid=1679220249&s=baby&sr=1-874,4.0,340,₹253,₹599
Mee Mee Soft Plush Stretchable Baby Feeding Bottle Cover with Cute Animated Overall Print (Pk-2) Multicolour,toys & baby products,Nursing & Feeding,https://m.media-amazon.com/images/I/51rieN+yHOL._AC_UL320_.jpg,https://www.amazon.in/Mee-Stretchable-Feeding-Animated-Multicolour/dp/B09VPJ47HT/ref=sr_1_875?qid=1679220249&s=baby&sr=1-875,3.3,43,₹191,₹199
"Mylo Essentials Feels Natural Baby Feeding Bottle, BPA Free with Anti-Colic Nipple, Slim Neck (Blue Elephant, 250ml)",toys & baby products,Nursing & Feeding,https://m.media-amazon.com/images/I/518oRgj+n8L._AC_UL320_.jpg,https://www.amazon.in/Mylo-Essentials-Natural-Anti-Colic-Elephant/dp/B09WVSTTHD/ref=sr_1_876?qid=1679220249&s=baby&sr=1-876,4.6,10,,₹179
"Goodmunchkins Stainless Steel Baby Feeding Bottle 304 Grade Steel for Infants/Toddlers Jointless, with Bottle Cleaning Bru...",toys & baby products,Nursing & Feeding,https://m.media-amazon.com/images/I/51dB5d1QQ4L._AC_UL320_.jpg,https://www.amazon.in/Goodmunchkins-Stainless-Toddlers-Jointless-Cleaning/dp/B0BH47SZ6M/ref=sr_1_877?qid=1679220249&s=baby&sr=1-877,4.3,28,,₹455
"Hopop Portable & Compact Baby Bottle Drying Rack with Detachable Water Drip Tray, White, Holds Upto 6 Bottles and Accessories",toys & baby products,Nursing & Feeding,https://m.media-amazon.com/images/I/61Yuf82cASL._AC_UL320_.jpg,https://www.amazon.in/Hopop-Portable-Compact-Bottle-Detachable/dp/B09WM1SVNB/ref=sr_1_878?qid=1679220249&s=baby&sr=1-878,4.7,18,₹950,₹999
"Dormyo Cradle Breast Feeding/Nursing Pillow (with Belt) Multifunction Pillow with 5 Different uses; 1 Year Warranty, Print...",toys & baby products,Nursing & Feeding,https://m.media-amazon.com/images/I/71hFVqcfw7L._AC_UL320_.jpg,https://www.amazon.in/Dormyo-Multifunction-Different-Resistant-Microfibre/dp/B09G1XDP7H/ref=sr_1_879?qid=1679220249&s=baby&sr=1-879,4.2,139,₹849,"₹1,999"
THE LITTLE LOOKERS Soft Plush Stretchable Baby Feeding Bottle Cover with Easy to Hold Strap | Cute Animated Overall Print ...,toys & baby products,Nursing & Feeding,https://m.media-amazon.com/images/I/81rHp4oZN-L._AC_UL320_.jpg,https://www.amazon.in/LITTLE-LOOKERS%C2%AE-Stretchable-Feeding-Suitable/dp/B07XXZGW1T/ref=sr_1_880?qid=1679220249&s=baby&sr=1-880,4.2,163,₹296,₹599
"FLIPZON Waterproof Baby Apron with Bib, Multicolor",toys & baby products,Nursing & Feeding,https://m.media-amazon.com/images/I/71Z2OMn81cL._AC_UL320_.jpg,https://www.amazon.in/FLIPZON-Waterproof-Baby-Apron-Multicolor/dp/B08XNPWMT8/ref=sr_1_881?qid=1679220249&s=baby&sr=1-881,4.2,145,₹199,₹599
Dr. Brown's Milk Powder Dispenser - Pink,toys & baby products,Nursing & Feeding,https://m.media-amazon.com/images/I/71bkB9U+HpL._AC_UL320_.jpg,https://www.amazon.in/Dr-Browns-Milk-Powder-Dispenser/dp/B013RCJEBI/ref=sr_1_882_mod_primary_new?qid=1679220249&s=baby&sbo=RZvfv%2F%2FHxDF%2BO5021pAnSA%3D%3D&sr=1-882,4.5,918,₹439,₹625
"St Stehlen Exclusive Bugs Bunny Design, Melamine Kids Set, 5-Pieces (1 x Plate, 1 x Bowl, 1 x Glass, 1 x Spoon, 1 x Fork )...",toys & baby products,Nursing & Feeding,https://m.media-amazon.com/images/I/71-bIT4MYfL._AC_UL320_.jpg,https://www.amazon.in/St-Stehlen-Exclusive-Melamine-5-Pieces/dp/B08R95HR96/ref=sr_1_883?qid=1679220249&s=baby&sr=1-883,4.2,95,₹463.20,₹579
CHILDCHIC 90ML Newborn Baby Feeding Bottle Toddler Silicone Squeeze Feeding Spoon Milk Cereal Training Feeder and Fruit Fe...,toys & baby products,Nursing & Feeding,https://m.media-amazon.com/images/I/51FPZ3AO33L._AC_UL320_.jpg,https://www.amazon.in/CHILDCHIC-Newborn-Feeding-Silicone-Training/dp/B09P3Z16K3/ref=sr_1_884?qid=1679220249&s=baby&sr=1-884,4.0,8,₹283,₹999
"HOOPA 2-in-1 Feeding Pillow Baby Pink | Feeding Pad | Infant Carrier | Newborn Carrier | Nursing Pad , Reclined Carrier (B...",toys & baby products,Nursing & Feeding,https://m.media-amazon.com/images/I/81YsNsqjc5L._AC_UL320_.jpg,https://www.amazon.in/HOOPA-Feeding-Carrier-Newborn-Reclined/dp/B09QZL1ZQ9/ref=sr_1_885?qid=1679220249&s=baby&sr=1-885,4.1,87,"₹1,640","₹1,800"
Philips Avent Natural Nipple Combo 3m+ Medium Flow Nipple (Pack of 2 Nipples),toys & baby products,Nursing & Feeding,https://m.media-amazon.com/images/I/61eCSiP8moL._AC_UL320_.jpg,https://www.amazon.in/Philips-Avent-Natural-Nipple-Nipples/dp/B0B6ZYGQQK/ref=sr_1_886?qid=1679220249&s=baby&sr=1-886,Get,Only 2 left in stock.,,₹670
CareVego Suction Plate for Babies & Toddlers | 100% Silicone | Plate Stay Put with Suction Feature | Divided Design | Micr...,toys & baby products,Nursing & Feeding,https://m.media-amazon.com/images/I/41X49k4A2JL._AC_UL320_.jpg,https://www.amazon.in/CareVego-Toddlers-Microwave-Dishwasher-Blue/dp/B0B4SBR8CG/ref=sr_1_887?qid=1679220249&s=baby&sr=1-887,3.6,19,₹599,₹999
Mee Mee Reusable Maternity Breast Pads | Washable Nursing Pads | Absorbent Comfort Fit Breast Pads | Leak Proof Coverage |...,toys & baby products,Nursing & Feeding,https://m.media-amazon.com/images/I/6132YnBg4SL._AC_UL320_.jpg,https://www.amazon.in/Mee-Washable-Cotton-Maternity-Breast/dp/B07BS9MPC2/ref=sr_1_888?qid=1679220249&s=baby&sr=1-888,3.9,"1,429",₹336,₹449
BeeBaby 2 in 1 Gentle Slim Neck Baby Feeding Bottle with Anti - Colic Gentle Touch Silicone Nipple and Feeder Spoon (Plast...,toys & baby products,Nursing & Feeding,https://m.media-amazon.com/images/I/71HeaWapxOL._AC_UL320_.jpg,https://www.amazon.in/BeeBaby-Gentle-Slim-Feeding-Bottle/dp/B0B32QPFQL/ref=sr_1_1057?qid=1679220253&s=baby&sr=1-1057,4.6,11,,₹250
"Dr. Brown's Narrow Neck Original Options Baby Bottle (250 ml, Pink)",toys & baby products,Nursing & Feeding,https://m.media-amazon.com/images/I/31-SaUzVtML._AC_UL320_.jpg,https://www.amazon.in/Dr-Browns-Narrow-Original-Options/dp/B07Z547GNC/ref=sr_1_1058?qid=1679220253&s=baby&sr=1-1058,5.0,2,,₹799
"SLICKFIX Sports Nipple Covers for Men's Anti-Chafing for Runners, Nipple Tape, Nip Protectors, Nipple Stickers,",toys & baby products,Nursing & Feeding,https://m.media-amazon.com/images/I/51cGYQlBDEL._AC_UL320_.jpg,https://www.amazon.in/Slickfix-Sports-Nipple-Covers-Pack/dp/B08SBWWCBV/ref=sr_1_1059?qid=1679220253&s=baby&sr=1-1059,3.6,55,₹399,₹720
Bowiemall Ultra-Light Silicone Baby Pacifier Nipple Shape Helps Promote Healthy Oral Development (Blue),toys & baby products,Nursing & Feeding,https://m.media-amazon.com/images/I/41wmsWMEN+L._AC_UL320_.jpg,https://www.amazon.in/Bowiemall-Ultra-Light-Silicone-Pacifier-Development/dp/B0BXGZBHQW/ref=sr_1_1060?qid=1679220253&s=baby&sr=1-1060,,,₹199,₹999
"Baybee 6 in 1 Baby Bottle Warmer & Sterilizer | Electric Baby Food, Water & Milk Heater & Defrost with LCD Temperature Dis...",toys & baby products,Nursing & Feeding,https://m.media-amazon.com/images/I/61HX5BpGsBL._AC_UL320_.jpg,https://www.amazon.in/Sterilizer-Electric-Defrost-Temperature-Display/dp/B08LQDP6LR/ref=sr_1_1061?qid=1679220253&s=baby&sr=1-1061,4.0,579,"₹3,599","₹3,999"
Teri Beri BPA-Free Non Toxic Toddler and Infant Baby Tooth Sooter Teether Keys Teething Toys for Baby Toy Textured Silicon...,toys & baby products,Nursing & Feeding,https://m.media-amazon.com/images/I/31Yuz737HQL._AC_UL320_.jpg,https://www.amazon.in/Teri-Beri-BPA-Free-Teething-Textured/dp/B08T1VGJJV/ref=sr_1_1062?qid=1679220253&s=baby&sr=1-1062,3.6,153,₹199,₹800
"BeeBaby Strawberry Fruit Shape Soft Silicone Teether for 3-6 Months with Carry Case, BPA Free Teething Toy for Babies with...",toys & baby products,Nursing & Feeding,https://m.media-amazon.com/images/I/51NRoME7SdL._AC_UL320_.jpg,https://www.amazon.in/Strawberry-Silicone-Teething-Textured-Soothing/dp/B0B32VHZCW/ref=sr_1_1063?qid=1679220253&s=baby&sr=1-1063,4.1,"1,568",₹141,₹249
"ZoZoBaa Silicone Baby Feeding & Weaning Bib with Easy Grip Spoon|Waterproof,Washable & Reusable,Adjustable Bib with button...",toys & baby products,Nursing & Feeding,https://m.media-amazon.com/images/I/61XGboAzkwL._AC_UL320_.jpg,https://www.amazon.in/ZoZoBaa-Silicone-Waterproof-Adjustable-Comfortable/dp/B0B4JHH23T/ref=sr_1_1064?qid=1679220253&s=baby&sr=1-1064,4.8,36,₹398,"₹1,999"
"THE LITTLE LOOKERS Silicone Feeding Bib with Adjustable Strap, Waterproof, Easy to wash, Stain Proof | BPA Free/Soft Mater...",toys & baby products,Nursing & Feeding,https://m.media-amazon.com/images/I/61QUws4zBvL._AC_UL320_.jpg,https://www.amazon.in/LITTLE-LOOKERS-Silicone-Adjustable-Waterproof/dp/B09HGKTH52/ref=sr_1_1065?qid=1679220253&s=baby&sr=1-1065,4.1,73,₹213,₹399
BEEBABY Free Flow Twin Handle Hard Spout Sippy Cup/Sipper 180 ML / 6 oz. 100% BPA Free | Leak Proof. (Light Blue) (6M+),toys & baby products,Nursing & Feeding,https://m.media-amazon.com/images/I/614uiWtg7wL._AC_UL320_.jpg,https://www.amazon.in/Beebaby-Handle-Sipper-Single-Colour/dp/B07SBW9HZW/ref=sr_1_1066?qid=1679220253&s=baby&sr=1-1066,3.8,"1,146",₹113,₹159
GUCHIGU Mini Cup + Straw Training System - 100% Silicone Training Cup for Infants + Toddlers | Reusable Portable Baby Sipp...,toys & baby products,Nursing & Feeding,https://m.media-amazon.com/images/I/41T5QGSVmfL._AC_UL320_.jpg,https://www.amazon.in/GUCHIGU-Mini-Straw-Training-System/dp/B0B4B1K227/ref=sr_1_1067?qid=1679220253&s=baby&sr=1-1067,Get,FREE Delivery by Amazon,₹499,₹798
"KOOCHIE-KOO Plastic One Touch Open Cute Lion Printed Handy Transparent Sippy Cup Bottle with Handle, Straw and Strap For K...",toys & baby products,Nursing & Feeding,https://m.media-amazon.com/images/I/7191+KKZQWL._AC_UL320_.jpg,https://www.amazon.in/Koochie-Koo-Sipper-Toddlers-Handles-Free-400/dp/B08C4PKBQJ/ref=sr_1_1068?qid=1679220253&s=baby&sr=1-1068,3.9,135,₹369,₹599
Nestle Nido Fortified Full Cream Milk Powder (1Years and Above) -2500 g,toys & baby products,Nursing & Feeding,https://m.media-amazon.com/images/I/51nqWcP-N5S._AC_UL320_.jpg,https://www.amazon.in/NESTLE-NIDO-FORTIFIED-CREAM-POWDER/dp/B01126WLDO/ref=sr_1_1069?qid=1679220253&s=baby&sr=1-1069,4.2,146,"₹3,450","₹4,500"
"Chicco Well-Being 150 ml Feeding Bottle, Advanced Anti-Colic System, BPA Free, Hygienic Silicone Teat (Green)",toys & baby products,Nursing & Feeding,https://m.media-amazon.com/images/I/51UpokrE0OS._AC_UL320_.jpg,https://www.amazon.in/Chicco-Well-Being-Advanced-Anti-Colic-Hygienic/dp/B0929LCH9B/ref=sr_1_1070_mod_primary_new?qid=1679220253&s=baby&sbo=RZvfv%2F%2FHxDF%2BO5021pAnSA%3D%3D&sr=1-1070,4.4,748,₹279,₹319
"Chicco Well-Being 250 ml Feeding Bottle, Advanced Anti-Colic System, BPA Free, Hygienic Silicone Teat (Green)",toys & baby products,Nursing & Feeding,https://m.media-amazon.com/images/I/51SRcxh1EwS._AC_UL320_.jpg,https://www.amazon.in/Chicco-Well-Being-Advanced-Anti-Colic-Hygienic/dp/B0929M3FQB/ref=sr_1_1071?qid=1679220253&s=baby&sr=1-1071,4.4,748,₹299,₹319
"Philips Avent Ultra Air Pacifier, 0-6 months, contemporary decos, blue/green, 2 pack, SCF344/20",toys & baby products,Nursing & Feeding,https://m.media-amazon.com/images/I/51po3VPFDLL._AC_UL320_.jpg,https://www.amazon.in/Philips-Avent-Contemporary-SCF344-20/dp/B07GQ1GHKV/ref=sr_1_1072?qid=1679220253&s=baby&sr=1-1072,4.2,102,,₹405
"Munchkin White Hot Infant Safety Spoons (Multicolor, Pack of 4)",toys & baby products,Nursing & Feeding,https://m.media-amazon.com/images/I/61vZQ6lVuZL._AC_UL320_.jpg,https://www.amazon.in/Munchkin-Infant-Safety-Spoons-Multicolor/dp/B00HZO5S4M/ref=sr_1_1073?qid=1679220253&s=baby&sr=1-1073,4.3,"8,113",₹429,₹499
"LuvLap Silicone Teether for 6 to 12 Months Baby / Toddler, Teething Toy for Infants and Babies, 100% Food Grade Silicone, ...",toys & baby products,Nursing & Feeding,https://m.media-amazon.com/images/I/61FEzR6Qq2L._AC_UL320_.jpg,https://www.amazon.in/Silicone-Teether-Toddler-Teething-Textured/dp/B0B4RW8K6S/ref=sr_1_1074?qid=1679220253&s=baby&sr=1-1074,4.1,"11,419",,₹449
a baby cherry - Baby Bib || 21st Century Bib || Waterproof Silicone Bib for Feeding Infants and Toddlers (6M to 5 Yr) || C...,toys & baby products,Nursing & Feeding,https://m.media-amazon.com/images/I/51TXSOvJr5L._AC_UL320_.jpg,https://www.amazon.in/Baby-Cherry-Waterproof-Silicone-Toddlers/dp/B07CRTXHWN/ref=sr_1_1075?qid=1679220253&s=baby&sr=1-1075,4.4,"1,827",₹789,₹999
"Fisher-Price Ultra Care Food Nibbler with Extra Mesh, Blue & Squeezy Silicone Food Feeder, Blue, 125ml",toys & baby products,Nursing & Feeding,https://m.media-amazon.com/images/I/41bij4HRRdL._AC_UL320_.jpg,https://www.amazon.in/Fisher-Price-Nibbler-Squeezy-Silicone-Feeder/dp/B088KV5QTX/ref=sr_1_1076?qid=1679220253&s=baby&sr=1-1076,4.1,"6,239",₹460,₹608
CHILDCHIC Teether for Baby 3-6 Month | 6 to 12 Months Baby Tooth Soother/Teething Toys for Baby (Assorted Color),toys & baby products,Nursing & Feeding,https://m.media-amazon.com/images/I/41A1d36cAZL._AC_UL320_.jpg,https://www.amazon.in/CHILDCHIC-Teether-Soother-Teething-Assorted/dp/B09X3799YN/ref=sr_1_1077?qid=1679220253&s=baby&sr=1-1077,3.9,4,₹176,₹499
